title,color,size
Zapatillas trail running Salomon Xa Enduro Hombre 41 1/3 Azul/Naranja,Azul/Naranja,41 1/3
BOLSO EXPEDICION 120 TRANGO ANTRACITA-NEGRO L Antracita,Antracita,L
"ATTIPAS - Attipas calzado los primeros pasos zoo azul 22,5 AZUL",AZUL,"22,5"
BOTAS CHIRUCA PANTICOSA 06 GORE-TEX GRIS 41 Gris,Gris,41
Mallas Sontress 1609 Mujer Negro M Negro,Negro,M
Pies de gato La Sportiva Mythos Terra 46.5 Tierra Oscura,Tierra Oscura,46.5
Botas Boreal Sherpa 40 Marron,Marron,40
Zapatillas La Sportiva Mutant Mujer Cieruela Manzana Verde 37 Cereza,Verde/Cereza,37
Pies de gato La Sportiva TC Pro 41.5 Crema,Crema,41.5
Botas Boreal Hurricane Verde 42 Verde,Verde,42
Sandalias De Descanso Salomon Rx Break Mujer Rosa 41 1/3 Rosa,Rosa,41 1/3
Pies de gato La Sportiva Finale Sulphur-Blue 46.5 Amarillo/Azul,Amarillo/Azul,46.5
Camiseta The North Face S/s Kcc Chest Tee Hombre Verde M Verde,Verde,M
Pies de gato La Sportiva Otaki Blue-Flame 43.5 Azul/Naranja,Azul/Naranja,43.5
Zapatillas Boreal Sendai Vent Verde 43 1/4 Verde,Verde,43 1/4
Zapatillas Nike Flex Experience Rn 7 Mujer Lobo Gris 39 Gris/blanco,Gris/Blanco,39
Zapatillas Running Nike Revolution 3 Hombre Azul Azul 43 Azul/azul,Azul/Azul,43
Zapatillas Hi-tec Sensor Trail Lite Hombre Negro Rojo 41 Negro/rojo,Negro/Rojo,41
Zapatillas Merrell Accentor Sport Goretex Mujer Uva Acuífero 38 Morado/azul,Morado/Azul,38
Zapatillas Nike Revolution 4 Eu Hombre Rojo 44 Rojo,Rojo,44
Zapatillas Salomon Sense Ride 2 Hombre Ilusión Azul 44 Azul,Azul,44
Pies de gato La Sportiva Miura Lime 37.5 Lima,Lima,37.5
Sandalias Chiruca Cartagena 05 Mujer Gris Morado 39 Gris,Gris,39
Pies de gato La Sportiva Solution mujer White-Lily Orange 37 Blanco/Naranja,Blanco/Naranja,37
Pies de gato La Sportiva Skwama mujer Apple Green-Cobalt Blue 39 Verde/Azul,Verde/Azul,39
Sandalias New Balance Cruiser K2013 Niños Negro Lima 30 Negro,Negro,30
Botas Boreal FLYERS MID 40 Gris/Amarillo,Gris/Amarillo,40
Botas Chiruca Xacobeo 12 GoreTex Hombre Marron 42 Marron,Marron,42
Botas La Sportiva Trango Trk Gtx Amarillo Negro 46.5 Amarillo/Negro,Amarillo/Negro,46.5
Botas De Montaña Salomon X Ultra 3 Mid Gtx Mujer Gris 41 1/3 Gris,Gris,41 1/3
Polaina Trangoworld Force Verde L Verde,Verde,L
Botas de Montaña Merrell Azura Mid Waterproof Mujer 37 Gris/Verde,Gris/Verde,37
Pantalones Breezy Tryn Hombre Negro Gris 2xl Negro/gris,Negro/Gris,2XL
Zapatillas New Balance Fresh Foam Cruz On Hombre Burdeos 41.5 Burdeos,Burdeos,41.5
BOTAS CHIRUCA DYNAMIC 52 GORE-TEX MARRON 39 Marron,Marron,39
Botas Chiruca Trofeo 01 GoreTex Pointer Hombre 41 Kaki,Kaki,41
Botas Chiruca Angliru 02 Goretex Hombre Marrón 43 Marron,Marron,43
Pies de gato La Sportiva Tarantula mujer Turquoise 41 Turquesa,Turquesa,41
Pies de gato La Sportiva Katana Tangerine-Tropic Blue 42.5 Naranja/Azul,Naranja/Azul,42.5
Zapatillas Salomon Cove Hombre 42 Gris,Gris,42
"Zapatillas La Sportiva Wild Cat Mujer Gris Rojo 40,5 Gris/rojo",Gris/Rojo,"40,5"
Pies de gato La Sportiva Otaki mujer Sulphur-Coral 38.5 Amarillo/Rosa,Amarillo/Rosa,38.5
Calcetines Compressport Training Pack De 2 Azul 42 - 44 Azul,Azul,42 - 44
Zapatillas New Balance Gym Training Fitness Mujer Rosa 39 Azul,Azul,39
Camiseta Térmica Sport Hg 8052 Mujer Naranja L Naranja,Naranja,L
Botas The North Face Hedgehog Fastpack Mid Gtx Hombre Negro 47 Negro,Negro,47
Pies de gato La Sportiva Skwama mujer Apple Green-Cobalt Blue 39 Verde/Azul,Verde/Azul,39
Botas Chiruca Troll 01 Goretex Niños Gris Verde 31 Gris/verde,Gris/Verde,31
Botas La Sportiva Trango Trk Gtx Amarillo Negro 42.5 Amarillo/Negro,Amarillo/Negro,42.5
Botas Salomon Quest 4d 3 Gtx Hombre Marron 44 2/3 Marron,Marron,44 2/3
BOTAS CHIRUCA MONIQUE 12 GORE-TEX MARRON 42 Marron,Marron,42
Pantalones Trekking Regatta Catla Shorts Mujer 36 Gris,Gris,36
Botas de Montaña Merrell Moab Fst Ice+ Thermo Hombre 42 Verde oliva,Verde oliva,42
ZAPATILLAS CHIRUCA TASMANIA 10 GORE-TEX GRIS 37 Gris,Gris,37
ZAPATILLAS CHIRUCA ETNICO 03 GTX SURROUND MARINO-MARRON 41 Azul Marino,Azul Marino,41
Zapatillas Boreal AZTEC WOMEN'S 41.5 Gris,Gris,41.5
Chaqueta Soft Shell Trekking Izas Copper Hombre Gris XS Gris,Gris,XS
Zapatillas Saucony Excursion Tr11 Hombre Rojo Gris 42 Rojo/gris,Rojo/Gris,42
"Zapatillas trekking Salewa MS Firetail 3 GTX Hombre Negro Verde 44,5 Negro/Verde",Negro/Verde,"44,5"
Pies de gato La Sportiva Katana Yellow-Black 36 Amarillo/Negro,Amarillo/Negro,36
Chaqueta de Senderismo Ternua Zixon Therm Hombre Burdeos XL Burdeos,Burdeos,XL
ZAPATILLAS CHIRUCA ETNICO 03 GTX SURROUND MARINO-MARRON 40 Azul Marino,Azul Marino,40
Zapatillas Nike Revolution 4 Eu Mujer Tormenta 42 Azul,Azul,42
Zapatillas Nike Tanjun Se Hombre Verde 44 Verde oliva,Verde oliva,44
Zapatillas Nike Revolution 4 Eu Hombre Rojo 42 Rojo,Rojo,42
Zapatillas La Sportiva Akasha Hombre Gris Azul 41.5 Gris/Azul,Gris/Azul,41.5
Banda para el Pelo La Sportiva Fade Headband Negro Naranja L Negro/Naranja,Negro/Naranja,L
Zapatillas Boreal Bamba W's Verde 42 Verde,Verde,42
Zapatillas La Sportiva Falkon Gtx 27-35 Gris 27 Gris,Gris,27
Zapatillas Boreal BAMBA ANTRACITA 41.5 Antracita,Antracita,41.5
Zapatillas Chiruca Sendero 02 Gore-tex Marron 46 Marron,Marron,46
Pies de gato La Sportiva Genius 40.5 Rojo/Amarillo,Rojo/Amarillo,40.5
BOTAS CHIRUCA TROLL 03 GORE-TEX AZUL MARINO 28 Azul Marino,Azul Marino,28
Chaqueta The North Face Stratos Hombre Negro M Negro,Negro,M
Zapatillas New Balance Kj373 Crema 36 Crema,Crema,36
Pies de gato La Sportiva Skwama Black-Yellow 41.5 Negro/Amarillo,Negro/Amarillo,41.5
Sandalias Hi-Tec Santorini Strap Mujer Taupe 37 Taupe,Taupe,37
Zapatillas La Sportiva Ultra Raptor Hombre Naranja Gris 43.5 Naranja/Gris,Naranja/Gris,43.5
Zapatillas Nike Downshifter 8 Hombre Gris 42 Gris/naranja,Gris/Naranja,42
Botas The North Face Hedgehog Fastpack Mid Gtx Mujer Gris 37 Gris,Gris,37
Botas Boreal HURRICANE ANTRACITA 40 Antracita,Antracita,40
Zapatillas Salomon X Ultra 3 GTX Mujer Gris 38 Gris,Gris,38
Pies de gato La Sportiva Mythos Lady 36 Blanco,Blanco,36
Zapatillas New Balance Kd373 Burdeos 28 Burdeos,Burdeos,28
Camiseta running Salomon Elevate Seamless LS Tee Mujer Turquesa L Turquesa,Turquesa,L
Pies de gato La Sportiva Katana Tangerine-Tropic Blue 38 Naranja/Azul,Naranja/Azul,38
Botas Boreal ASPEN 34 Gris/Rojo,Gris/Rojo,34
Pies de gato La Sportiva Solution mujer White-Lily Orange 33.5 Blanco/Naranja,Blanco/Naranja,33.5
Pies de gato La Sportiva Kataki Ocean-Sulphur 45 Azul/Amarillo,Azul/Amarillo,45
Pies de gato La Sportiva Finale mujer Grey-Coral 37 Gris/Coral,Gris/Coral,37
Forro Polar Campagnolo 3g10747 Hombre Negro Blanco 48 Negro/Blanco,Negro/Blanco,48
Zapatillas De Senderismo Hi-tec Ruta Low Wp Hombre Marron 40 Marron,Marron,40
Botas Boreal ASPEN GIRLS 34 Gris/Turquesa,Gris/Turquesa,34
Botas Chiruca Xacobeo 12 GoreTex Hombre Marron 42 Marron,Marron,42
Chaqueta de pluma Campagnolo 3Z22577 Fix Hood Hombre Teja 46 Teja,Teja,46
Zapatillas Trekking Salewa Ms Wildfire Vent Hombre Azul 45 Azul,Azul,45
Pantalones Trangoworld Prote Fi Hombre Gris Amarillo S Gris/Amarillo,Gris/Amarillo,S
Botas Boreal KOVACH GRIS 47 Gris,Gris,47
Pantalones Esquí de travesía Salomon Active Soft Shell Mujer M Rojo con cremallera entera,Rojo con cremallera entera,M
Zapatillas Boreal BAMBA ANTRACITA 45.5 Antracita,Antracita,45.5
Zapatillas Trail Running La Sportiva Ultra Raptor Hombre Naranja Gris 43 Naranja/gris,Naranja/Gris,43
BOTAS CHIRUCA DYNAMIC 52 GORE-TEX MARRON 40 Marron,Marron,40
"Zapatillas La Sportiva Akyra Hombre Amarillo 45,5 Amarillo",Amarillo,"45,5"
Zapatillas New Balance Fresh Foam Hierro V3 Hombre Imán Negro 47 Negro,Negro,47
Calcetines Lorpen T2 Trekking Thermolite Navy 43/46 Navy,Navy,43/46
Pies de gato La Sportiva Finale Brown-Orange 40.5 Marrón/Naranja,Marrón/Naranja,40.5
Zapatillas De Trekking Salomon X Ultra 3 Hombre Azul Poseidon 43 1/3 Azul,Azul,43 1/3
BOTAS CHIRUCA MASSANA 05 GORE-TEX ASFALTO-ROJO 34 Asfalto,Asfalto,34
Botas Boreal ZANSKAR GRIS 44 Gris,Gris,44
BOTAS CHIRUCA PANTICOSA 06 GORE-TEX GRIS 39 Gris,Gris,39
Forro Polar Campagnolo 3g10747 Hombre Negro Blanco 48 Negro/Blanco,Negro/Blanco,48
Pies de gato La Sportiva Miura Lime 43 Lima,Lima,43
Pies de gato La Sportiva Solution White-Yellow 36 Blanco/Amarillo,Blanco/Amarillo,36
Zapatillas Trail Running La Sportiva Bushido Mujer Azul Naranja 38 Azul/naranja,Azul/Naranja,38
BOTAS CHIRUCA MULHACEN 19 GORETEX HOMBRE GRIS ROJO 43 Gris/Rojo,Gris/Rojo,43
Zapatillas Salomon X Ultra 3 Prime Goretex Mujer Málaga 40 Rosa,Rosa,40
Botas Salewa Ws Mtn Trainer Mid Gtx Mujer Marron 40 Marron,Marron,40
Zapatillas Boreal AZTEC WOMEN'S 37 Gris,Gris,37
Zapatillas Salomon X Ultra 3 Gtx Mujer Gris 40 2/3 Gris,Gris,40 2/3
BOTAS CHIRUCA CARES 52 GORE-TEX MARRON 41 Marron,Marron,41
Zapatillas Boreal BAMBA ANTRACITA 45.5 Antracita,Antracita,45.5
Zapatillas Saucony Jazz Original Vintage Niños Navy 34 Navy,Navy,34
Saucony Jazz Original Vintage Mujer Granate 37 Granate,Granate,37
Botas Boreal KOVACH FULL GRAIN 42 Marron,Marron,42
Botas Boreal DROM MID GRAFITO 39.5 Gris/Verde,Gris/Verde,39.5
"Botas La Sportiva G5 Negro Amarillo 44,5 Negro/amarillo",Negro/Amarillo,"44,5"
Zapatillas Salomon Xa Pro 3d Goretex Hombre Negro 44 Negro,Negro,44
ZAPATILLAS LA SPORTIVA ULTRA RAPTOR HOMBRE NEGRO AMARILLO 41 Negro/Amarillo,Negro/Amarillo,41
Pantalones Trekking Regatta Catla Shorts Mujer 36 Gris,Gris,36
Zapatillas Hi-tec Razor Low Wp Hombre Gris Naranja 45 Gris/naranja,Gris/Naranja,45
Botas Boreal ASPEN GIRLS 34 Gris/Turquesa,Gris/Turquesa,34
"ATTIPAS - Calzado los primeros pasos urban attipas 21,5 AMARILLO",AMARILLO,"21,5"
"Zapatillas New Balance Fresh Foam Crag V2 Hombre Oro 41,5 Oro Brillante",Oro brillante,"41,5"
Zapatillas Saucony Jazz Original Vintage Mujer Gris Negro 40 Gris/negro,Gris/Negro,40
Pantalones Trangoworld Prote Fi Hombre Negro Azul S Negro/Azul,Negro/Azul,S
Zapatillas Hi-tec Gregal Low Wp Hombre Marron 46 Marron,Marron,46
Botas Boreal YUCATAN GRIS 44 Gris,Gris,44
Zapatillas Hi-Tec Quadra Classic Wp Hombre Tupe 46 Taupe,Taupe,46
Botas Boreal Flyers Mid 47 Gris/amarillo,Gris/Amarillo,47
Pies de gato La Sportiva Katana Yellow-Black 36.5 Amarillo/Negro,Amarillo/Negro,36.5
Pies de gato La Sportiva Katana Tangerine-Tropic Blue 38 Naranja/Azul,Naranja/Azul,38
Zapatillas Boreal DROM W'S MORADO 37 Morado,Morado,37
Zapatillas Nike Revolution 4 Eu Hombre Negro Rojo 44 Negro/rojo,Negro/Rojo,44
Zapatillas Trail Running Merrell All Out Terra Trail Hombre Negro Amarillo 41 Negro/amarillo,Negro/Amarillo,41
Pies de gato La Sportiva Solution mujer White-Lily Orange 41 Blanco/Naranja,Blanco/Naranja,41
Pantalones Trangoworld Prote Fi Hombre Gris Amarillo S Gris/Amarillo,Gris/Amarillo,S
Pies de gato La Sportiva Otaki Blue-Flame 45 Azul/Naranja,Azul/Naranja,45
Pies de gato La Sportiva Mythos Terra 39 Tierra Oscura,Tierra Oscura,39
Zapatillas Boreal FUTURA ANTRACITA 46.5 Antracita,Antracita,46.5
"Zapatillas Boreal DROM GRIS 42,5 Gris",Gris,"42,5"
Zapatillas La Sportiva Akyra GoreTex Hombre Neptuno Amapola 41 Azul/Rojo,Azul/Rojo,41
Botas Boreal ZANSKAR GRIS 42 Gris,Gris,42
Zapatillas Boreal DROM W'S MORADO 39.5 Morado,Morado,39.5
Botas Boreal APACHE MARRON 42.5 Marron,Marron,42.5
Pies de gato La Sportiva Finale Sulphur-Blue 39 Amarillo/Azul,Amarillo/Azul,39
Zapatillas Nike Downshifter 8 Mujer Lobo Gris 40 Gris,Gris,40
ATTIPAS - Zapatos attipas primeros pasos cutie blanco 20 BLANCO,BLANCO,20
ZAPATILLAS LA SPORTIVA AKYRA GORETEX HOMBRE CARBÓN VERDE MANZANA 40.5 Carbon,Carbon,40.5
Pies de gato La Sportiva Mythos Terra 40 Tierra Oscura,Tierra Oscura,40
Zapatillas La Sportiva Ultra Raptor Hombre Azul Amarillo 41.5 Azul/Amarillo,Azul/Amarillo,41.5
Chaqueta Chiruca Polar Axe 08 Hombre XL Verde/Naranja,Verde/Naranja,XL
Zapatillas Trail Running Salomon Wings Pro 2 Hombre Lima 42 Lima,Lima,42
Pies de gato La Sportiva Katana Tangerine-Tropic Blue 38.5 Naranja/Azul,Naranja/Azul,38.5
Pantalones Trekking Regatta Catla Shorts Mujer 36 Gris,Gris,36
Medias de compresión Compressport R2 Amarillo Azul T4 Amarillo/Azul,Amarillo/Azul,T4
Pies de gato La Sportiva Otaki Blue-Flame 40.5 Azul/Naranja,Azul/Naranja,40.5
Pies de gato La Sportiva Solution White-Yellow 43.5 Blanco/Amarillo,Blanco/Amarillo,43.5
Botas Hi-Tec Ravus Adventure Mid WP Hombre Chocolate 46 Chocolate,Chocolate,46
Sandalias De Descanso Salomon Rx Break Mujer Turquesa 40 2/3 Turquesa,Turquesa,40 2/3
Botas Boreal MAZAMA GRIS 40 Gris,Gris,40
Pantalones Breezy Coromell Hombre Negro Azul S Negro/Azul,Negro/Azul,S
ATTIPAS - Zapatos bebé ribbon gris attipas 20 GRIS,GRIS,20
Mallas Anticeluliticas Sontress 1051 Mujer M Negro,Negro,M
Sandalias Chiruca Baleares 01 Beig-verde 39 Beig,Beig,39
Zapatillas La Sportiva Jynx Niños 36-40 Ópalo Manzana Verde 39 Azul,Azul,39
Zapatillas Salomon X Ultra 3 Gtx Hombre Negro Verde 46 Negro/verde,Negro/Verde,46
Pantalones Chiruca Silvano Pro 11 Hombre M Kaki,Kaki,M
Zapatillas La Sportiva Kaptiva GoreTex Hombre Negro Amarillo 42.5 Negro/Amarillo,Negro/Amarillo,42.5
Botas Chiruca Xacobeo 05 GoreTex Hombre Gris Petroleo 44 Gris,Gris,44
Pies de gato La Sportiva Solution White-Yellow 39.5 Blanco/Amarillo,Blanco/Amarillo,39.5
ZAPATILLAS LA SPORTIVA ULTRA RAPTOR HOMBRE NEGRO AMARILLO 46 Negro/Amarillo,Negro/Amarillo,46
Botas Chiruca Angliru 02 Goretex Hombre Marrón 43 Marron,Marron,43
Parka Inobe Termic Gtx Trango Marrón Bungee 2xl Marron,Marron,2XL
"Zapatillas Boreal Sendai Gris 46,5 Gris",Gris,"46,5"
ZAPATILLAS LA SPORTIVA AKYRA GORETEX HOMBRE CARBÓN VERDE MANZANA 42 Carbon,Carbon,42
Zapatillas New Balance ML574 Hombre Negro Luz de Piscina 45 Negro/Azul,Negro/Azul,45
Pies de gato La Sportiva Otaki Blue-Flame 42 Azul/Naranja,Azul/Naranja,42
BOTAS CHIRUCA TROLL 06 GORE-TEX LILA 25 Lila,Lila,25
Zapatillas New Balance Fresh Foam Cruz On Hombre Negro Imán 42 Negro,Negro,42
Zapatillas Salomon X Ultra 3 Gtx Hombre Negro Verde 42 2/3 Negro/verde,Negro/Verde,42 2/3
ATTIPAS - Attipas calzado los primeros pasos sneakers gris 19 GRIS,GRIS,19
ImseVimse - Braguita-pañal de aprendizaje imsevimse XL 11-14 Kg ZOO,ZOO,XL 11-14 Kg
Botas The North Face Hedgehog Fastpack Mid Gtx Hombre Negro 47 Negro,Negro,47
Chaqueta Sieber Complet Gtx Trango Kaki 2xl Kaki,Kaki,2XL
BOTAS CHIRUCA MASSANA 02 GORE-TEX MARRON 39 Marron,Marron,39
Pies de gato La Sportiva Kataki mujer Mint-Coral 40.5 Menta,Menta,40.5
"Zapatillas Boreal Sendai Vent Verde 42,5 Verde",Verde,"42,5"
Pies de gato La Sportiva Futura Blue-Yellow 41.5 Azul/Amarillo,Azul/Amarillo,41.5
Chaqueta Mac In A Sac Mias Ultra Negro Naranja M Negro/Naranja,Negro/Naranja,M
Sandalias Chiruca Surinam 15 Gris 43 Gris,Gris,43
Zapatillas Salomon X Ultra 3 Gtx Hombre Negro Verde 46 Negro/verde,Negro/Verde,46
Zapatillas New Balance Kd373 Marron 30 Marron,Marron,30
Zapatillas Salomon X Radiant Goretex Hombre Beluga 43 1/3 Gris Oscuro,Gris Oscuro,43 1/3
Pullover Trx2 Stretch Pro Trango Azul-azul Oscuro 2xl Azul,Azul,2XL
Botas Boreal NELION WOMEN'S 42 Lima,Lima,42
Zapatillas Boreal Magma Grafito 40 Gris Oscuro,Gris Oscuro,40
Pies de gato La Sportiva Finale Sulphur-Blue 40 Amarillo/Azul,Amarillo/Azul,40
"Zapatillas La Sportiva Helios Sr Hombre Amarillo 38,5 Amarillo",Amarillo,"38,5"
Zapatillas La Sportiva Akyra Hombre Azul Oceano 43 Azul,Azul,43
Botas Boreal BAMBA MID MARINO 44.5 Azul Marino,Azul Marino,44.5
Zapatillas Trail Running La Sportiva Bushido Mujer Azul Naranja 38 Azul/naranja,Azul/Naranja,38
Botas Boreal HURRICANE WS GRIS 38 Gris,Gris,38
Botas The North Face Hedgehog Fastpack Mid Gtx Hombre Negro 43 Negro,Negro,43
Botas Boreal MALI GRIS 37 Gris,Gris,37
Pies de gato La Sportiva Skwama mujer Apple Green-Cobalt Blue 41 Verde/Azul,Verde/Azul,41
Pies de gato La Sportiva Tarantula mujer Turquoise 42 Turquesa,Turquesa,42
Botas Boreal KERALA GRIS 39.5 Gris,Gris,39.5
Chaqueta Ganin Ft Trango Verde Lima L Lima,Lima,L
Botas Merrell Accentor Sport Mid Goretex Mujer Negro Acuífero 40 Negro/azul,Negro/Azul,40
Pies de gato La Sportiva Kataki Ocean-Sulphur 42.5 Azul/Amarillo,Azul/Amarillo,42.5
Chaqueta Trx2 Stretch Pro Trango Azul-azul Oscuro 3xl Azul,Azul,3XL
Botas De Montaña Salomon Xa Pro 3d Mid Cswp J Niños Morado 33 Morado,Morado,33
ZAPATILLAS CHIRUCA SENDERO 02 GORE-TEX MARRON 39 Marron,Marron,39
Pies de gato La Sportiva Solution White-Yellow 36 Blanco/Amarillo,Blanco/Amarillo,36
Sandalias Chiruca Malibu 07 Mujer Coral 41 Coral,Coral,41
Zapatillas Trail Running La Sportiva Ultra Raptor Hombre Naranja Gris 42 Naranja/gris,Naranja/Gris,42
Zapatillas Salomon Outline GoreTex Hombre Blazer Azul Marino 45 1/3 Navy,Navy,45 1/3
"Zapatillas La Sportiva Mutant Mujer Cieruela Manzana Verde 42,5 Cereza",Verde/Cereza,"42,5"
Pantalones Cortos Trango World Yittu Mujer Morado M Morado,Morado,M
BOTAS CHIRUCA ETRUSCA 02 GORE-TEX MARRON 40 Marron,Marron,40
"Zapatillas New Balance U410 Hombre Burdeos 47,5 Burdeos",Burdeos,"47,5"
Pies de gato La Sportiva Finale Sulphur-Blue 39 Amarillo/Azul,Amarillo/Azul,39
Pies de gato La Sportiva Katana Tangerine-Tropic Blue 38 Naranja/Azul,Naranja/Azul,38
Botas Hi-Tec Garcia Sport Wp Hombre Chocolate 44 Chocolate,Chocolate,44
Zapatillas Boreal FLYERS VENT WS 37.5 Gris,Gris,37.5
BOTAS CHIRUCA CARES 05 GORE-TEX GRIS 36 Gris,Gris,36
Chaqueta de Senderismo Ternua Zixon Therm Hombre Burdeos XL Burdeos,Burdeos,XL
ATTIPAS - Attipas calzado los primeros pasos zoo azul 20 AZUL,AZUL,20
Zapatillas Boreal Sendai Gris 44 Gris,Gris,44
Zapatillas Skechers Gorun Fast Valor Hombre Rojo 44 Rojo,Rojo,44
Camiseta Running Salomon Agile Ss Hombre Negro Liso M Negro Liso,Negro liso,M
Zapatillas trail running La Sportiva Akasha Hombre Negro 40.5 Negro/Amarillo,Negro/Amarillo,40.5
"Zapatillas Nike Flex Experience Rn 7 Mujer Pistola De Humo 38,5 Gris/rosa",Gris/Rosa,"38,5"
BOTAS CHIRUCA TROLL 06 GORE-TEX LILA 25 Lila,Lila,25
Botas Chiruca Mars Boa 05 Goretex Niños Gris Rojo 34 Gris/rojo,Gris/Rojo,34
Zapatillas New Balance Fuelcore Nergize Mujer Azul 37 Azul,Azul,37
Zapatillas Boreal SALSA W'S TURQUESA 40 Turquesa,Turquesa,40
Zapatillas La Sportiva Kaptiva GoreTex Hombre Negro Amarillo 43.5 Negro/Amarillo,Negro/Amarillo,43.5
Calcetines Lorpen T2 Light Hiker Gris 39/42 Gris,Gris,39/42
Botas Hi-Tec Gregal Mid WP Hombre Gris 41 Gris,Gris,41
Zapatillas Boreal BAMBA W'S OLIVA 39.5 Verde oliva,Verde oliva,39.5
Zapatillas Hi-tec Razor Low Wp Hombre Carbón 46 Carbon,Carbon,46
Pies de gato La Sportiva TC Pro 42 Crema,Crema,42
Zapatillas Saucony Jazz Original Vintage Hombre Verde Kaki 43 Verde,Verde,43
Mallas Sontress 1609 Mujer Negro M Negro,Negro,M
Botas de montaña Salomon X Alp Mid Ltr Gtx Hombre Gris 41 1/3 Gris,Gris,41 1/3
Zapatillas Boreal AZTEC WOMEN'S 41.5 Gris,Gris,41.5
Chaqueta De Punto Campagnolo 38h2237 Hombre Gris 50 Gris,Gris,50
Botas Boreal ASPEN 36 Gris/Rojo,Gris/Rojo,36
Zapatillas Salomon Xa Elevate Hombre 44 Azul,Azul,44
Sandalias Hi-tec Delos Mujer Azul 40 Azul,Azul,40
Botas Chiruca Trofeo 01 GoreTex Pointer Hombre 45 Kaki,Kaki,45
Botas Montaña Millet Ld High Route Mesh Hombre 44 2/3 Gris,Gris,44 2/3
Zapatillas Boreal Sendai Vent Verde 43 1/4 Verde,Verde,43 1/4
Zapatillas Salomon X Radiant Goretex Hombre Beluga 46 Gris Oscuro,Gris Oscuro,46
Camiseta Ternua Talok 1/2 Zip Hombre Mousse Grey S Gris,Gris,S
Sandalias Chiruca Guam 03 Hombre Negro 43 Negro,Negro,43
BOTAS CHIRUCA MONIQUE 09 GORE-TEX GRIS-ROJO 37 Gris/Rojo,Gris/Rojo,37
Sandalias Hi-tec Santorini Strap Mujer Taupe 41 Taupe,Taupe,41
Botas Boreal ASPEN GIRLS 29 Gris/Turquesa,Gris/Turquesa,29
Pies de gato La Sportiva Solution White-Yellow 45 Blanco/Amarillo,Blanco/Amarillo,45
Botas La Sportiva Trango Trk Gtx Amarillo Negro 44.5 Amarillo/Negro,Amarillo/Negro,44.5
Botas Hi-Tec Ravus Adventure Mid WP Hombre Chocolate 44 Chocolate,Chocolate,44
Pies de gato La Sportiva Futura Blue-Yellow 38.5 Azul/Amarillo,Azul/Amarillo,38.5
Zapatillas La Sportiva Lycan Hombre Gris Verde 44 Gris/verde,Gris/Verde,44
Zapatillas Skechers Gorun Fast Valor Hombre Rojo 43 Rojo,Rojo,43
Zapatillas Salomon Sense Ride 2 Hombre Ilusión Azul 42 2/3 Azul,Azul,42 2/3
Zapatillas Trail Running Salomon Wings Flyte Goretex Hombre Gris  42 Gris,Gris,42
Zapatillas Salomon X Ultra 3 Gtx Hombre Azul Azul 44 Azul/azul,Azul/Azul,44
"Zapatillas La Sportiva Lycan Hombre Gris Verde 44,5 Gris/verde",Gris/Verde,"44,5"
Saucony Jazz Original Vintage Azul Mujer 39 Azul,Azul,39
Botas La Sportiva Trango Trk Gtx Carbon 44 Carbon,Carbon,44
Pies de gato La Sportiva Skwama Black-Yellow 46 Negro/Amarillo,Negro/Amarillo,46
Zapatillas Chiruca Maracaibo 19 Morado 40 Morado,Morado,40
Zapatillas Chiruca Sendero 02 Gore-tex Marron 47 Marron,Marron,47
"Botas Boreal Drom Mid Rojo 44,5 Rojo",Rojo,"44,5"
Pies de gato La Sportiva Miura Lime 42 Lima,Lima,42
BOTAS CHIRUCA MASSANA 05 GORE-TEX ASFALTO-ROJO 34 Asfalto,Asfalto,34
Camiseta térmica Trango World Lace Hombre M Blanco,Blanco,M
BOTAS Chiruca Somiedo 12 GoreTex Hombre MARRÓN 41 Marron,Marron,41
BOTAS CHIRUCA MASSANA 05 GORE-TEX ASFALTO-ROJO 34 Asfalto,Asfalto,34
Zapatillas La Sportiva Jynx Niños 36-40 Ópalo Manzana Verde 39 Azul,Azul,39
"ATTIPAS - Calzado los primeros pasos urban attipas 22,5 AMARILLO",AMARILLO,"22,5"
Botas Salomon X Ultra 3 Mid Gtx Mujer Imán 39 1/3 Negro,Negro,39 1/3
"Zapatillas Trail Running La Sportiva Akyra Mujer Verde 37,5 Verde",Verde,"37,5"
Botas De Montaña Salomon Quest 4d 2 Gtx Hombre Marron Negro 43 1/3 Marron,Marron,43 1/3
BOTAS CHIRUCA MONIQUE 01 GORE-TEX GRIS-VERDE 40 Gris/Verde,Gris/Verde,40
BOTAS CHIRUCA TROLL 03 GORE-TEX AZUL MARINO 31 Azul Marino,Azul Marino,31
"ATTIPAS - Attipas los primeros pasos puzzle azul 21,5 AZUL",AZUL,"21,5"
Zapatillas Boreal GLOVE OLIVA 44.5 Verde oliva,Verde oliva,44.5
Chaqueta Soft Shell Trekking Izas Copper Hombre Gris S Gris,Gris,S
Botas Merrell Outmost Mid Vent GTX Hombre Granite 41 Gris,Gris,41
ZAPATILLAS CHIRUCA ETNICO 03 GTX SURROUND MARINO-MARRON 43 Azul Marino,Azul Marino,43
Botas La Sportiva Trango Tech Gtx Negro-Amarillo 45 Negro/Amarillo,Negro/Amarillo,45
Zapatillas New Balance Fresh Foam Hierro V3 Mujer Coral Vivo 37 Coral,Coral,37
Zapatillas Boreal FLYERS VENT MARINO 42 Azul Marino,Azul Marino,42
Zapatillas trail running La Sportiva Akasha Hombre Negro 43 Negro/Amarillo,Negro/Amarillo,43
Botas Salomon Quest 4d 3 Gtx Hombre Negro 41 1/3 Negro,Negro,41 1/3
Zapatillas La Sportiva Hyrax Gtx Marrón 43 Marron,Marron,43
Pantalones Cortos Trango World Yittu Mujer Morado M Morado,Morado,M
Pies de gato La Sportiva Finale mujer Grey-Coral 36 Gris/Coral,Gris/Coral,36
Zapatillas Boreal Magma Hombre Marrón 47 Marron,Marron,47
BOTAS CHIRUCA MASSANA 02 GORE-TEX MARRON 41 Marron,Marron,41
Botas Chiruca Pointer 01 GoreTex Hombre 43 Marron,Marron,43
BOTAS CHIRUCA URALES 12 GORE-TEX MARRON 39 Marron,Marron,39
"Zapatillas Trail Running La Sportiva Ultra Raptor Hombre Azul Amarillo 45,5 Azul/amarillo",Azul/Amarillo,"45,5"
BOTAS CHIRUCA TROLL 06 GORE-TEX LILA 27 Lila,Lila,27
Botas Boreal Aspen 37 Gris/rojo,Gris/Rojo,37
Pantalones de montaña Trango World Naym Mujer XL Gris/Rosa,Gris/Rosa,XL
Chaqueta Ganin Ft Trango Verde Lima L Lima,Lima,L
"Zapatillas Nike Flex Experience Rn 7 Mujer Pistola De Humo 38,5 Gris/rosa",Gris/Rosa,"38,5"
Zapatillas La Sportiva Akasha Hombre Negro Naranja 43 Negro/naranja,Negro/Naranja,43
BOTAS CHIRUCA PANTICOSA 12 GORE-TEX MARRON 41 Marron,Marron,41
Botas Boreal MAIPO 39.5 Gris,Gris,39.5
"Zapatillas La Sportiva Akasha Mujer Gris Verde 38,5 Gris/verde",Gris/Verde,"38,5"
Pies de gato La Sportiva Cobra Slate 40.5 Gris,Gris,40.5
Botas de montaña Salomon X Alp Mid Ltr Gtx Hombre Gris 44 2/3 Gris,Gris,44 2/3
ZAPATILLAS CHIRUCA ETNICO 03 GTX SURROUND MARINO-MARRON 41 Azul Marino,Azul Marino,41
Zapatillas La Sportiva Akasha Mujer Negro Morado 37 Negro/Morado,Negro/Morado,37
Pies de gato La Sportiva Miura Lime 45.5 Lima,Lima,45.5
Botas La Sportiva Trango Tech Gtx Negro-Amarillo 40 Negro/Amarillo,Negro/Amarillo,40
Pies de gato La Sportiva Skwama mujer Apple Green-Cobalt Blue 39 Verde/Azul,Verde/Azul,39
Botas Hi-Tec Ravus Vent Mid WP Hombre Chocolate 42 Chocolate,Chocolate,42
Zapatillas New Balance Fresh Foam Cruz On Hombre Azul 42 Azul,Azul,42
Sandalias Hi-tec Delos Mujer Marron 40 Marron,Marron,40
Saucony Jazz Original Vintage Hombre Mostaza 44 Mostaza,Mostaza,44
Zapatillas Boreal GLOVE OLIVA 45.5 Verde oliva,Verde oliva,45.5
Zapatillas La Sportiva Ultra Raptor Hombre Negro Verde 46 Negro/Verde,Negro/Verde,46
Mochila Trail Running Salomon Adv Skin 5 Set Morado M/l Morado,Morado,M/L
BOTAS CHIRUCA ETRUSCA 02 GORE-TEX MARRON 43 Marron,Marron,43
Zapatillas Boreal SENDAI WS LILA 37.5 Lila,Lila,37.5
Botas Boreal NELION WOMEN'S 38 Lima,Lima,38
Pantalones Breezy Coromell Hombre Negro Azul XL Negro/Azul,Negro/Azul,XL
Calcetines Trail Running Compressport Pro Racing Socks V3.0 Blanco 42 - 44 Blanco,Blanco,42 - 44
Pies de gato La Sportiva TC Pro 36 Crema,Crema,36
ZAPATILLAS LA SPORTIVA URAGANO GORETEX HOMBRE NEGRO AMARILLO 41.5 Negro/Amarillo,Negro/Amarillo,41.5
"Zapatillas La Sportiva Akasha Hombre Negro Naranja 41,5 Negro/naranja",Negro/Naranja,"41,5"
Zapatillas trail running Salomon Xa Enduro Hombre 42 Azul/Naranja,Azul/Naranja,42
Botas Salomon Quest 4d 3 Gtx Hombre Marron 44 2/3 Marron,Marron,44 2/3
"Botas Boreal Atlas 39,5 Marron",Marron,"39,5"
Pantalones Trekking Izas Escort Hombre Caqui M Kaki,Kaki,M
Zapatillas Trail Running La Sportiva Ultra Raptor Hombre Naranja Gris 43 Naranja/gris,Naranja/Gris,43
Pies de gato La Sportiva Katana Tangerine-Tropic Blue 39 Naranja/Azul,Naranja/Azul,39
Pies de gato La Sportiva Finale Sulphur-Blue 38 Amarillo/Azul,Amarillo/Azul,38
Zapatillas Nike Downshifter 8 Mujer Lobo Gris 40 Gris,Gris,40
Pies de gato La Sportiva Kataki mujer Mint-Coral 35 Menta,Menta,35
Zapatillas Salomon X Ultra 3 Goretex Hombre Cuerda Elástica 47 1/3 Marron,Marron,47 1/3
Zapatillas Running Salomon X-mission 2 Hombre 42 2/3 Azul,Azul,42 2/3
Botas Chiruca Mars Boa 05 Goretex Niños Gris Rojo 35 Gris/rojo,Gris/Rojo,35
Calcetines Running Compressport Pro Racing Socks V3.0 Ultralight High Azul 42 - 44 Azul,Azul,42 - 44
Zapatillas Salomon X Ultra 3 Gtx Hombre Negro Verde 46 2/3 Negro/verde,Negro/Verde,46 2/3
Pies de gato La Sportiva TaRENTula 43 Gris,Gris,43
