title,color,size
Mallas Anticeluliticas Sontress 1051 Mujer M Negro,Negro,M
Botas Chiruca Massana 06 Goretex Mujer Gris Morado 40 Gris,Gris,40
Zapatillas De Trekking Salomon X Ultra 3 Hombre Negro 41 1/3 Negro,Negro,41 1/3
Botas Montaña Millet Ld High Route Mesh Mujer 38 Gris,Gris,38
Zapatillas Saucony Excursion Tr12 Mujer Morado 38 Morado,Morado,38
Pies de gato La Sportiva Miura Lime 45.5 Lima,Lima,45.5
Pies de gato La Sportiva Solution mujer White-Lily Orange 36 Blanco/Naranja,Blanco/Naranja,36
Chaqueta Hara Trango Amaranto M Violeta,Violeta,M
Zapatillas Boreal FUTURA ANTRACITA 44.5 Antracita,Antracita,44.5
Zapatillas Columbia Canyon Point Waterproof Hombre Carbon 44 Carbon,Carbon,44
Zapatillas Salomon Xa Elevate J Niños Rojo 32 Rojo,Rojo,32
Chaqueta Hara Trango Amaranto M Violeta,Violeta,M
"Zapatillas Trail Running La Sportiva Bushido Hombre Gris Verde 41,5 Gris/verde",Gris/Verde,"41,5"
"Zapatillas Trail Running La Sportiva Bushido Hombre Gris Verde 41,5 Gris/verde",Gris/Verde,"41,5"
Mochila trail running Salomon S-Lab Sense Ultra 8 Set Blanco XL Blanco,Blanco,XL
BOTAS CHIRUCA TROLL 03 GORE-TEX AZUL MARINO 32 Azul Marino,Azul Marino,32
Zapatillas Merrell Moab 2 Goretex Hombre Navy 46 Navy,Navy,46
"Zapatillas Nike Downshifter 8 Hombre Lobo Gris 45,5 Gris",Gris,"45,5"
Botas La Sportiva Olympus Mons Evo Negro Amarillo 46 Negro/amarillo,Negro/Amarillo,46
CHIRUCA BOXER BOA 01 GORETEX HOMBRE 43 Marron verdoso,Marron verdoso,43
Botas La Sportiva Trango Tech Gtx Negro-Amarillo 41 Negro/Amarillo,Negro/Amarillo,41
Botas Hi-tec Bandera Lite Wp Hombre Gris Azul 42 Gris/azul,Gris/Azul,42
"Zapatillas La Sportiva Akyra Hombre Naranja Negro 41,5 Naranja/negro",Naranja/Negro,"41,5"
Chaqueta Mac In A Sac Mias Origin Rojo Lava L Lava,Lava,L
Botas Chiruca Troll 05 GoreTex Niños Gris Rojo 30 Gris/Rojo,Gris/Rojo,30
Pies de gato La Sportiva Futura Blue-Yellow 43 Azul/Amarillo,Azul/Amarillo,43
Chaqueta Soft Shell Trekking Izas Copper Hombre Negro Rojo M Negro/rojo,Negro/Rojo,M
Pies de gato La Sportiva Genius 38 Rojo/Amarillo,Rojo/Amarillo,38
Pantalones TrangoWorld Kasu FI Hombre Gris S Gris,Gris,S
Botas Boreal MAIPO 40 Gris,Gris,40
BOTAS CHIRUCA MULHACEN 52 GORE-TEX MARRON-NEGRO 43 Marron,Marron,43
Pies de gato La Sportiva Skwama Black-Yellow 38 Negro/Amarillo,Negro/Amarillo,38
Pantalones Trangoworld Prote Fi Hombre Negro Azul S Negro/Azul,Negro/Azul,S
BOTAS CHIRUCA ABORIGEN 03 GTX SURROUND MARINO-MARRON 40 Azul Marino,Azul Marino,40
Zapatillas Nike Tanjun Premium Hombre Rojo 42 Rojo,Rojo,42
ATTIPAS - Zapatos attipas primeros pasos cutie rosa 24 ROSA,ROSA,24
Pies de gato La Sportiva Futura Blue-Yellow 39.5 Azul/Amarillo,Azul/Amarillo,39.5
Pies de gato La Sportiva Tarantula mujer Turquoise 38.5 Turquesa,Turquesa,38.5
CAMISETA INTERIOR TRX2 WOOL WM PRO TRANGO GRIS CLARO-GRIS OSCURO XXL Gris,Gris,XXL
Zapatillas Trail Running La Sportiva Bushido Mujer Azul Naranja 38 Azul/naranja,Azul/Naranja,38
"Zapatillas La Sportiva Lycan Hombre Negro Naranja 43,5 Negro/naranja",Negro/Naranja,"43,5"
Chaqueta Cortaviento Running Dare2b Blighted Windshell Mujer 38 Rosa Fuxia,Rosa fuxia,38
Chaqueta Polar Campagnolo 38p1536 Mujer Rock 44 Roca,Roca,44
Pantalones Trekking Trangoworld Trace Hombre S Gris,Gris,S
Botas Montaña Millet Ld High Route Mesh Mujer 40 2/3 Gris,Gris,40 2/3
BOTAS CHIRUCA DALLAS 12 GORE-TEX MARRON 41 Marron,Marron,41
Chaqueta de Senderismo Ternua Zixon Therm Hombre Azul Marino L Azul Marino,Azul Marino,L
Zapatillas Salomon Xa Elevate J Niños Rojo 31 Rojo,Rojo,31
Pies de gato La Sportiva Katana Tangerine-Tropic Blue 42.5 Naranja/Azul,Naranja/Azul,42.5
Zapatillas Saucony Jazz Original Vintage Mujer Gris Negro 40 Gris/negro,Gris/Negro,40
Pies de gato La Sportiva Skwama mujer Apple Green-Cobalt Blue 40 Verde/Azul,Verde/Azul,40
BOTAS CHIRUCA BERREA Hi Vis 08 GORE-TEX MARRON-NARANJA 43 Marron,Marron,43
Botas Boreal MALI GRIS 37.5 Gris,Gris,37.5
Zapatillas Boreal BAMBA W'S GRANATE 37.5 Granate,Granate,37.5
Zapatillas Running Nike Revolution 3 Hombre Azul Azul 43 Azul/azul,Azul/Azul,43
Botas De Nieve Salewa Ws Capsico Mid Insulated Mujer 38 Gris,Gris,38
"Botas Boreal Ketil Verde 39,5 Verde",Verde,"39,5"
CHAQUETA RUNART TRANGO LIMA-LIMA S Lima,Lima,S
Pant. Largo Prote Fi Trango Rojo-antracita L Rojo,Rojo,L
Zapatillas Boreal FUTURA WS ROJO 40 Gris,Gris,40
Zapatillas La Sportiva Akasha Mujer Azul Marino Púrpura 36 Azul/morado,Azul/Morado,36
"Botas La Sportiva Nepal Cube Gtx Amarillo 39,5 Amarillo",Amarillo,"39,5"
BOTAS CHIRUCA CARES FORCE 01 GORETEX HOMBRE MARRON 42 Marron,Marron,42
Pies de gato La Sportiva Katana Tangerine-Tropic Blue 37 Naranja/Azul,Naranja/Azul,37
Medias de compresión Compressport R2 Amarillo Azul T4 Amarillo/Azul,Amarillo/Azul,T4
BOTAS CHIRUCA MASSANA 05 GORE-TEX ASFALTO-ROJO 38 Asfalto,Asfalto,38
Botas De Nieve Salewa Ms Capsico Mid Insulated Hombre 44 1/2 Negro,Negro,44 1/2
Zapatillas Trail Running La Sportiva Bushido Mujer Azul Naranja 38 Azul/naranja,Azul/Naranja,38
Botas Hi-Tec Garcia Sport Wp Hombre Gris 44 Gris,Gris,44
Pies de gato La Sportiva Skwama mujer Apple Green-Cobalt Blue 40 Verde/Azul,Verde/Azul,40
"Zapatillas La Sportiva Hyrax Mujer Gtx Azul 39,5 Azul",Azul,"39,5"
Botas Boreal FLYERS MID 39.5 Gris/Amarillo,Gris/Amarillo,39.5
Zapatillas Salomon X Ultra 3 Gtx Mujer Gris 38 2/3 Gris,Gris,38 2/3
Pies de gato La Sportiva Kataki mujer Mint-Coral 40 Menta,Menta,40
Pies de gato La Sportiva Finale Sulphur-Blue 37.5 Amarillo/Azul,Amarillo/Azul,37.5
Zapatillas Trail Running Salomon Xa Pro 3d Gtx Hombre Navy 46 2/3 Navy,Navy,46 2/3
Pies de gato La Sportiva Skwama mujer Apple Green-Cobalt Blue 36.5 Verde/Azul,Verde/Azul,36.5
Pies de gato La Sportiva Miura mujer White-Jade Green 36 Blanco/Verde,Blanco/Verde,36
Zapatillas La Sportiva Kaptiva GoreTex Hombre Negro Amarillo 41 Negro/Amarillo,Negro/Amarillo,41
Botas Boreal NELION WOMEN'S 38 Lima,Lima,38
Botas Chiruca Sarria 07 Mujer Gris Burdeos 38 Gris,Gris,38
Pies de gato La Sportiva TC Pro 44 Crema,Crema,44
Polaina Trangoworld Force Verde L Verde,Verde,L
Zapatillas Salomon Ultra Pro Hombre Naranja Azul 42 Naranja/azul,Naranja/Azul,42
Botas De Montaña Millet High Route Gtx Hombre 45 1/3 Marron,Marron,45 1/3
Zapatillas La Sportiva Lycan Hombre Negro Azul 43 Negro/azul,Negro/Azul,43
"Zapatillas New Balance Gm500 Hombre Gris Plata 47,5 Plata",Plata,"47,5"
Pantalones Salomon Agile 2in1 Short Hombre Gris M Gris,Gris,M
"Zapatillas La Sportiva Akyra Hombre Gris Azul 46,5 Gris/azul",Gris/Azul,"46,5"
Pantalones Trangoworld Prote Extreme DS Hombre Gris Negro L Gris/Negro,Gris/Negro,L
Pies de gato La Sportiva Tarantula mujer Coral 40.5 Coral,Coral,40.5
Zapatillas Boreal FUTURA WS ROJO 37 Gris,Gris,37
BOTAS CHIRUCA BERREA FORCE Hi Vis 18 GORE-TEX MARRON-NARANJA 43 Marron,Marron,43
Pies de gato La Sportiva Katana Tangerine-Tropic Blue 39.5 Naranja/Azul,Naranja/Azul,39.5
Botas de Montaña Merrell Moab Fst Ice+ Thermo Hombre 42 Verde oliva,Verde oliva,42
Zapatillas Boreal GLOVE ANTRACITA 44 Antracita,Antracita,44
BOTAS CHIRUCA TROLL 06 GORE-TEX LILA 27 Lila,Lila,27
Botas Boreal STRIDER 42.5 Marron,Marron,42.5
Zapatillas Salomon Xa Pro 3d Hombre Azul Naranja 42 2/3 Azul/naranja,Azul/Naranja,42 2/3
Zapatillas Saucony Dxn Trainer Vintage Mujer Burdeos 39 Burdeos,Burdeos,39
Chaqueta Mac In A Sac Mias Origin Kaki L Kaki,Kaki,L
Zapatillas Trail Running La Sportiva Bushido Mujer Azul Naranja 38 Azul/naranja,Azul/Naranja,38
Pies de gato La Sportiva Katana mujer White-Purple 36.5 Blanco/Morado,Blanco/Morado,36.5
Calcetines Compressport Amortiguadores Negro 42 - 44 Negro,Negro,42 - 44
Botas Columbia Redmond V2 Mid Wp Hombre Cordovés Panadero 43 Marron,Marron,43
BOTAS CHIRUCA ABORIGEN 03 GTX SURROUND MARINO-MARRON 45 Azul Marino,Azul Marino,45
Pies de gato La Sportiva Solution mujer White-Lily Orange 40.5 Blanco/Naranja,Blanco/Naranja,40.5
Zapatillas Salomon X Ultra 3 GTX Mujer Gris 38 Gris,Gris,38
Calcetines Running Compressport Pro Racing Socks V3.0 Ultralight High Negro 35 - 38 Negro,Negro,35 - 38
Pies de gato La Sportiva Miura Lime 44 Lima,Lima,44
Pies de gato La Sportiva Finale mujer Grey-Coral 37 Gris/Coral,Gris/Coral,37
Zapatillas Nike Flex Contact 2 Hombre Negro 43 Negro,Negro,43
Chaqueta De Punto Campagnolo 38h2237 Hombre Cyano 50 Azul,Azul,50
Zapatillas Saucony Jazz Original Vintage Hombre Gris Negro 44 Gris/Negro,Gris/Negro,44
Zapatillas Boreal SENDAI GRIS 46 Gris,Gris,46
Chaqueta de Senderismo Ternua Zixon Therm Hombre Azul Marino L Azul Marino,Azul Marino,L
Mallas Sontress 1621 Mujer Negro M Negro,Negro,M
Zapatillas La Sportiva Wild Cat Mujer Gris Rojo 37.5 Gris/Rojo,Gris/Rojo,37.5
Zapatillas New Balance Kd373 Marron 30 Marron,Marron,30
Zapatillas La Sportiva Wild Cat Mujer Gris Rojo 38 Gris/Rojo,Gris/Rojo,38
ATTIPAS - Attipas calzado los primeros pasos sneakers azul 19 AZUL,AZUL,19
Pies de gato La Sportiva Katana Yellow-Black 46 Amarillo/Negro,Amarillo/Negro,46
Zapatillas Nike Downshifter 8 Mujer Piedra Pómez 39 Verde,Verde,39
"Botas La Sportiva Trango Trk Leather Gtx Gris Verde 42,5 Carbon",Carbon,"42,5"
"Zapatillas Boreal Chameleon Azul 39,5 Azul",Azul,"39,5"
Chaqueta Mac In A Sac Mias Origin Kaki L Kaki,Kaki,L
Zapatillas Saucony Dxn Trainer Vintage Mujer Burdeos 39 Burdeos,Burdeos,39
Pies de gato La Sportiva Katana Yellow-Black 45 Amarillo/Negro,Amarillo/Negro,45
Botas Senderismo Hi-tec Riverstone Wp Hombre Taupe 47 Taupe,Taupe,47
Botas Boreal Tempest Mid Azul 43 1/4 Azul,Azul,43 1/4
Mochila Trail Running Salomon Adv Skin 5 Set Rojo M/l Rojo,Rojo,M/L
Botas Columbia Cascade Pass Waterproof Hombre Marron 42 Marron,Marron,42
"Zapatillas Boreal Chameleon Azul 45,5 Azul",Azul,"45,5"
GUANTE ALOIS TRANGO GRIS XS Gris,Gris,XS
Zapatillas Boreal GLOVE W'S MALVA 37 Morado,Morado,37
"Zapatillas Nike Revolution 4 Eu Hombre Rojo 44,5 Rojo",Rojo,"44,5"
Pantalones Trekking Salomon Wayfarer Capri Hombre L Kaki,Kaki,L
Zapatillas Trail Running Salomon Wings Flyte Goretex Hombre Gris  42 Gris,Gris,42
Pies de gato La Sportiva Futura mujer Jade Green-White 36 Verde/Blanco,Verde/Blanco,36
Pies de gato La Sportiva Futura mujer Jade Green-White 33.5 Verde/Blanco,Verde/Blanco,33.5
Sandalias Chiruca Surinam 15 Gris 43 Gris,Gris,43
Botas Boreal Fuji 47 Marron,Marron,47
Pies de gato La Sportiva Otaki mujer Sulphur-Coral 37 Amarillo/Rosa,Amarillo/Rosa,37
Zapatillas La Sportiva Ultra Raptor Hombre Azul Amarillo 41.5 Azul/Amarillo,Azul/Amarillo,41.5
Zapatillas Merrell Moab 2 GoreTex Hombre Beluga 42 Gris Oscuro,Gris Oscuro,42
Botas Chiruca Troll 01 Goretex Niños Gris Verde 32 Gris/verde,Gris/Verde,32
BOTAS CHIRUCA MULHACEN 19 GORETEX HOMBRE GRIS ROJO 45 Gris/Rojo,Gris/Rojo,45
Zapatillas Trail Running Salomon Xa Pro 3d Gtx Hombre Rojo Dahlia 42 Rojo,Rojo,42
"ATTIPAS - Zapatos primeros pasos attipas tie 21,5 GRIS",GRIS,"21,5"
Botas Senderismo Hi-tec Riverstone Wp Hombre Gris 45 Gris,Gris,45
Botas Boreal BAMBA MID MARINO 39.5 Azul Marino,Azul Marino,39.5
Pies de gato La Sportiva Finale mujer Grey-Coral 37.5 Gris/Coral,Gris/Coral,37.5
Zapatillas La Sportiva Ultra Raptor Hombre Negro Verde 43 Negro/Verde,Negro/Verde,43
Botas De Montaña Salewa Ms Mtn Trainer Mid Goretex Hombre Gris 45 Gris,Gris,45
Zapatillas Trail Running Salomon Sense Ride Hombre Rojo Negro 44 2/3 Rojo/negro,Rojo/Negro,44 2/3
Pies de gato La Sportiva Katana mujer White-Purple 39 Blanco/Morado,Blanco/Morado,39
Botas Salomon X Ultra 3 Mid Gtx Hombre Castor Gray 48 Gris,Gris,48
ZAPATILLAS CHIRUCA TASMANIA 10 GORE-TEX GRIS 37 Gris,Gris,37
Zapatillas Trail Running Salomon Wings Pro 2 Hombre Lima 42 Lima,Lima,42
Botas Chiruca Monique 07 Goretex Mujer Burdeos 37 Burdeos,Burdeos,37
Pies de gato La Sportiva Katana Yellow-Black 36 Amarillo/Negro,Amarillo/Negro,36
CAMISETA INTERIOR TRX2 WOOL WM PRO TRANGO GRIS CLARO-GRIS OSCURO M Gris,Gris,M
Sandalias Chiruca Guam 03 Hombre Negro 43 Negro,Negro,43
Calcetines Lorpen T2 Light Hiker Gris 39/42 Gris,Gris,39/42
Chiruca Pointer 01 Goretex Hombre Marrón 47 Marron,Marron,47
Pies de gato La Sportiva Finale mujer Grey-Coral 40.5 Gris/Coral,Gris/Coral,40.5
Botas Hi-Tec Gregal Mid WP Hombre Gris 41 Gris,Gris,41
BOTAS CHIRUCA CARES 05 GORE-TEX GRIS 41 Gris,Gris,41
Botas Boreal MAZAMA MARRON 40 Marron,Marron,40
BOTAS CHIRUCA TROLL 03 GORE-TEX AZUL MARINO 32 Azul Marino,Azul Marino,32
Pies de gato La Sportiva Katana Yellow-Black 37.5 Amarillo/Negro,Amarillo/Negro,37.5
"Zapatillas Trail Running Merrell All Out Terra Light Hombre Gris 43,5 Gris",Gris,"43,5"
ZAPATILLAS LA SPORTIVA AKYRA GORETEX HOMBRE CARBÓN VERDE MANZANA 43.5 Carbon,Carbon,43.5
Zapatillas La Sportiva Hyrax Gtx Marrón 43 Marron,Marron,43
Zapatillas Boreal TEMPEST LOW GRAFITO 45.5 Gris Oscuro,Gris Oscuro,45.5
Zapatillas Boreal SENDAI VENT GRAFITO 42.5 Gris/Verde,Gris/Verde,42.5
Zapato Bomio Ip Trango Marron Chocolate 41 Marron,Marron,41
Botas Boreal ZANSKAR GRIS 40 Gris,Gris,40
Pies de gato La Sportiva Katana Tangerine-Tropic Blue 38.5 Naranja/Azul,Naranja/Azul,38.5
Botas La Sportiva Olympus Mons Evo Negro Amarillo 43 Negro/amarillo,Negro/Amarillo,43
Camiseta Térmica Sport Hg 8052 Mujer Naranja L Naranja,Naranja,L
Zapatillas La Sportiva Lycan Hombre Negro Naranja 42 Negro/naranja,Negro/Naranja,42
Pies de gato La Sportiva Futura Blue-Yellow 36.5 Azul/Amarillo,Azul/Amarillo,36.5
Zapatillas Saucony Shadow 5000 Vintage Hombre Verde 41 Verde,Verde,41
Mallas Running New Balance Impact Tight Negro Hombre M Negro,Negro,M
Botas Montaña Millet Ld High Route Mesh Mujer 40 Gris,Gris,40
Botas De Montaña Salewa Ms Crow Gtx Hombre 41 Negro/naranja,Negro/Naranja,41
ZAPATILLAS CHIRUCA ETNICO 03 GTX SURROUND MARINO-MARRON 41 Azul Marino,Azul Marino,41
Chaqueta Columbia Mission Air Interchange Hombre Verde Oliva S Verde Oliva,Verde oliva,S
Botas Boreal MAZAMA MARRON 40 Marron,Marron,40
Botas Boreal KLAMATH WMN'S MALVA 37 Morado,Morado,37
Zapatillas Salomon X Radiant Goretex Hombre Beluga 44 Gris Oscuro,Gris Oscuro,44
Sandalias Chiruca Malibu 05 Mujer Gris Morado 37 Gris,Gris,37
Zapatillas Nike Flex Contact 2 Hombre Antracita 43 Antracita,Antracita,43
Pies de gato La Sportiva Katana mujer White-Purple 36.5 Blanco/Morado,Blanco/Morado,36.5
Botas Boreal BULNES 42 Marron,Marron,42
Mochila trail running Salomon S-Lab Sense Ultra 8 Set Blanco XL Blanco,Blanco,XL
"Zapatillas Boreal SENDAI VENT GRAFITO 41,5 Gris/Verde",Gris/Verde,"41,5"
Chaqueta The North Face Stratos Hombre Negro M Negro,Negro,M
Camiseta Salomon S-Lab Sense Tee Hombre Blanco Negro XS Blanco/Negro,Blanco/Negro,XS
Pies de gato La Sportiva Tarantula mujer Turquoise 39 Turquesa,Turquesa,39
Pantalones Ternua Natib Hombre Plata Profunda L Plata,Plata,L
Botas Chiruca Trofeo 01 GoreTex Pointer Hombre 44 Kaki,Kaki,44
BOTAS CHIRUCA CARES 05 GORE-TEX GRIS 41 Gris,Gris,41
Zapatillas New Balance Kd373 Marron 38 Marron,Marron,38
Sandalias Chiruca Cartagena 05 Mujer Gris Morado 39 Gris,Gris,39
Pies de gato La Sportiva Katana Tangerine-Tropic Blue 39 Naranja/Azul,Naranja/Azul,39
Zapatillas Nike Downshifter 8 Hombre Navy 43 Navy,Navy,43
Zapatillas La Sportiva Jynx Niños 36-40 Ópalo Manzana Verde 38 Azul,Azul,38
Zapatillas Running Salomon X-Scream 3D Mujer 38 2/3 Lila/Morado,Lila/Morado,38 2/3
Zapatillas Trekking Millet Trident Gtx Hombre 42 Negro,Negro,42
Zapatillas trail running La Sportiva Akasha Hombre Negro 44.5 Negro/Amarillo,Negro/Amarillo,44.5
Zapatillas Columbia Redmond V2 Wp Mujer Exprés Océano Profundo 39 Marron,Marron,39
Zapatillas La Sportiva Akasha Hombre Negro Naranja 43 Negro/naranja,Negro/Naranja,43
Botas Chiruca Monique 07 Goretex Mujer Burdeos 38 Burdeos,Burdeos,38
Pies de gato La Sportiva TC Pro 42.5 Crema,Crema,42.5
Zapatillas Nike Air Max Motion Lw Gs Negro 38 Negro,Negro,38
Chaqueta Trx2 Soft Pro Trango Naranja Intenso-calabaza L Naranja,Naranja,L
Botas De Montaña Salomon X Ultra 3 Mid Gtx Hombre Verde Amarillo 44 Verde/amarillo,Verde/Amarillo,44
Zapatillas Saucony Jazz Trail Original Hombre Verde 41 Verde,Verde,41
Zapatillas Boreal Sendai Vent Verde 43 1/4 Verde,Verde,43 1/4
"Zapatillas La Sportiva Kaptiva Goretex Mujer Negro Orquídea 38,5 Negro/fuxia",Negro/Fuxia,"38,5"
Pies de gato La Sportiva Katana Yellow-Black 46 Amarillo/Negro,Amarillo/Negro,46
Zapatillas Nike Flex Experience Rn 7 Mujer Lobo Gris 39 Gris/blanco,Gris/Blanco,39
Zapatillas Hi-Tec Forza Low WP Niños 38 Gris/Amarillo,Gris/Amarillo,38
"ATTIPAS - Zapatos primeros pasos attipas tie 21,5 GRIS",GRIS,"21,5"
Zapatillas Saucony Azura Hombre Blanco 44 Blanco,Blanco,44
Chaqueta de Senderismo Ternua Zixon Therm Hombre Azul Marino S Azul Marino,Azul Marino,S
Zapatillas La Sportiva Ultra Raptor Hombre Negro Verde 44 Negro/Verde,Negro/Verde,44
Pies de gato La Sportiva Katana mujer White-Purple 34 Blanco/Morado,Blanco/Morado,34
Botas Salomon X Ultra 3 Mid Gtx Hombre Castor Gray 48 Gris,Gris,48
Zapatillas New Balance Gc574 Azul 40 Azul,Azul,40
Botas La Sportiva Trango Trk Gtx Amarillo Negro 40 Amarillo/Negro,Amarillo/Negro,40
Botas Salomon X Ultra 3 Mid GTX Mujer Azul Lima 38 2/3 Azul/Verde,Azul/Verde,38 2/3
Botas Boreal BAMBA MID GRIS 47 Gris,Gris,47
Botas De Montaña Salomon Quest 4d 2 Gtx Hombre Negro 44 2/3 Negro,Negro,44 2/3
Pies de gato La Sportiva Tarantula mujer Turquoise 35.5 Turquesa,Turquesa,35.5
ATTIPAS - Attipas calzado los primeros pasos zoo azul 20 AZUL,AZUL,20
Forro Polar Campagnolo 3g10747 Hombre Negro Blanco 50 Negro/Blanco,Negro/Blanco,50
Pies de gato La Sportiva Otaki mujer Sulphur-Coral 40.5 Amarillo/Rosa,Amarillo/Rosa,40.5
Parka Inobe Termic Gtx Trango Marrón Bungee 2xl Marron,Marron,2XL
BOTAS CHIRUCA MONIQUE 09 GORE-TEX GRIS-ROJO 36 Gris/Rojo,Gris/Rojo,36
Botas Boreal DESERT 42 Marron,Marron,42
Botas Millet High Route Goretex Hombre Negro Verde Ácido 45 1/3 Negro/verde,Negro/Verde,45 1/3
"Zapatillas De Trekking The North Face Hedgehog Fastpack Gtx Hombre Azul 42,5 Azul",Azul,"42,5"
Pies de gato La Sportiva Finale mujer Grey-Coral 33 Gris/Coral,Gris/Coral,33
BOTAS CHIRUCA SPANIEL 12 GORE-TEX MARRON 42 Marron,Marron,42
Pies de gato La Sportiva Mythos Terra 46 Tierra Oscura,Tierra Oscura,46
Botas Montaña Merrell Moab Mid GoreTex Hombre Marron 43 Marron,Marron,43
"Zapatillas Saucony Jazz Original Amarillo Azul 36,5 Amarillo/azul",Amarillo/Azul,"36,5"
Pies de gato La Sportiva Cobra Slate 40.5 Gris,Gris,40.5
Zapatillas Running Nike Flex Experience Rn 5 Hombre Negro 44 Negro,Negro,44
"Zapatillas Saucony Jazz Trail Original Hombre Verde 42,5 Verde",Verde,"42,5"
Zapatillas trail running La Sportiva Akasha Hombre Negro 44.5 Negro/Amarillo,Negro/Amarillo,44.5
Chaqueta Columbia Powder Lite Jkt Hombre Negro 2xl Negro,Negro,2XL
BOTAS CHIRUCA ABORIGEN 03 GTX SURROUND MARINO-MARRON 45 Azul Marino,Azul Marino,45
Saco Lc 800 Ua Trango Negro-naranja-gris Izquierda Negro,Negro,Izquierda
Zapatillas Salomon Xa Pro 3d J Niños Azul Naranja 40 Azul,Azul,40
Zapatillas Náuticas Salomon Cove Light Mujer 40 Gris,Gris,40
BOTAS CHIRUCA CAMEROS 02 MARRON 43 Marron,Marron,43
Pantalones Breezy Coromell Hombre Negro Rojo 2XL Negro/Rojo,Negro/Rojo,2XL
Botas de Montaña Merrell Azura Mid Waterproof Mujer 37 Gris/Verde,Gris/Verde,37
Pies de gato La Sportiva Tarantula mujer Turquoise 42 Turquesa,Turquesa,42
Chaqueta Mac In A Sac Mias Origin Rojo Lava L Lava,Lava,L
Zapatillas Saucony Jazz Original Vintage Niños Navy 35 Navy,Navy,35
Sandalias De Descanso Salomon Rx Break Mujer Rosa 41 1/3 Rosa,Rosa,41 1/3
Zapatillas De Trekking Salomon X Ultra 2 Gtx Hombre Lima 44 2/3 Lima,Lima,44 2/3
Botas Boreal MAZAMA GRIS 46 Gris,Gris,46
Pies de gato La Sportiva TaRENTula 46 Gris,Gris,46
Pies de gato La Sportiva Skwama Black-Yellow 38 Negro/Amarillo,Negro/Amarillo,38
Botas Boreal Drom Mid Rojo 43 1/4 Rojo,Rojo,43 1/4
Zapatillas Nike Revolution 4 Gs Azul 36 Azul,Azul,36
Zapatillas Salomon Eos Goretex Mujer Fantasma 38 Gris,Gris,38
Pies de gato La Sportiva Tarantula mujer Coral 36 Coral,Coral,36
"Botas Boreal Maipo 44,5 Gris",Gris,"44,5"
Sandalias Chiruca Surinam 15 Gris 43 Gris,Gris,43
BOTAS CHIRUCA DYNAMIC 52 GORE-TEX MARRON 39 Marron,Marron,39
Zapatillas Boreal FLYERS VENT WS 37 Gris,Gris,37
Botas La Sportiva Trango Trk Gtx Amarillo Negro 42.5 Amarillo/Negro,Amarillo/Negro,42.5
BOTAS CHIRUCA ABORIGEN 03 GTX SURROUND MARINO-MARRON 45 Azul Marino,Azul Marino,45
Zapatillas Boreal Sendai Gris 44 Gris,Gris,44
"Zapatillas Nike Revolution 4 Gs Azul 36,5 Azul",Azul,"36,5"
Zapatillas Boreal GLOVE W'S GRIS 37 Gris,Gris,37
Zapatillas trail running La Sportiva Akasha Hombre Negro 44.5 Negro/Amarillo,Negro/Amarillo,44.5
Zapatillas La Sportiva Akyra Hombre Naranja Negro 42 Naranja/Negro,Naranja/Negro,42
ZAPATILLAS CHIRUCA PANTERA GTX 03 GORE-TEX GRIS-AZUL 37 Gris/Azul,Gris/Azul,37
Pies de gato La Sportiva Katana Yellow-Black 43.5 Amarillo/Negro,Amarillo/Negro,43.5
"Botas Boreal Drom Mid Rojo 44,5 Rojo",Rojo,"44,5"
GUANTE ALOIS TRANGO GRIS S Gris,Gris,S
Botas Boreal Tempest Mid Marron 43 1/4 Marron,Marron,43 1/4
Zapatillas Chiruca Detroit 12 Gore-tex Marron 39 Marron,Marron,39
Botas Boreal SIANA CORAL 38 Coral,Coral,38
"Zapatillas Saucony Xodus Iso 3 Mujer Arándano 38,5 Rosa",Rosa,"38,5"
Pies de gato La Sportiva TC Pro 42 Crema,Crema,42
"Botas Boreal Bamba Mid Marino 45,5 Azul Marino",Azul Marino,"45,5"
Bermuda Ternua Kross Hombre Borgoña L Burdeos,Burdeos,L
Pies de gato La Sportiva Solution White-Yellow 39 Blanco/Amarillo,Blanco/Amarillo,39
Zapatillas Salomon Sense Ride 2 Hombre Dalia Roja 41 1/3 Rojo,Rojo,41 1/3
"Botas The North Face Hedgehog Fastpack Mid Gtx Hombre Negro 42,5 Negro",Negro,"42,5"
CHAQUETA RUNART TRANGO LIMA-LIMA S Lima,Lima,S
Chaqueta Mac In A Sac Mias Origin Kaki L Kaki,Kaki,L
Mochila Trail Running Salomon S-lab Sense 2 Set Negro L Negro,Negro,L
Zapatillas Nike Downshifter 8 Mujer Piedra Pómez 40 Verde,Verde,40
Botas Boreal Aspen 37 Gris/rojo,Gris/Rojo,37
Camiseta Running The North Face Graphic Play Hard Tank Mujer Morado XS Morado,Morado,XS
Zapatillas Trekking Merrell Chameleon 5 Ventilator Hombre Gris 46 Gris,Gris,46
Pies de gato La Sportiva Solution mujer White-Lily Orange 34 Blanco/Naranja,Blanco/Naranja,34
Pies de gato La Sportiva TaRENTula 43 Gris,Gris,43
Zapatillas Boreal SALSA W'S TURQUESA 37.5 Turquesa,Turquesa,37.5
Zapatillas Boreal DROM W'S MORADO 38 Morado,Morado,38
Zapatillas De Trekking Salomon X Ultra 3 Hombre Amarillo 42 Amarillo,Amarillo,42
Zapatillas Boreal FUTURA WS ROJO 37 Gris,Gris,37
Zapatillas Saucony Jazz Original Vintage Azul Marino Hombre 44.5 Azul Marino,Azul Marino,44.5
Zapatillas Chiruca Cuba 05 Gore-tex Gris-azul-rosa 37 Gris/azul,Gris/Azul,37
Sandalias De Descanso Salomon Rx Break Mujer Turquesa 40 2/3 Turquesa,Turquesa,40 2/3
Botas Boreal HURRICANE WS GRIS 38 Gris,Gris,38
Zapatillas Salomon Evasion 2 Aero Hombre Marron Amarillo 41 1/3 Marron,Marron,41 1/3
"Botas La Sportiva Trango Trk Leather Gtx Carbon 44,5 Carbon",Carbon,"44,5"
Zapatillas Nike Downshifter 8 Hombre Lobo Gris 43 Gris,Gris,43
Botas De Montaña Salomon Quest Origins 2 Gtx Hombre 42 Verde,Verde,42
ATTIPAS - Attipas los primeros pasos puzzle azul 20 AZUL,AZUL,20
"Zapatillas New Balance Gm500 Hombre Gris Plata 47,5 Plata",Plata,"47,5"
Pies de gato La Sportiva Genius 38.5 Rojo/Amarillo,Rojo/Amarillo,38.5
Sudadera Trangoworld Poppi Mujer Azul Rosa XS Azul/Rosa,Azul/Rosa,XS
Chaqueta Polar Campagnolo 38p1536 Mujer Rock 44 Roca,Roca,44
Sandalias Chiruca Guam 02 Hombre Marrón 42 Marron,Marron,42
Pies de gato La Sportiva Solution White-Yellow 41.5 Blanco/Amarillo,Blanco/Amarillo,41.5
Zapatillas Merrell Moab 2 GoreTex Hombre Beluga 42 Gris Oscuro,Gris Oscuro,42
"Zapatillas La Sportiva Helios 2.0 Hombre Carbón Azul Trópico 44,5 Carbon",Azul/Carbon,"44,5"
Zapatillas Running Nike Revolution 3 Hombre Azul 43 Azul/blanco,Azul/Blanco,43
ZAPATILLAS LA SPORTIVA MUTANT MUJER ÓPALO AGUA 36.5 Agua,Agua,36.5
Zapatillas Salomon Eos Goretex Mujer Fantasma 38 Gris,Gris,38
Zapatillas La Sportiva Akasha Mujer Ópalo Agua 42 Agua,Agua,42
Zapatillas Hi-tec Razor Low Wp Hombre Gris Naranja 45 Gris/naranja,Gris/Naranja,45
Botas Chiruca Patagonia 12 Hombre Marron 41 Marron,Marron,41
Pies de gato La Sportiva Solution White-Yellow 39 Blanco/Amarillo,Blanco/Amarillo,39
"Zapatillas La Sportiva Helios Sr Hombre Amarillo 38,5 Amarillo",Amarillo,"38,5"
Botas Chiruca Constanza 03 Gore-tex Negro 36 Negro,Negro,36
Sandalias Chiruca Malibu 05 Mujer Gris Morado 37 Gris,Gris,37
Botas Boreal BULNES 42 Marron,Marron,42
Zapatillas Boreal Sendai Vent Verde 42 Verde,Verde,42
ZAPATILLAS LA SPORTIVA KAPTIVA HOMBRE ÓPALO CHILE 47 Azul/Rojo,Azul/Rojo,47
Botas Chiruca Monique 07 Goretex Mujer Burdeos 37 Burdeos,Burdeos,37
Botas Chiruca Somiedo 02 GoreTex Hombre Marrón 41 Marron,Marron,41
Pies de gato La Sportiva Kataki Ocean-Sulphur 36 Azul/Amarillo,Azul/Amarillo,36
Zapatillas Nike Tanjun Hombre Negro 43 Negro,Negro,43
Zapatillas Boreal FUTURA ANTRACITA 39.5 Antracita,Antracita,39.5
Pies de gato La Sportiva Tarantula mujer Coral 38 Coral,Coral,38
Zapatillas Nike Downshifter 8 Hombre Gris Negro 43 Gris/negro,Gris/Negro,43
Botas La Sportiva Trango Tech Gtx Negro-Amarillo 42.5 Negro/Amarillo,Negro/Amarillo,42.5
Zapatillas Saucony Shadow 5000 Hombre Azul 44 Azul,Azul,44
Botas Chiruca Monique 07 Goretex Mujer Burdeos 38 Burdeos,Burdeos,38
Botas Boreal MAZAMA GRIS 39.5 Gris,Gris,39.5
BOTAS CHIRUCA TROLL 06 GORE-TEX LILA 38 Lila,Lila,38
Botas Boreal Maipo 42 Gris,Gris,42
Pies de gato La Sportiva Futura mujer Jade Green-White 36.5 Verde/Blanco,Verde/Blanco,36.5
CAMISETA INTERIOR TRX2 WOOL WM PRO TRANGO GRIS CLARO-GRIS OSCURO S Gris,Gris,S
"Zapatillas La Sportiva Mutant Mujer Cieruela Manzana Verde 36,5 Cereza",Verde/Cereza,"36,5"
Zapatillas Salomon Cove Hombre 42 Gris,Gris,42
Zapatillas Nike Revolution 4 Eu Hombre Negro Verde 41 Negro,Negro,41
ZAPATILLAS LA SPORTIVA URAGANO GORETEX HOMBRE NEGRO AMARILLO 42 Negro/Amarillo,Negro/Amarillo,42
ATTIPAS - Zapatos primeros pasos attipas tie 19 GRIS,GRIS,19
Zapatillas La Sportiva TX4 Gris 43 Gris,Gris,43
BOTAS CHIRUCA URALES 12 GORE-TEX MARRON 41 Marron,Marron,41
Zapatillas Salomon X Ultra 3 Gtx Hombre Negro Verde 41 1/3 Negro/verde,Negro/Verde,41 1/3
Zapatillas Skechers Gorun Fast Valor Hombre Rojo 43 Rojo,Rojo,43
