title,color,size
Pies de gato La Sportiva Genius 39 Rojo/Amarillo,Rojo/Amarillo,39
Pies de gato La Sportiva Cobra Slate 40.5 Gris,Gris,40.5
Botas Salomon Quest 4d 3 Gtx Hombre Negro 44 2/3 Negro,Negro,44 2/3
"Botas Boreal Mazama Marron 41,5 Marron",Marron,"41,5"
"Botas La Sportiva Trango Trk Leather Gtx Carbon 44,5 Carbon",Carbon,"44,5"
"Botas Boreal Mali 46,5 Morado",Morado,"46,5"
Botas Chiruca Xacobeo 12 Goretex Hombre Marron 39 Marron,Marron,39
Pies de gato La Sportiva Tarantula mujer Turquoise 38.5 Turquesa,Turquesa,38.5
Zapatillas Salomon Cove Hombre 42 Gris,Gris,42
"Zapatillas La Sportiva Akyra Hombre Naranja Negro 45,5 Naranja/negro",Naranja/Negro,"45,5"
Zapatillas Nike Downshifter 8 Hombre Gris Negro 46 Gris/negro,Gris/Negro,46
Zapatillas La Sportiva TX4 Gris 43 Gris,Gris,43
Botas Chiruca Massana 07 Gore-tex Burdeos 39 Burdeos,Burdeos,39
Zapatillas Salomon Ultra Pro Hombre Clima Tormentoso 43 1/3 Gris/Naranja,Gris/Naranja,43 1/3
"Zapatillas Saucony Xodus Iso 3 Mujer Arándano 38,5 Rosa",Rosa,"38,5"
Pantalones Breezy Coromell Mujer Negro Phlox XL Negro/Morado,Negro/Morado,XL
"Zapatillas La Sportiva Akyra Hombre Azul Oceano 42,5 Azul",Azul,"42,5"
ZAPATILLAS CHIRUCA ETNICO 03 GTX SURROUND MARINO-MARRON 42 Azul Marino,Azul Marino,42
Bermudas Ternua Mika Mujer Morado M Morado,Morado,M
Pantalones Breezy Coromell Mujer Negro Phlox L Negro/morado,Negro/Morado,L
"Zapatillas Boreal DROM GRIS 42,5 Gris",Gris,"42,5"
"Zapatillas La Sportiva Akasha Hombre Negro Naranja 45,5 Negro/Naranja",Negro/Naranja,"45,5"
Zapatillas trekking SALEWA Ms Wildfire Vent Hombre Marron 42 Marron,Marron,42
Zapatillas Saucony Jazz Original Vintage Azul Marino Hombre 41 Azul Marino,Azul Marino,41
"Botas Boreal Bamba Mid Marino 45,5 Azul Marino",Azul Marino,"45,5"
Zapatillas trekking Salewa Ms Speed Ascent Hombre Azul Amarillo 46 Azul/Amarillo,Azul/Amarillo,46
Bermuda Ternua Kross Hombre Borgoña L Burdeos,Burdeos,L
Botas La Sportiva G2 Sm Negro Amarillo 43 Negro/amarillo,Negro/Amarillo,43
Zapatillas Boreal GLOVE ANTRACITA 44 Antracita,Antracita,44
Chaqueta de fibras The North Face Thermoball Hoodie Hombre Azul Azul XL Azul/Azul,Azul/Azul,XL
Zapatillas De Trekking Salomon X Ultra 3 Hombre Negro 41 1/3 Negro,Negro,41 1/3
Zapatillas Nike Downshifter 8 Mujer Piedra Pómez 40 Verde,Verde,40
Pantalones Trekking Salomon Wayfarer Capri Hombre L Kaki,Kaki,L
BOTAS CHIRUCA TROLL 06 GORE-TEX LILA 30 Lila,Lila,30
Pies de gato La Sportiva TC Pro 37.5 Crema,Crema,37.5
Zapatillas Saucony Excursion Tr12 Mujer Morado 38 Morado,Morado,38
"Botas Boreal Mali 46,5 Morado",Morado,"46,5"
Botas Boreal NELION WOMEN'S 40 3/4 Lima,Lima,40 3/4
"Botas Boreal Ketil Verde 39,5 Verde",Verde,"39,5"
Zapatillas The North Face Tent Mule Iv Mujer Negro 36/38 Negro,Negro,36/38
Botas Boreal BAMBA MID GRIS 39.5 Gris,Gris,39.5
"Zapatillas Boreal Magma Grafito 46,5 Gris Oscuro",Gris Oscuro,"46,5"
Chaqueta De Punto Campagnolo 38h2237 Hombre Cyano 50 Azul,Azul,50
Zapatillas Columbia Peakfreak Venture LT Hombre Cordobés 43 Chocolate,Chocolate,43
"Zapatillas La Sportiva Akyra Hombre Naranja Negro 45,5 Naranja/negro",Naranja/Negro,"45,5"
Zapatillas La Sportiva TX4 Mujer Gris 42 Gris,Gris,42
Botas Chiruca Patagonia 12 Hombre Marron 41 Marron,Marron,41
"Botas La Sportiva Nepal Cube Gtx Amarillo 39,5 Amarillo",Amarillo,"39,5"
BOTAS CHIRUCA GALICIA 02 GORE-TEX MARRON 43 Marron,Marron,43
Botas De Montaña Chiruca Labrador Boa Goretex Hombre 45 Marron,Marron,45
Botas De Montaña Salomon X Ultra 3 Mid Gtx Mujer Gris 41 1/3 Gris,Gris,41 1/3
Botas De Montaña Salewa Ms Mtn Trainer Mid Goretex Hombre Gris 45 Gris,Gris,45
Zapatillas Salomon Sense Ride 2 Hombre Ilusión Azul 44 2/3 Azul,Azul,44 2/3
Chaqueta Trx2 Soft Pro Trango Naranja Intenso-calabaza L Naranja,Naranja,L
Chaqueta Mac In A Sac Mias Origin Kaki L Kaki,Kaki,L
Botas Boreal KERALA GRIS 41.5 Gris,Gris,41.5
Pies de gato La Sportiva Otaki Blue-Flame 37 Azul/Naranja,Azul/Naranja,37
Zapatillas Boreal TEMPEST LOW GRAFITO 45.5 Gris Oscuro,Gris Oscuro,45.5
Zapatillas Boreal TEMPEST LOW GRAFITO 45.5 Gris Oscuro,Gris Oscuro,45.5
Botas Hi-Tec Gregal Mid WP Hombre Marron 43 Marron,Marron,43
Mochila Trail Running Salomon S-lab Sense 2 Set Negro L Negro,Negro,L
Botas La Sportiva Trango Trk Gtx Amarillo Negro 41.5 Amarillo/Negro,Amarillo/Negro,41.5
Forro Polar Campagnolo 3g10747 Hombre Negro Blanco 48 Negro/Blanco,Negro/Blanco,48
Botas Boreal NELION WOMEN'S 42 Lima,Lima,42
CAMISETA INTERIOR TRX2 WOOL WM PRO TRANGO GRIS CLARO-GRIS OSCURO M Gris,Gris,M
Pies de gato La Sportiva Futura mujer Jade Green-White 37 Verde/Blanco,Verde/Blanco,37
Botas Chiruca Sarria 07 Mujer Gris Burdeos 39 Gris,Gris,39
BOTAS CHIRUCA MASSANA 02 GORE-TEX MARRON 41 Marron,Marron,41
"Zapatillas Trail Running La Sportiva Akyra Mujer Verde 37,5 Verde",Verde,"37,5"
BOTAS CHIRUCA CALIBRE 22 GORE-TEX MARRON 42 Marron,Marron,42
BOTAS CHIRUCA TROLL 06 GORE-TEX LILA 28 Lila,Lila,28
Zapatillas Boreal BAMBA ANTRACITA 39.5 Antracita,Antracita,39.5
Botas De Montaña Salewa Ms Mtn Trainer Mid Goretex Hombre Gris 45 Gris,Gris,45
Zapatillas New Balance Wl574 Mujer Coral 39 Coral,Coral,39
Botas Boreal BAMBA MID WS GRIS 37.5 Gris,Gris,37.5
Pies de gato La Sportiva Katana Tangerine-Tropic Blue 42.5 Naranja/Azul,Naranja/Azul,42.5
Zapatillas Trail Running La Sportiva Ultra Raptor Hombre Naranja Gris 43 Naranja/gris,Naranja/Gris,43
Zapatillas Columbia Peakfreak Venture LT Hombre Cordobés 43.5 Chocolate,Chocolate,43.5
Zapatillas Trail Running Salomon Xa Pro 3d Gtx Hombre Navy 46 2/3 Navy,Navy,46 2/3
Pies de gato La Sportiva Otaki Blue-Flame 45 Azul/Naranja,Azul/Naranja,45
Botas Chiruca Sarria 07 Mujer Gris Burdeos 38 Gris,Gris,38
Zapatillas Saucony Jazz Original Vintage Azul Marino Hombre 41 Azul Marino,Azul Marino,41
BOTAS CHIRUCA MASSANA 02 GORE-TEX MARRON 39 Marron,Marron,39
Pies de gato La Sportiva Miura mujer White-Jade Green 34 Blanco/Verde,Blanco/Verde,34
Zapatillas Boreal Bamba Amarillo 44 Amarillo,Amarillo,44
Zapatillas Chiruca Maracaibo 19 Morado 37 Morado,Morado,37
Zapatillas New Balance Fresh Foam Cruz On Hombre Negro Imán 42 Negro,Negro,42
Sandalias Chiruca Guam 02 Hombre Marrón 42 Marron,Marron,42
Zapatillas New Balance Fuel Core Coast Mujer Rosa 39 Rosa,Rosa,39
Sudadera Trekking Trangoworld Atran Hombre Azul 2xl Azul Mar,Azul mar,2XL
Chaqueta Ganin Ft Trango Verde Lima L Lima,Lima,L
Pies de gato La Sportiva Kataki Ocean-Sulphur 36 Azul/Amarillo,Azul/Amarillo,36
Botas La Sportiva Trango Trk Leather Gtx Gris Verde 41 Carbon,Carbon,41
Zapatillas trail running La Sportiva Mutant Hombre Gris Lima 43 Gris/Verde,Gris/Verde,43
Zapatillas La Sportiva Akyra GoreTex Hombre Neptuno Amapola 41 Azul/Rojo,Azul/Rojo,41
Botas La Sportiva Trango Tech Gtx Negro-Amarillo 40.5 Negro/Amarillo,Negro/Amarillo,40.5
Chaqueta Columbia Lake 22 Down Hombre Jaspe Rojo L Rojo,Rojo,L
BOTAS CHIRUCA RIGLOS 05 GRIS 40 Gris,Gris,40
Botas Boreal KLAMATH WMN'S LILA 38 3/4 Lila,Lila,38 3/4
Zapatillas Salomon X Ultra 3 Gtx Hombre Azul Azul 42 Azul/azul,Azul/Azul,42
Pies de gato La Sportiva TaRENTula 44 Gris,Gris,44
Zapatillas New Balance ML574 Hombre Burdeos 44 Burdeos,Burdeos,44
Zapatillas Salomon Xa Pro 3d Hombre Azul Naranja 42 2/3 Azul/naranja,Azul/Naranja,42 2/3
BOTAS CHIRUCA CARES 52 GORE-TEX MARRON 41 Marron,Marron,41
Pies de gato La Sportiva Finale mujer Grey-Coral 35 Gris/Coral,Gris/Coral,35
Chaqueta Hara Trango Amaranto M Violeta,Violeta,M
Calcetines Compressport Training Pack De 2 Azul 42 - 44 Azul,Azul,42 - 44
BOTAS CHIRUCA CLETA 02 MARRON 41 Marron,Marron,41
BOTAS CHIRUCA MASSANA 05 GORE-TEX ASFALTO-ROJO 40 Asfalto,Asfalto,40
Pantalones Trangoworld Dobu Fi Hombre Negro M Negro,Negro,M
Zapatillas La Sportiva Jynx Niños 27-35 Ópalo Manzana Verde 34 Azul,Azul,34
Medias de compresión Compressport R2 Amarillo Azul T4 Amarillo/Azul,Amarillo/Azul,T4
Zapatillas Boreal FLYERS VENT WS 37.5 Gris,Gris,37.5
Pantalones Cortos Senderismo +8000 Tremaya Mujer Negro Fuxia M Negro/fuxia,Negro/Fuxia,M
Chaqueta de plumas Breezy Cefira Mujer Silver L Silver,Silver,L
Saco Lc 450 Ua Trango Negro-antracita Derecha Negro,Negro,Derecha
Botas La Sportiva G2 Sm Negro Amarillo 44 Negro/amarillo,Negro/Amarillo,44
Botas Boreal FLYERS MID 40 Gris/Amarillo,Gris/Amarillo,40
Chaqueta La Sportiva Promo Fleece Mujer Negro M Negro/Amarillo,Negro/Amarillo,M
Zapatillas New Balance KD373 Morado 40 Morado,Morado,40
Chaqueta Argualas Trango Verde Caza L Verde,Verde,L
Zapatillas La Sportiva Akyra Hombre Gris Azul 43 Gris/Azul,Gris/Azul,43
Pies de gato La Sportiva Katana Tangerine-Tropic Blue 39 Naranja/Azul,Naranja/Azul,39
Pies de gato La Sportiva Solution mujer White-Lily Orange 39 Blanco/Naranja,Blanco/Naranja,39
Camiseta Trangoworld Omiz Hombre Naranja L Naranja,Naranja,L
Botas Boreal Ordesa Women's Gris 38 3/4 Gris,Gris,38 3/4
Pies de gato La Sportiva Mythos Terra 39.5 Tierra Oscura,Tierra Oscura,39.5
Zapatillas Saucony Excursion Tr11 Hombre Rojo Gris 42 Rojo/gris,Rojo/Gris,42
Botas Salewa Ms Mtn Trainer Mid Goretex Hombre Negro Amarillo 41 Negro/amarillo,Negro/Amarillo,41
Pies de gato La Sportiva Skwama mujer Apple Green-Cobalt Blue 33 Verde/Azul,Verde/Azul,33
Pies de gato La Sportiva Finale Sulphur-Blue 39.5 Amarillo/Azul,Amarillo/Azul,39.5
Zapatillas La Sportiva TX4 Mujer Gris 37.5 Gris,Gris,37.5
Zapatillas Salomon Xa Pro 3d Hombre Azul Naranja 42 2/3 Azul/naranja,Azul/Naranja,42 2/3
BOTAS CHIRUCA PANTICOSA 06 GORE-TEX GRIS 40 Gris,Gris,40
Zapatillas Salomon Xa Pro 3d Goretex Hombre Negro 44 Negro,Negro,44
Zapatillas La Sportiva Unika Hombre Carbón Azul 45 Gris/azul,Gris/Azul,45
BOTAS CHIRUCA TROLL 03 GORE-TEX AZUL MARINO 38 Azul Marino,Azul Marino,38
Botas De Montaña Salewa Ms Crow Gtx Hombre 41 Negro/naranja,Negro/Naranja,41
Botas Boreal SIANA CORAL 37.5 Coral,Coral,37.5
Botas Boreal TURKANA GRIS 37 Gris,Gris,37
CHIRUCA BOXER BOA 01 GORETEX HOMBRE 43 Marron verdoso,Marron verdoso,43
Zapatillas Boreal FUTURA WS GRIS 42 Gris,Gris,42
Pies de gato La Sportiva Finale Sulphur-Blue 38 Amarillo/Azul,Amarillo/Azul,38
Pies de gato La Sportiva TaRENTula 40.5 Gris,Gris,40.5
Zapatillas La Sportiva Wild Cat Mujer Gris Rojo 37.5 Gris/Rojo,Gris/Rojo,37.5
BOTAS CHIRUCA CARES 52 GORE-TEX MARRON 39 Marron,Marron,39
Zapatillas Boreal BAMBA W'S GRANATE 37.5 Granate,Granate,37.5
Chaqueta De Plumas Icepeak  Kaarl Hombre 54 Azul,Azul,54
Botas Boreal TURKANA GRIS 42 Gris,Gris,42
"Zapatillas Saucony Excursion Tr12 Hombre Negro Azul 42,5 Negro/azul",Negro/Azul,"42,5"
Zapatillas Nike Revolution 4 Eu Hombre Navy Medianoche 42 Azul Marino,Azul Marino,42
Chaqueta Campagnolo Hybrid 3E48367 Hombre 54 Antracita,Antracita,54
Botas Boreal TURKANA GRIS 39.5 Gris,Gris,39.5
Pies de gato La Sportiva TaRENTula 43.5 Gris,Gris,43.5
Botas Boreal YUCATAN MARRON 40 Marron,Marron,40
Zapatillas Trekking Salewa Wildfire Pro Goretex Hombre 45 Azul,Azul,45
Zapatillas trail running Salomon Xa Pro 3D GTX Hombre Navy 41 1/3 Navy,Navy,41 1/3
BOTAS CHIRUCA BERREA Hi Vis 08 GORE-TEX MARRON-NARANJA 42 Marron,Marron,42
ImseVimse - Bañador-pañal imsevimse con volante L Rosa flamingo,Rosa flamingo,L
"Botas Boreal Apache Gris 46,5 Gris",Gris,"46,5"
CHAQUETA TRX2 SHELL WM PRO GTX TRANGO MORADO-MORADO XS Morado,Morado,XS
Botas Boreal DROM MID GRAFITO 45.5 Gris/Verde,Gris/Verde,45.5
Zapatillas New Balance Fuel Core Coast Mujer Rosa 39 Rosa,Rosa,39
Zapatillas Chiruca Spider Gtx 09 Gore-tex Negro-rojo 42 Negro/rojo,Negro/Rojo,42
Botas Hi-Tec Garcia Sport Wp Hombre Gris 44 Gris,Gris,44
Zapatillas Saucony Shadow 5000 Vintage Hombre Verde 41 Verde,Verde,41
Pies de gato La Sportiva Kataki Ocean-Sulphur 43.5 Azul/Amarillo,Azul/Amarillo,43.5
Zapatillas New Balance Fresh Foam Cruz On Hombre Azul 42 Azul,Azul,42
Chaqueta Trx2 Stretch Pro Trango Azul-azul Oscuro 3xl Azul,Azul,3XL
BOTAS CHIRUCA CLETA 02 MARRON 39 Marron,Marron,39
Zapatillas Boreal GLOVE OLIVA 39.5 Verde oliva,Verde oliva,39.5
Botas Boreal BAMBA MID WS GRIS 37 Gris,Gris,37
Chiruca Pointer 01 Goretex Hombre Marrón 47 Marron,Marron,47
"Botas La Sportiva Trango Trk Leather Gtx Carbon 44,5 Carbon",Carbon,"44,5"
Sandalias New Balance Cruiser K2013 Niños Blanco Lila 31 Blanco/morado,Blanco/Morado,31
ATTIPAS - Calzado los primeros pasos urban attipas 19 AMARILLO,AMARILLO,19
Zapatillas Saucony Excursion Tr12 Mujer Azul Negro 38 Azul/negro,Azul/Negro,38
Zapatillas Salomon X Radiant Goretex Hombre Beluga 44 Gris Oscuro,Gris Oscuro,44
Zapatillas Columbia Ivo Trail Hombre Negro Vapor 44 Negro,Negro,44
BOTAS CHIRUCA MONIQUE 09 GORE-TEX GRIS-ROJO 40 Gris/Rojo,Gris/Rojo,40
ZAPATILLAS CHIRUCA TASMANIA 10 GORE-TEX GRIS 40 Gris,Gris,40
Zapatillas Boreal GLOVE W'S GRIS 42 Gris,Gris,42
Botas The North Face Hedgehog Fastpack Mid Gtx Hombre Negro 47 Negro,Negro,47
Pies de gato La Sportiva Solution White-Yellow 41 Blanco/Amarillo,Blanco/Amarillo,41
ATTIPAS - Attipas calzado los primeros pasos polka rosa 19 ROSA,ROSA,19
Zapatillas Salomon X Ultra 3 Gtx Hombre Gris Amarillo 42 Gris/amarillo,Gris/Amarillo,42
Chaqueta Haglöfs Heron Hombre Pizarra M Pizarra,Pizarra,M
Zapatillas Boreal SENDAI GRIS 41.5 Gris,Gris,41.5
Pies de gato La Sportiva TC Pro 39 Crema,Crema,39
"Zapatillas Trail Running La Sportiva Akyra Mujer Verde 37,5 Verde",Verde,"37,5"
Zapatillas Saucony Shadow 5000 Hombre Azul 44 Azul,Azul,44
"Botas La Sportiva Nepal Cube Gtx Amarillo 39,5 Amarillo",Amarillo,"39,5"
Chaqueta Salomon Bonatti Race Wp Hombre Gris S Gris,Gris,S
Botas Chiruca Game Hi Vis 08 GoreTex Hombre 40 Marron,Marron,40
Zapatillas Salomon X Ultra 3 Gtx Hombre Negro Verde 42 2/3 Negro/verde,Negro/Verde,42 2/3
Chaqueta trail running Salomon Bonatti Wp Hombre Azul Naranja S Azul/Naranja,Azul/Naranja,S
Botas Millet High Route Goretex Hombre Negro Verde Ácido 45 1/3 Negro/verde,Negro/Verde,45 1/3
Zapatillas Saucony Excursion Tr11 Hombre Gris Burdeos 42 Gris/rojo,Gris/Rojo,42
Zapatillas Nike Downshifter 8 Hombre Lobo Gris 43 Gris,Gris,43
Zapatillas Nike Downshifter 8 Hombre Azul 43 Azul,Azul,43
Zapatillas Salomon X Ultra 3 Gtx Hombre Negro Verde 41 1/3 Negro/verde,Negro/Verde,41 1/3
Zapatillas New Balance Fresh Foam Cruz On Hombre Negro Imán 42 Negro,Negro,42
Sudadera +8000 Almaden J 044 Niños Azul 8 Azul,Azul,8
Botas Boreal APACHE MARRON 42.5 Marron,Marron,42.5
BOTAS CHIRUCA MONIQUE 09 GORE-TEX GRIS-ROJO 40 Gris/Rojo,Gris/Rojo,40
BOTAS CHIRUCA MASSANA 05 GORE-TEX ASFALTO-ROJO 40 Asfalto,Asfalto,40
Pantalones Cortos Trango World Yittu Mujer Morado M Morado,Morado,M
ATTIPAS - Zapatos attipas primeros pasos cutie rosa 25.5 ROSA,ROSA,25.5
Pantalones Campagnolo Long Pant 3d44977 Hombre Azul Oscuro 48 Azul Oscuro,Azul oscuro,48
Botas Boreal Tempest Mid Marron 43 1/4 Marron,Marron,43 1/4
Botas Boreal KLAMATH WMN'S LILA 38 3/4 Lila,Lila,38 3/4
ZAPATILLAS LA SPORTIVA MUTANT MUJER ÓPALO AGUA 40 Agua,Agua,40
Chaqueta trail running Salomon Bonatti Wp Hombre Azul Naranja S Azul/Naranja,Azul/Naranja,S
Pies de gato La Sportiva TaRENTula 41.5 Gris,Gris,41.5
Botas Montaña Millet Ld High Route Mesh Mujer 38 Gris,Gris,38
Chaqueta Ternua Jaksam Hombre Verde M Verde,Verde,M
Botas Boreal ORDESA WOMEN'S GRIS 39.5 Gris,Gris,39.5
"ATTIPAS - Attipas los primeros pasos puzzle gris 21,5 GRIS",GRIS,"21,5"
Pies de gato La Sportiva Katana Tangerine-Tropic Blue 46 Naranja/Azul,Naranja/Azul,46
Zapatillas Hi-Tec Ravus Adventure Low Wp Hombre Marron 41 Marron,Marron,41
Botas Chiruca Massana 07 Gore-tex Burdeos 37 Burdeos,Burdeos,37
Botas Boreal TURKANA MARRON 40 Marron,Marron,40
Botas Boreal BAMBA MID WS GRIS 38 Gris,Gris,38
"Calcetines Icebreaker Hike+ Light Crew Hombre 39 - 41,5 Gris",Gris,"39 - 41,5"
Zapatillas La Sportiva Ultra Raptor Hombre Negro Verde 42.5 Negro/Verde,Negro/Verde,42.5
"Zapatillas Saucony Xodus Iso 2 Mujer Violeta 38,5 Violeta",Violeta,"38,5"
Botas Boreal Ordesa Wmn's Morado 38 Morado,Morado,38
Zapatillas Salomon Sense J Niños Tarde Azul 38 Azul,Azul,38
Chaqueta Polar Campagnolo 38p1536 Mujer Rock 44 Roca,Roca,44
Zapatillas trail running La Sportiva Akasha Hombre Negro 43 Negro/Amarillo,Negro/Amarillo,43
Camiseta Termica Hg Sport 8010 Hombre XL Blanco,Blanco,XL
ATTIPAS - Calzado los primeros pasos urban attipas 20 AMARILLO,AMARILLO,20
Zapatillas Trekking Salomon Cove Mujer 36 Gris,Gris,36
Chaqueta Trx2 Loft Pro Trango Azul Oscuro-azul Oscuro 2xl Azul,Azul,2XL
BOTAS CHIRUCA BERREA Hi Vis 08 GORE-TEX MARRON-NARANJA 43 Marron,Marron,43
Zapatillas trekking SALEWA Ms Wildfire Vent Hombre Marron 43 Marron,Marron,43
"Zapatillas Saucony Jazz Trail Original Hombre Púrpura 44,5 Púrpura",Púrpura,"44,5"
Pies de gato La Sportiva Finale Brown-Orange 39.5 Marrón/Naranja,Marrón/Naranja,39.5
Chaqueta trail running La Sportiva Hail Hombre Naranja Azul S Naranja/Azul,Naranja/Azul,S
Zapatillas Salomon Xa Pro 3d Goretex Hombre Lyon Azul 44 Azul,Azul,44
Zapatillas New Balance Kd373 Marron 37 Marron,Marron,37
Pies de gato La Sportiva Solution mujer White-Lily Orange 37.5 Blanco/Naranja,Blanco/Naranja,37.5
Zapatillas Nike Tanjun Se Hombre Verde 44 Verde oliva,Verde oliva,44
"Zapatillas Boreal Chameleon Azul 44,5 Azul",Azul,"44,5"
Zapatillas New Balance Gc574 Azul 40 Azul,Azul,40
Botas Trekking Salomon Authentic Ltr Gtx Hombre Negro Café 43 1/3 Negro/café,Negro/Café,43 1/3
Zapatillas New Balance Fresh Foam Cruz On Hombre Burdeos Negro 44 Burdeos,Burdeos,44
Chaqueta Polux Trango Rojo-negro 2xl Rojo/negro,Rojo/Negro,2XL
Calcetines Running Compressport Pro Racing Socks V3.0 Ultralight High Azul 42 - 44 Azul,Azul,42 - 44
Zapatillas Salomon X Ultra 3 Prime Goretex Mujer Málaga 37 1/3 Rosa,Rosa,37 1/3
Zapatillas Saucony Azura Hombre Blanco 41 Blanco,Blanco,41
"ATTIPAS - Zapatos primeros pasos attipas tie 21,5 GRIS",GRIS,"21,5"
BOTAS CHIRUCA GREDOS SUPRA 05 GORE-TEX GRIS 41 Gris,Gris,41
Calcetines running Compressport Run High V3 Blanco Rosa 39/41 Blanco/Rosa,Blanco/Rosa,39/41
ZAPATILLAS LA SPORTIVA URAGANO GORETEX HOMBRE NEGRO AMARILLO 44.5 Negro/Amarillo,Negro/Amarillo,44.5
Saucony Jazz Original Vintage Mujer Granate 38 Granate,Granate,38
Chaqueta Bern Trango Negro M Negro,Negro,M
"Botas Boreal Ketil Verde 39,5 Verde",Verde,"39,5"
Zapatillas Salomon X Ultra 3 Gtx Hombre Azul Azul 41 1/3 Azul/azul,Azul/Azul,41 1/3
Pies de gato La Sportiva Katana Tangerine-Tropic Blue 39 Naranja/Azul,Naranja/Azul,39
Zapatillas Boreal TEMPEST LOW GRAFITO 45.5 Gris Oscuro,Gris Oscuro,45.5
Chaqueta trail running Salomon Bonatti Wp Hombre Azul Naranja M Azul/Naranja,Azul/Naranja,M
"Zapatillas Saucony Excursion Tr12 Mujer Azul Negro 38,5 Azul/negro",Azul/Negro,"38,5"
Zapatillas Nike Flex Contact 2 Hombre Antracita 43 Antracita,Antracita,43
Zapatillas Boreal TEMPEST LOW GRAFITO 45.5 Gris Oscuro,Gris Oscuro,45.5
"Zapatillas La Sportiva Akasha Mujer Gris Verde 38,5 Gris/verde",Gris/Verde,"38,5"
Zapatillas Salomon X Ultra 3 Goretex Hombre Cuerda Elástica 47 1/3 Marron,Marron,47 1/3
Zapatillas Salomon Ultra Pro Mujer Azulejo Azul 40 Azul,Azul,40
Botas La Sportiva Nepal Trek Evo Gtx Antracita-rojo 41 Antracita,Antracita,41
Zapatillas Saucony Jazz Original Vintage Hombre Azul 39 Azul,Azul,39
Mochila Trail Running Salomon Adv Skin 5 Set Rojo Negro M/l Rojo/negro,Rojo/Negro,M/L
Zapatillas Salomon Ultra Pro Hombre Naranja Azul 42 Naranja/azul,Naranja/Azul,42
"ATTIPAS - Attipas calzado los primeros pasos sneakers gris 22,5 GRIS",GRIS,"22,5"
Botas Boreal Tempest Mid Azul 43 1/4 Azul,Azul,43 1/4
Pies de gato La Sportiva Skwama mujer Apple Green-Cobalt Blue 36.5 Verde/Azul,Verde/Azul,36.5
Zapatillas Saucony Excursion Tr12 Mujer Azul Negro 38 Azul/negro,Azul/Negro,38
Sandalias Senderismo Campagnolo Aquarii Mujer Hielo 40 Beig,Beig,40
Zapatillas Columbia Canyon Point Waterproof Hombre Carbon 48 Carbon,Carbon,48
Camiseta Ternua Talok 1/2 Zip Hombre Mousse Grey S Gris,Gris,S
Zapatillas Nike Tanjun Se Hombre Azul 42 Azul,Azul,42
BOTAS CHIRUCA CARES 52 GORE-TEX MARRON 41 Marron,Marron,41
Chaqueta Campagnolo 3E13116 Mujer Grafito Iris 40 Gris,Gris,40
Zapatillas Hi-Tec Ravus Vent Low Wp Hombre Gris 46 Gris,Gris,46
Botas Columbia Canyon Point Mid Waterproof Mujer Rojo Marsala 40 Rojo,Rojo,40
Calcetines Trail Running Compressport Pro Racing Socks V3.0 Verde 39/41 Verde,Verde,39/41
Zapatillas La Sportiva Ultra Raptor Hombre Negro Verde 46 Negro/Verde,Negro/Verde,46
Botas Boreal FLYERS MID 41.5 Gris/Amarillo,Gris/Amarillo,41.5
Chaqueta de fibras The North Face Thermoball Hoodie Hombre Azul Azul XL Azul/Azul,Azul/Azul,XL
Chaqueta Peyrol Trango Negro 2xl Negro,Negro,2XL
Zapatillas Trail Running La Sportiva Ultra Raptor Hombre Naranja Gris 47 Gris/naranja,Gris/Naranja,47
Zapatillas Trail Running Salomon Wings Pro 2 Hombre Azul Verde 46 Azul/verde,Azul/Verde,46
Zapatillas Salomon X Radiant Goretex Hombre Beluga 42 2/3 Gris Oscuro,Gris Oscuro,42 2/3
BOTAS CHIRUCA SOMIEDO 05 GORE-TEX GRIS 44 Gris,Gris,44
Pies de gato La Sportiva TC Pro 39 Crema,Crema,39
"Zapatillas Trail Running La Sportiva Bushido Hombre Azul Oscuro 41,5 Azul Oscuro",Azul oscuro,"41,5"
Botas Boreal ASPEN 31 Gris/Rojo,Gris/Rojo,31
Botas La Sportiva Trango Tech Gtx Negro-Amarillo 42.5 Negro/Amarillo,Negro/Amarillo,42.5
Chaqueta trail running Salomon Bonatti Wp Hombre Azul Naranja M Azul/Naranja,Azul/Naranja,M
Pies de gato La Sportiva Otaki Blue-Flame 41.5 Azul/Naranja,Azul/Naranja,41.5
Zapatillas trail running La Sportiva Mutant Hombre Gris Lima 42 Gris/Verde,Gris/Verde,42
Pies de gato La Sportiva Katana Tangerine-Tropic Blue 42.5 Naranja/Azul,Naranja/Azul,42.5
Pantalones TrangoWorld Otago Hombre Gris Naranja M Gris/Naranja,Gris/Naranja,M
Zapatillas Nike Tanjun Se Hombre Azul 44 Azul,Azul,44
Pantalones Running Salomon Agile Short Mujer Negro L Negro,Negro,L
Pies de gato La Sportiva Tarantula mujer Turquoise 40 Turquesa,Turquesa,40
Pies de gato La Sportiva Katana mujer White-Purple 36.5 Blanco/Morado,Blanco/Morado,36.5
"Botas The North Face Hedgehog Fastpack Mid Gtx Hombre Negro 42,5 Negro",Negro,"42,5"
Pies de gato La Sportiva Futura mujer Jade Green-White 34 Verde/Blanco,Verde/Blanco,34
BOTAS CHIRUCA CLETA 02 MARRON 39 Marron,Marron,39
Pies de gato La Sportiva Katana mujer White-Purple 41.5 Blanco/Morado,Blanco/Morado,41.5
Pies de gato La Sportiva Mythos Terra 45 Tierra Oscura,Tierra Oscura,45
Zapatillas Boreal GLOVE OLIVA 42 Verde oliva,Verde oliva,42
Botas Chiruca Monique 07 Goretex Mujer Burdeos 38 Burdeos,Burdeos,38
Saucony Jazz Original Vintage Verde Mujer 41 Verde,Verde,41
Pantalones Running The North Face Versitas Short Mujer Morado L Morado,Morado,L
Zapatillas Trail Running Salomon Wings Flyte Goretex Hombre Gris  42 Gris,Gris,42
Zapatillas Saucony Jazz Original Vintage Mujer Gris Negro 40 Gris/negro,Gris/Negro,40
Botas Hi-Tec Garcia Sport Wp Hombre Gris 41 Gris,Gris,41
Pies de gato La Sportiva Katana Yellow-Black 38.5 Amarillo/Negro,Amarillo/Negro,38.5
"Zapatillas De Trekking The North Face Hedgehog Fastpack Gtx Hombre Azul 42,5 Azul",Azul,"42,5"
Pantalones Ternua Natib Hombre Plata Profunda S Plata,Plata,S
Sandalias Chiruca Baleares 01 Beig-verde 39 Beig,Beig,39
Zapatillas La Sportiva Jynx Niños 36-40 Ópalo Manzana Verde 37 Azul,Azul,37
Zapatillas Saucony Jazz Original Vintage Hombre Verde Kaki 43 Verde,Verde,43
BOTAS CHIRUCA GREDOS SUPRA 05 GORE-TEX GRIS 37 Gris,Gris,37
Zapatillas Boreal DROM W'S MORADO 39.5 Morado,Morado,39.5
Chaleco Trx2 800 Pro Trango Negro-negro M Negro,Negro,M
Botas Boreal ASPEN GIRLS 30 Gris/Turquesa,Gris/Turquesa,30
CAMISETA INTERIOR TRX2 WOOL WM PRO TRANGO GRIS CLARO-GRIS OSCURO XL Gris,Gris,XL
Botas La Sportiva Trango Trk Gtx Amarillo Negro 41 Amarillo/Negro,Amarillo/Negro,41
"Botas La Sportiva G5 Negro Amarillo 44,5 Negro/amarillo",Negro/Amarillo,"44,5"
Saucony Jazz Original Vintage Verde Mujer 41 Verde,Verde,41
Chaqueta Trail Running Salomon Bonatti Wp Hombre Naranja M Naranja,Naranja,M
Botas Boreal Apache Gris 43 1/4 Gris,Gris,43 1/4
Zapatillas Salomon Sense Ride 2 Hombre Ilusión Azul 45 1/3 Azul,Azul,45 1/3
Zapatillas Nike Flex Experience Rn 7 Mujer Lobo Gris 38 Gris/blanco,Gris/Blanco,38
Zapatillas Boreal Magma Hombre Marrón 47 Marron,Marron,47
Botas Boreal ORDESA WOMEN'S GRIS 38 Gris,Gris,38
Zapatillas Skechers Gorun Fast Valor Hombre Rojo 42 Rojo,Rojo,42
BOTAS CHIRUCA GALICIA 02 GORE-TEX MARRON 41 Marron,Marron,41
Zapatillas Boreal FUTURA WS ROJO 37 Gris,Gris,37
Zapatillas Saucony Excursion Tr12 Hombre Negro Azul 44 Negro/azul,Negro/Azul,44
ATTIPAS - Attipas calzado los primeros pasos polka rosa 19 ROSA,ROSA,19
Botas De Nieve Salewa Ws Capsico Mid Insulated Mujer 38 Gris,Gris,38
Botas La Sportiva Olympus Mons Evo Negro Amarillo 41 Negro/amarillo,Negro/Amarillo,41
Pies de gato La Sportiva Miura mujer White-Jade Green 36 Blanco/Verde,Blanco/Verde,36
Pies de gato La Sportiva Skwama Black-Yellow 35 Negro/Amarillo,Negro/Amarillo,35
Botas Boreal DROM MID GRAFITO 39.5 Gris/Verde,Gris/Verde,39.5
"ATTIPAS - Attipas calzado los primeros pasos polka rosa 21,5 ROSA",ROSA,"21,5"
Botas Campagnolo Rigel Mid Wp Hombre Madera 45 Marron,Marron,45
Sandalias De Descanso Salomon Rx Break Mujer Rosa 41 1/3 Rosa,Rosa,41 1/3
Zapatillas Saucony Jazz Original Vintage Niños Verde 32 Verde,Verde,32
Pies de gato La Sportiva Finale mujer Grey-Coral 33.5 Gris/Coral,Gris/Coral,33.5
Chaqueta de fibras The North Face Thermoball Full Zip Hombre Asfalto S Asfalto,Asfalto,S
Zapatillas Saucony Jazz Original Vintage Niños Navy 35 Navy,Navy,35
ZAPATILLAS LA SPORTIVA MUTANT MUJER ÓPALO AGUA 37.5 Agua,Agua,37.5
"Botas Boreal Apache Marron 45,5 Marron",Marron,"45,5"
ATTIPAS - Zapatos attipas primeros pasos cutie rosa 24 ROSA,ROSA,24
Pies de gato La Sportiva Katana Yellow-Black 46 Amarillo/Negro,Amarillo/Negro,46
Zapatillas Boreal BAMBA ANTRACITA 44.5 Antracita,Antracita,44.5
Zapatillas Salomon Ultra Pro Hombre Clima Tormentoso 45 1/3 Gris/Naranja,Gris/Naranja,45 1/3
Botas Montaña Millet Ld High Route Mesh Hombre 43 1/3 Gris,Gris,43 1/3
Botas Boreal SIANA MORADO 41.5 Morado,Morado,41.5
Zapatillas trail running Salomon Xa Enduro Hombre 44 2/3 Azul/Naranja,Azul/Naranja,44 2/3
Zapatillas Salomon X Ultra 3 Gtx Mujer Gris 40 2/3 Gris,Gris,40 2/3
Zapatillas Salomon Ultra Pro Mujer Azulejo Azul 39 1/3 Azul,Azul,39 1/3
Botas Chiruca Xacobeo 05 GoreTex Hombre Gris Petroleo 44 Gris,Gris,44
