title,color,size
Botas de montaña salomon x alp mid ltr gtx hombre gris 41 1/3 gris,Gris,41 1/3
zapatillas la sportiva uragano goretex hombre negro amarillo 44.5 negro/amarillo,Negro/Amarillo,44.5
Sandalias Salomon Rx Break Hombre Perla Azul 42 2/3 Azul/verde,Azul/Verde,42 2/3
Botas Boreal Ordesa Wmn's Morado 38 Morado,Morado,38
Chaqueta mac in a sac mias origin kaki l kaki,Kaki,L
zapatillas de trekking salomon x ultra 3 hombre azul poseidon 45 1/3 azul,Azul,45 1/3
Zapatillas la sportiva mutant mujer ópalo agua 41.5 agua,Agua,41.5
BOTAS CHIRUCA PANTICOSA 06 GORE-TEX GRIS 41 GRIS,Gris,41
attipas - zapatos primeros pasos attipas tie 20 gris,GRIS,20
Zapatillas la sportiva ultra raptor gtx hombre carbon naranja 41 carbon,Carbon,41
Botas Boreal YUCATAN GRIS 42 Gris,Gris,42
ZAPATILLAS LA SPORTIVA JYNX NIÑOS 36-40 NEGRO 38 NEGRO/AMARILLO,Negro/Amarillo,38
Zapatillas la sportiva ultra raptor hombre negro verde 46 negro/verde,Negro/Verde,46
"zapatillas boreal futura verde 44,5 verde",verde,"44,5"
Zapatillas Salomon Xa Elevate J Niños Rojo 38 Rojo,Rojo,38
"ZAPATILLAS LA SPORTIVA AKYRA HOMBRE AMARILLO 45,5 AMARILLO",Amarillo,"45,5"
camiseta ternua talok 1/2 zip hombre mousse grey s gris,Gris,S
"ATTIPAS - ZAPATOS ATTIPAS PRIMEROS PASOS NORDIC GRIS 22,5 GRIS",GRIS,"22,5"
pantalones ternua sabah hombre laguna oscura m azul oscuro,Azul oscuro,M
Zapatillas New Balance Fresh Foam Cruz On Hombre Negro Imán 42 Negro,Negro,42
botas salomon x ultra 3 mid gtx mujer azul lima 40 azul/verde,Azul/Verde,40
Zapatillas Boreal BAMBA W'S OLIVA 40 verde oliva,verde oliva,40
Zapatillas trail running la sportiva akasha hombre negro 42.5 negro/amarillo,Negro/Amarillo,42.5
Zapatillas trekking merrell chameleon 5 ventilator hombre gris 46 gris,Gris,46
BOTAS CHIRUCA SPANIEL 12 GORE-TEX MARRON 42 MARRON,Marron,42
ZAPATILLAS LA SPORTIVA MUTANT MUJER ÓPALO AGUA 43 AGUA,Agua,43
Zapatillas salomon xa pro 3d j niños cerise 36 cereza,Cereza,36
Botas hi-tec garcia sport wp hombre chocolate 41 chocolate,Chocolate,41
Botas hi-tec gregal mid wp hombre marron 43 marron,Marron,43
Zapatillas Boreal Drom Gris 44 Gris,Gris,44
Zapatillas chiruca etnico 03 gtx surround marino-marron 42 azul marino,Azul Marino,42
Pies de gato la sportiva mythos lady 41.5 blanco,Blanco,41.5
Pies de gato la sportiva tarantula mujer turquoise 40.5 turquesa,Turquesa,40.5
Botas boreal drom mid rojo 43 1/4 rojo,Rojo,43 1/4
pies de gato la sportiva kataki mujer mint-coral 36.5 menta,Menta,36.5
"Zapatillas Nike Md Runner 2 Gs Pistola De Humo 36,5 Gris",Gris,"36,5"
Zapatillas nike tanjun se hombre azul 44 azul,Azul,44
Pies de gato la sportiva finale sulphur-blue 45.5 amarillo/azul,Amarillo/Azul,45.5
bermuda ternua kross hombre borgoña ártico oscuro s burdeos,Burdeos,S
PIES DE GATO LA SPORTIVA KATAKI MUJER MINT-CORAL 37.5 MENTA,Menta,37.5
Pies de gato La Sportiva Mythos Terra 39.5 Tierra Oscura,Tierra Oscura,39.5
SUDADERA TREKKING TRANGOWORLD POPPI MUJER VERDE GRANATE L VERDE,Verde,L
Botas montaña millet ld high route mesh hombre 44 2/3 gris,Gris,44 2/3
Pies de gato la sportiva genius 43 rojo/amarillo,Rojo/Amarillo,43
Zapatillas Chiruca Detroit 12 Gore-tex Marron 39 Marron,Marron,39
pies de gato la sportiva mythos lady 37 blanco,Blanco,37
Zapatillas de trekking salomon x ultra 3 hombre negro 42 negro,Negro,42
Botas Boreal MAZAMA GRIS 39.5 Gris,Gris,39.5
zapatillas boreal bamba w's oliva 40 verde oliva,verde oliva,40
Zapatillas nike downshifter 8 hombre lobo gris 44 gris,Gris,44
Pies de gato La Sportiva Genius 39 Rojo/Amarillo,Rojo/Amarillo,39
botas chiruca dynamic 05 gore-tex gris-rojo 41 gris/rojo,Gris/Rojo,41
SANDALIAS CHIRUCA MALIBU 05 MUJER GRIS MORADO 41 GRIS,Gris,41
BOTAS CHIRUCA DYNAMIC 52 GORE-TEX MARRON 40 MARRON,Marron,40
Zapatillas running nike flex experience rn 4 hombre azul  41 azul,Azul,41
zapatillas trail running la sportiva ultra raptor hombre naranja gris 47 gris/naranja,Gris/Naranja,47
FORRO POLAR CAMPAGNOLO 3G10747 HOMBRE NEGRO BLANCO 50 NEGRO/BLANCO,Negro/Blanco,50
ZAPATILLAS TREKKING SALEWA WILDFIRE PRO GORETEX HOMBRE 45 AZUL,Azul,45
PANTALONES SALOMON S-LAB SHORT 6 M HOMBRE NEGRO NEGRO M,Negro,M
Botas columbia redmond v2 mid wp hombre grafito jaspe rojo 42 gris/rojo,Gris/Rojo,42
Zapatillas Boreal BAMBA ANTRACITA 39.5 Antracita,Antracita,39.5
PIES DE GATO LA SPORTIVA SOLUTION WHITE-YELLOW 43.5 BLANCO/AMARILLO,Blanco/Amarillo,43.5
Zapatillas Salomon Sense Ride 2 Hombre Ilusión Azul 44 2/3 Azul,Azul,44 2/3
zapatillas columbia ivo trail mujer laguna coral 40 azul/rosa,Azul/Rosa,40
Calcetines running compressport pro racing socks v3.0 ultralight high azul 42 - 44 azul,Azul,42 - 44
botas salomon quest 4d 3 gtx hombre negro 45 1/3 negro,Negro,45 1/3
zapatillas salomon xa elevate j niños rojo 32 rojo,Rojo,32
Pies de gato La Sportiva Solution mujer White-Lily Orange 33 Blanco/Naranja,Blanco/Naranja,33
botas boreal atlas marino 37.5 azul marino,Azul Marino,37.5
BOTAS CHIRUCA TROLL 03 GORE-TEX AZUL MARINO 40 Azul Marino,Azul Marino,40
ZAPATILLAS LA SPORTIVA ULTRA RAPTOR HOMBRE NEGRO VERDE 46 NEGRO/VERDE,Negro/Verde,46
zapatillas saucony dxn trainer vintage mujer burdeos 39 burdeos,Burdeos,39
Zapatillas Running Salomon X-Scream 3D Mujer 38 2/3 Lila/Morado,Lila/Morado,38 2/3
Botas chiruca xacobeo 36 goretex hombre gris oscuro 41 gris oscuro,Gris Oscuro,41
zapatillas de trekking salomon x ultra 3 hombre negro 41 1/3 negro,Negro,41 1/3
botas chiruca texas hi vis 08 gtx hombre 43 kaki,Kaki,43
ZAPATILLAS SAUCONY DXN TRAINER VINTAGE MUJER BURDEOS 39 BURDEOS,Burdeos,39
ZAPATILLAS NIKE REVOLUTION 4 GS AZUL 36 AZUL,Azul,36
zapatillas chiruca detroit 12 gore-tex marron 40 marron,Marron,40
Pies de gato la sportiva otaki blue-flame 45.5 azul/naranja,Azul/Naranja,45.5
Zapatillas La Sportiva Falkon Low 27-35 Gris 32 Gris,Gris,32
PIES DE GATO LA SPORTIVA TARANTULA MUJER CORAL 36 CORAL,Coral,36
Zapatillas La Sportiva Akasha Mujer Azul Marino Púrpura 36 Azul/morado,Azul/Morado,36
"ZAPATILLAS BOREAL CHAMELEON AZUL 44,5 AZUL",Azul,"44,5"
Calcetines running compressport run high v3 blanco rosa 39/41 blanco/rosa,Blanco/Rosa,39/41
SANDALIAS HI-TEC DELOS MUJER VIOLETA 37 VIOLETA,Violeta,37
ZAPATILLAS BOREAL FUTURA ANTRACITA 46.5 ANTRACITA,Antracita,46.5
calcetines compressport winter trail unisex gris t2 gris/amarillo,Gris/Amarillo,T2
Zapatillas boreal glove oliva 42 verde oliva,verde oliva,42
zapatillas salomon xa alpine 2 43 1/3 azul/negro,Azul/Negro,43 1/3
botas boreal kovach gris 47 gris,Gris,47
Sudadera trekking trangoworld wislok hombre verde 2xl verde,Verde,2XL
Botas senderismo hi-tec riverstone wp hombre taupe 47 taupe,Taupe,47
"Zapatillas Saucony Excursion Tr12 Mujer Morado 38,5 Morado",Morado,"38,5"
ZAPATILLAS NIKE REVOLUTION 4 EU HOMBRE ROJO 42 ROJO,Rojo,42
zapatillas trekking salewa ms wildfire vent hombre azul 45 azul,Azul,45
Pies de gato La Sportiva Skwama Black-Yellow 35 Negro/Amarillo,Negro/Amarillo,35
Zapatillas Salomon X Ultra 3 Gtx Mujer Artic 40 2/3 Verde,Verde,40 2/3
BOTAS BOREAL BULNES 42 MARRON,Marron,42
ZAPATILLAS BOREAL BAMBA W'S OLIVA 39.5 VERDE OLIVA,verde oliva,39.5
pantalones breezy coromell hombre negro rojo 2xl negro/rojo,Negro/Rojo,2XL
SANDALIAS CHIRUCA MALIBU 05 MUJER GRIS MORADO 41 GRIS,Gris,41
Botas boreal bamba mid marino 40 azul marino,Azul Marino,40
Botas chiruca cares force 01 goretex hombre marron 42 marron,Marron,42
Botas boreal bamba mid marino 39.5 azul marino,Azul Marino,39.5
Zapatillas Columbia Redmond V2 Wp Mujer Acero Gris Ciruela Púrpura 38 Gris,Gris,38
"Zapatillas trail running la sportiva mutant hombre gris lima 40,5 gris/verde",Gris/Verde,"40,5"
Zapatillas Columbia Redmond V2 Wp Mujer Exprés Océano Profundo 39 Marron,Marron,39
Zapatillas Nike Downshifter 8 Hombre Lobo Gris 43 Gris,Gris,43
Botas Boreal MALI 40 Morado,Morado,40
Botas Hi-Tec Ravus Adventure Mid WP Hombre Chocolate 45 Chocolate,Chocolate,45
Zapatillas trekking salewa wildfire pro goretex hombre 45 azul,Azul,45
Zapatillas de trekking salomon x ultra 3 hombre amarillo 42 amarillo,Amarillo,42
Attipas - zapatos bebé ribbon gris attipas 19 gris,GRIS,19
ZAPATILLAS SALOMON XA PRO 3D HOMBRE MIKONOS 41 1/3 AZUL,Azul,41 1/3
PANTALONES ESQUÍ DE TRAVESÍA SALOMON ACTIVE SOFT SHELL MUJER M BLANCO,Blanco,M
BOTAS SALOMON X ULTRA 3 MID GTX HOMBRE CASTOR GRAY 43 1/3 GRIS,Gris,43 1/3
Botas chiruca spaniel 12 gore-tex marron 40 marron,Marron,40
Pies de gato la sportiva solution mujer white-lily orange 39 blanco/naranja,Blanco/Naranja,39
Pantalones running salomon agile short mujer morado blanco l morado/blanco,Morado/Blanco,L
BOTAS CHIRUCA TROLL 01 GORETEX NIÑOS GRIS VERDE 32 GRIS/VERDE,Gris/Verde,32
CHAQUETA LA SPORTIVA PROMO FLEECE MUJER NEGRO L NEGRO/AMARILLO,Negro/Amarillo,L
ZAPATILLAS SALOMON ULTRA PRO MUJER AZULEJO AZUL 40 AZUL,Azul,40
Zapatillas Hi-tec Gregal Low Wp Hombre Marron 46 Marron,Marron,46
SAUCONY JAZZ ORIGINAL VINTAGE MUJER GRANATE 38 GRANATE,Granate,38
Botas boreal kerala gris 37 gris,Gris,37
Pies de gato La Sportiva Mythos Terra 39 Tierra Oscura,Tierra Oscura,39
zapatillas la sportiva ultra raptor mujer carbon azul 37 carbon,Carbon,37
Pies de gato La Sportiva Katana mujer White-Purple 40 Blanco/Morado,Blanco/Morado,40
Zapatillas salomon xa pro 3d j niños cerise 35 cereza,Cereza,35
ZAPATILLAS MERRELL OUTMOST VENT GORETEX HOMBRE CANGURO 41 MARRON,Marron,41
"Attipas - zapatos attipas primeros pasos nordic gris 22,5 gris",GRIS,"22,5"
Botas The North Face Hedgehog Fastpack Mid Gtx Hombre Negro 43 Negro,Negro,43
Botas salomon x ultra 3 mid gtx mujer imán 40 negro,Negro,40
Zapatillas Running Salomon X-mission 2 Hombre 42 2/3 Azul,Azul,42 2/3
BOTAS MONTAÑA MILLET LD HIGH ROUTE MESH MUJER 40 GRIS,Gris,40
Pies de gato La Sportiva Solution White-Yellow 37 Blanco/Amarillo,Blanco/Amarillo,37
zapatillas de trekking salomon x ultra 3 hombre amarillo 42 amarillo,Amarillo,42
Botas columbia canyon point mid waterproof mujer rojo marsala 40 rojo,Rojo,40
BOTAS CHIRUCA MULHACEN 19 GORETEX HOMBRE GRIS ROJO 45 Gris/Rojo,Gris/Rojo,45
zapatillas new balance ml574 hombre burdeos 44 burdeos,Burdeos,44
zapatillas merrell outmost vent goretex hombre granite 43 gris,Gris,43
Zapatillas Nike Revolution 4 Eu Mujer Rosa Hielo 38 Rosa/blanco,Rosa/Blanco,38
botas chiruca panticosa 06 gore-tex gris 39 gris,Gris,39
Zapatillas hi-tec razor low wp hombre gris naranja 45 gris/naranja,Gris/Naranja,45
ZAPATILLAS RUNNING NIKE REVOLUTION 3 HOMBRE AZUL AZUL 44 AZUL/AZUL,Azul/Azul,44
Pies de gato la sportiva mythos lady 42 blanco,Blanco,42
BOTAS CHIRUCA SOMIEDO 05 GORE-TEX GRIS 38 Gris,Gris,38
ZAPATILLAS SALOMON XA PRO 3D J NIÑOS CERISE 35 CEREZA,Cereza,35
Pies de gato la sportiva miura mujer white-jade green 39.5 blanco/verde,Blanco/Verde,39.5
Botas chiruca game hi vis 08 goretex hombre 41 marron,Marron,41
Zapatillas Columbia Canyon Point Waterproof Hombre Carbon 44 Carbon,Carbon,44
botas chiruca somiedo 02 goretex hombre marrón 41 marron,Marron,41
botas chiruca riglos 05 gris 42 gris,Gris,42
BOTAS CHIRUCA TROLL 03 GORE-TEX AZUL MARINO 30 Azul Marino,Azul Marino,30
Botas Boreal MAIPO 39.5 Gris,Gris,39.5
ZAPATILLAS BOREAL DROM GRIS 46 GRIS,Gris,46
zapatillas trail running salomon wings pro 2 hombre lima 42 lima,Lima,42
ZAPATILLAS COLUMBIA CANYON POINT HOMBRE NEGRO 46 NEGRO,Negro,46
Zapatillas Merrell Moab 2 Goretex Hombre Navy 44 Navy,Navy,44
Zapatillas Hi-Tec Quadra Classic Wp Hombre Tupe 46 Taupe,Taupe,46
ZAPATILLAS BOREAL SALSA W'S TURQUESA 40 TURQUESA,Turquesa,40
Zapatillas New Balance Fresh Foam Gobi V3 Mujer Burgundy 41 Burdeos,Burdeos,41
Botas Boreal DESERT 42 Marron,Marron,42
Zapatillas la sportiva mutant mujer ópalo agua 36.5 agua,Agua,36.5
ZAPATILLAS BOREAL FUTURA WS GRIS 41.5 GRIS,Gris,41.5
BOTAS CHIRUCA DYNAMIC 52 GORE-TEX MARRON 40 MARRON,Marron,40
PIES DE GATO LA SPORTIVA OTAKI BLUE-FLAME 37.5 AZUL/NARANJA,Azul/Naranja,37.5
Pantalones breezy coromell hombre negro azul m negro/azul,Negro/Azul,M
zapatillas la sportiva tx4 hombre naranja 41 naranja,Naranja,41
Pies de gato la sportiva otaki mujer sulphur-coral 38 amarillo/rosa,Amarillo/Rosa,38
ZAPATILLAS SAUCONY EXCURSION TR11 HOMBRE ROJO GRIS 42 ROJO/GRIS,Rojo/Gris,42
zapatillas saucony excursion tr12 hombre negro azul 42 negro/azul,Negro/Azul,42
"zapatillas la sportiva kaptiva goretex mujer negro orquídea 38,5 negro/fuxia",Negro/Fuxia,"38,5"
Pies de gato La Sportiva Finale Brown-Orange 40.5 Marrón/Naranja,Marrón/Naranja,40.5
Botas chiruca calibre 22 gore-tex marron 40 marron,Marron,40
Pies de gato la sportiva miura mujer white-jade green 39 blanco/verde,Blanco/Verde,39
zapatillas la sportiva mutant mujer cieruela manzana verde 37 cereza,Verde/Cereza,37
Zapatillas Boreal Sendai Vent verde 43 1/4 verde,verde,43 1/4
Zapatillas New Balance Fresh Foam Cruz On Mujer Gris 41 Gris,Gris,41
Zapatillas boreal bamba w's oliva 40 verde oliva,verde oliva,40
pies de gato la sportiva katana tangerine-tropic blue 35 naranja/azul,Naranja/Azul,35
BOTAS CHIRUCA XACOBEO 12 GORETEX HOMBRE MARRON 42 MARRON,Marron,42
chaqueta +8000 potosi 19i 993 hombre granito m gris,Gris,M
Zapatillas Skechers Gorun Fast Valor Hombre Rojo 44 Rojo,Rojo,44
botas boreal yucatan marron 42 marron,Marron,42
zapatillas salomon xa pro 3d goretex hombre negro 44 2/3 negro,Negro,44 2/3
"zapatillas montaña columbia redmond hombre marron 43,5 marron",Marron,"43,5"
BOTAS CHIRUCA CARES 05 GORE-TEX GRIS 46 Gris,Gris,46
botas chiruca troll 03 gore-tex azul marino 26 azul marino,Azul Marino,26
ZAPATILLAS LA SPORTIVA KAPTIVA HOMBRE ÓPALO CHILE 47 AZUL/ROJO,Azul/Rojo,47
SANDALIAS CHIRUCA MALIBU 07 MUJER CORAL 41 CORAL,Coral,41
botas hi-tec garcia sport wp hombre gris 42 gris,Gris,42
botas boreal drom mid rojo 43 1/4 rojo,Rojo,43 1/4
"Zapatillas montaña columbia redmond hombre marron 41,5 marron",Marron,"41,5"
Pies de gato La Sportiva Kataki Ocean-Sulphur 39.5 Azul/Amarillo,Azul/Amarillo,39.5
Botas Boreal Karok Women's 40 Gris,Gris,40
Pies de gato La Sportiva Mythos Terra 42.5 Tierra Oscura,Tierra Oscura,42.5
Chaqueta trail running Salomon Lightning Wp Mujer Remolacha S Remolacha,Remolacha,S
"Zapatillas new balance gm500 hombre burdeos blanco 46,5 burdeos",Burdeos,"46,5"
CALCETINES TRAIL RUNNING COMPRESSPORT PRO RACING SOCKS V3.0 VERDE 39/41 VERDE,Verde,39/41
zapatillas boreal bamba w's granate 37.5 granate,Granate,37.5
botas chiruca riglos 05 gris 34 gris,Gris,34
Mochila trail running salomon adv skin 5 set rojo m/l rojo,Rojo,M/L
Zapatillas Trekking Salewa Ms Wildfire Vent Hombre Azul 45 Azul,Azul,45
Pantalones Trangoworld Limut Dn Hombre Negro L Negro,Negro,L
Botas boreal mazama gris 46 gris,Gris,46
Zapatillas salomon x radiant goretex hombre beluga 44 gris oscuro,Gris Oscuro,44
ZAPATILLAS NIKE FLEX CONTACT 2 HOMBRE NEGRO 43 NEGRO,Negro,43
botas chiruca massana 07 gore-tex burdeos 40 burdeos,Burdeos,40
Zapatillas nike downshifter 8 mujer piedra pómez 39 verde,Verde,39
PARKA INOBE TERMIC GTX TRANGO MARRÓN BUNGEE 2XL MARRON,Marron,2XL
Sandalias Hi-tec Delos Mujer Azul 40 Azul,Azul,40
Zapatillas Nike Flex Experience Rn 7 Mujer Lobo Gris 38 Gris/blanco,Gris/Blanco,38
"botas la sportiva trango trek micro evo gtx antracita rojo 43,5 gris/rojo",Gris/Rojo,"43,5"
"ZAPATILLAS DE MONTAÑA MERRELL MOAB FST LEATHER GORETEX HOMBRE ROCA 41,5 ROCA",Roca,"41,5"
Botas chiruca dynamic 52 gore-tex marron 47 marron,Marron,47
CHAQUETA TRX2 SOFT PRO TRANGO NARANJA INTENSO-CALABAZA L NARANJA,Naranja,L
chiruca boxer boa 01 goretex hombre 43 marron verdoso,Marron verdoso,43
ZAPATILLAS NEW BALANCE AM210 HOMBRE BLANQUECINO 46.5 BEIG,Beig,46.5
Botas chiruca troll 06 gore-tex lila 38 lila,Lila,38
sandalias chiruca guam 03 hombre negro 43 negro,Negro,43
botas boreal tempest mid azul 43 1/4 azul,Azul,43 1/4
zapatillas salomon xa pro 3d goretex hombre negro 44 2/3 negro,Negro,44 2/3
pies de gato la sportiva katana mujer white-purple 41 blanco/morado,Blanco/Morado,41
zapatillas salomon sense ride 2 hombre dalia roja 41 1/3 rojo,Rojo,41 1/3
"zapatillas trail running la sportiva mutant hombre gris lima 40,5 gris/verde",Gris/Verde,"40,5"
Zapatillas Nike Downshifter 8 Hombre Lobo Gris 44 Gris,Gris,44
Pies de gato la sportiva finale mujer grey-coral 39.5 gris/coral,Gris/Coral,39.5
Sandalias chiruca malibu 07 mujer coral 42 coral,Coral,42
Zapatillas Boreal BAMBA W'S GRANATE 37.5 Granate,Granate,37.5
ATTIPAS - Attipas calzado los primeros pasos polka rosa 19 ROSA,ROSA,19
bolso expedicion 120 trango antracita-negro l antracita,Antracita,L
PANTALONES DE MONTAÑA TRANGO WORLD NAYM MUJER XL GRIS/ROSA,Gris/Rosa,XL
botas boreal bamba mid ws gris 40 gris,Gris,40
BOTAS CHIRUCA TROLL 05 GORETEX NIÑOS GRIS ROJO 30 GRIS/ROJO,Gris/Rojo,30
Zapatillas Nike Flex Experience Rn 7 Hombre Recuerdo Azul 41 Azul,Azul,41
Zapatillas Nike Flex Contact 2 Hombre Antracita 41 Antracita,Antracita,41
Zapatillas salomon xa elevate j niños lima ácida 31 lima,Lima,31
pies de gato la sportiva skwama mujer apple green-cobalt blue 40 verde/azul,Verde/Azul,40
Zapatillas Running Nike Revolution 3 Hombre Azul Azul 42 Azul/azul,Azul/Azul,42
Zapatillas columbia canyon point waterproof hombre marron 41 marron,Marron,41
Zapatillas boreal flyers vent marino 42 azul marino,Azul Marino,42
"zapatillas boreal sendai vent grafito 41,5 gris/verde",Gris/verde,"41,5"
Botas Hi-Tec Gregal Mid WP Hombre Gris 46 Gris,Gris,46
Botas hi-tec garcia sport wp hombre gris 44 gris,Gris,44
Pies de gato la sportiva futura blue-yellow 36.5 azul/amarillo,Azul/Amarillo,36.5
zapatillas boreal futura antracita 44.5 antracita,Antracita,44.5
Botas chiruca monique 09 gore-tex gris-rojo 40 gris/rojo,Gris/Rojo,40
"zapatillas nike revolution 4 eu hombre rojo 44,5 rojo",Rojo,"44,5"
Botas boreal zanskar gris 40 gris,Gris,40
Pies de gato la sportiva kataki mujer mint-coral 37.5 menta,Menta,37.5
Pies de gato La Sportiva Solution White-Yellow 40.5 Blanco/Amarillo,Blanco/Amarillo,40.5
Botas La Sportiva Trango Trk Gtx Amarillo Negro 47.5 Amarillo/Negro,Amarillo/Negro,47.5
zapatillas trekking salewa ms speed ascent hombre azul amarillo 48.5 azul/amarillo,Azul/Amarillo,48.5
Botas De Montaña Merrell Capra Mid Sport Gore-tex Hombre 45 Naranja,Naranja,45
Pantalones Trekking Izas Infern Hombre Marron Marron Claro S Marron/Marron claro,Marron/Marron claro,S
"zapatillas saucony excursion tr12 mujer azul negro 38,5 azul/negro",Azul/Negro,"38,5"
Zapatillas Trail Running Salomon Xa Pro 3d Gtx Hombre Navy 44 2/3 Navy,Navy,44 2/3
botas hi-tec garcia sport wp hombre chocolate 44 chocolate,Chocolate,44
botas chiruca mulhacen 52 gore-tex marron-negro 37 marron,Marron,37
Pies de gato la sportiva miura mujer white-jade green 40 blanco/verde,Blanco/Verde,40
Pies de gato la sportiva otaki mujer sulphur-coral 38 amarillo/rosa,Amarillo/Rosa,38
Camiseta salomon coton logo ss tee hombre rojo azul l rojo/azul,Rojo/Azul,L
Botas Boreal Apache Gris 43 1/4 Gris,Gris,43 1/4
zapatillas new balance kd373 verde 37 verde,Verde,37
BOTAS COLUMBIA REDMOND V2 MID WP HOMBRE CORDOVÉS PANADERO 43 MARRON,Marron,43
zapatillas la sportiva hyrax gtx marrón 43 marron,Marron,43
botas boreal mazama gris 46 gris,Gris,46
SANDALIAS HI-TEC SANTORINI STRAP MUJER TAUPE 41 TAUPE,Taupe,41
ZAPATILLAS TREKKING SALEWA MS WILDFIRE VENT HOMBRE MARRON 42 MARRON,Marron,42
sombrero ternua kliluk beige s/m taupe,Taupe,S/M
Zapatillas new balance fresh foam hierro v3 hombre imán negro 42 negro,Negro,42
ZAPATILLAS NIKE DOWNSHIFTER 8 MUJER PIEDRA PÓMEZ 39 VERDE,Verde,39
pies de gato la sportiva otaki blue-flame 43.5 azul/naranja,Azul/Naranja,43.5
Zapatillas boreal flyers vent ws 37.5 gris,Gris,37.5
Zapatillas Boreal GLOVE OLIVA 42 verde oliva,verde oliva,42
Botas Chiruca Trofeo 01 GoreTex Pointer Hombre 41 Kaki,Kaki,41
Chaqueta runart trango lima-lima l lima,Lima,L
PIES DE GATO LA SPORTIVA KATAKI MUJER MINT-CORAL 35.5 MENTA,Menta,35.5
Botas merrell chameleon 7 limit mid wp hombre oliva 43 verde oliva,Verde oliva,43
zapatillas columbia canyon point waterproof hombre marron 43 marron,Marron,43
Zapatillas La Sportiva Ultra Raptor Gtx Hombre Carbon Naranja 41 Carbon,Carbon,41
botas boreal nelion women's 38 lima,Lima,38
ZAPATILLAS BOREAL FLYERS 39.5 GRIS/AMARILLO,Gris/Amarillo,39.5
Pies de gato La Sportiva Kataki mujer Mint-Coral 35 Menta,Menta,35
ZAPATILLAS BOREAL GLOVE OLIVA 44.5 VERDE OLIVA,verde oliva,44.5
Botas Boreal KOVACH GRIS 47 Gris,Gris,47
BOTAS BOREAL ORDESA WOMEN'S GRIS 39.5 GRIS,Gris,39.5
pantalones running salomon agile short mujer negro l negro,Negro,L
Pies de gato la sportiva futura blue-yellow 38.5 azul/amarillo,Azul/Amarillo,38.5
"ATTIPAS - Attipas calzado los primeros pasos sneakers rosa bebe 21,5 ROSA CLARO",ROSA CLARO,"21,5"
Botas Columbia Redmond V2 Mid Wp Hombre Cordovés Panadero 43 Marron,Marron,43
ZAPATILLAS DE TREKKING SALOMON X ULTRA 3 HOMBRE NEGRO 41 1/3 NEGRO,Negro,41 1/3
chaqueta campagnolo hybrid 3e48367 hombre 54 antracita,Antracita,54
Pies de gato La Sportiva Finale mujer Grey-Coral 41.5 Gris/Coral,Gris/Coral,41.5
Sandalias chiruca malibu 07 mujer coral 40 coral,Coral,40
Botas La Sportiva Trango Trk Gtx Amarillo Negro 41.5 Amarillo/Negro,Amarillo/Negro,41.5
Pies de gato La Sportiva Futura Blue-Yellow 39.5 Azul/Amarillo,Azul/Amarillo,39.5
pies de gato la sportiva solution mujer white-lily orange 36 blanco/naranja,Blanco/Naranja,36
Calcetines Compressport Winter Trail Unisex Gris T1 Gris/Amarillo,Gris/Amarillo,T1
Botas boreal turkana gris 40 gris,Gris,40
PIES DE GATO LA SPORTIVA FINALE SULPHUR-BLUE 39.5 AMARILLO/AZUL,Amarillo/Azul,39.5
Pies de gato La Sportiva Skwama mujer Apple Green-Cobalt Blue 40 Verde/Azul,Verde/Azul,40
Zapatillas la sportiva lycan hombre gris verde 44 gris/verde,Gris/Verde,44
Zapatillas Trekking Millet Trident Gtx Hombre 44 Negro,Negro,44
Botas chiruca angliru 02 goretex hombre marrón 43 marron,Marron,43
pantalones trekking izas vinson hombre gris s gris,Gris,S
Zapatillas boreal tempest low grafito 39.5 gris oscuro,Gris Oscuro,39.5
PIES DE GATO LA SPORTIVA GENIUS 41 ROJO/AMARILLO,Rojo/Amarillo,41
Botas boreal kovach gris 46 gris,Gris,46
BOTAS CHIRUCA CARES FORCE 01 GORETEX HOMBRE MARRON 42 MARRON,Marron,42
Camiseta salomon agile tank mujer lima s lima,Lima,S
BOTAS CHIRUCA MASSANA 07 GORE-TEX BURDEOS 42 BURDEOS,Burdeos,42
botas boreal turkana gris 39.5 gris,Gris,39.5
"Zapatillas boreal sendai vent grafito 44,5 gris/verde",Gris/verde,"44,5"
botas boreal bamba mid ws gris 40 gris,Gris,40
Camiseta Running The North Face Graphic Play Hard Tank Mujer Morado XS Morado,Morado,XS
Chaqueta Columbia Lake 22 Down Hombre Jaspe Rojo L Rojo,Rojo,L
"ATTIPAS - ZAPATOS PRIMEROS PASOS ATTIPAS TIE 21,5 GRIS",GRIS,"21,5"
ZAPATILLAS BOREAL FUTURA ANTRACITA 44.5 ANTRACITA,Antracita,44.5
zapatillas de trekking salomon x ultra 3 hombre negro 42 negro,Negro,42
sandalias chiruca malibu 05 mujer gris morado 41 gris,Gris,41
CHAQUETA TRAIL RUNNING SALOMON BONATTI WP HOMBRE AZUL GRIS XL AZUL/GRIS,Azul/Gris,XL
Zapatillas Nike Flex 2018 Rn Mujer Azul 38 Azul,Azul,38
chaqueta salomon fast wing iii jacket mujer xl morado,Morado,XL
Sandalias New Balance Cruiser K2013 Niños Blanco Lila 31 Blanco/morado,Blanco/Morado,31
zapatillas chiruca cuba 05 gore-tex gris-azul-rosa 37 gris/azul,Gris/Azul,37
Zapatillas la sportiva ultra raptor hombre negro verde 41 negro/verde,Negro/Verde,41
ZAPATILLAS BOREAL FLYERS VENT MARINO 42 AZUL MARINO,Azul Marino,42
botas boreal turkana gris 42 gris,Gris,42
"Zapatillas Saucony Excursion Tr11 Hombre Gris Burdeos 44,5 Gris/rojo",Gris/Rojo,"44,5"
Botas chiruca cameros 02 marron 40 marron,Marron,40
Sudadera the north face drew peak hombre negro gris m negro/gris,Negro/Gris,M
Zapatillas La Sportiva Jynx Niños 36-40 Negro 37 Negro/amarillo,Negro/Amarillo,37
Botas Boreal MAZAMA GRIS 46 Gris,Gris,46
Zapatillas Boreal BAMBA ANTRACITA 41.5 Antracita,Antracita,41.5
Zapatillas trail running salomon xa pro 3d gtx hombre navy 46 2/3 navy,Navy,46 2/3
Botas hi-tec garcia sport wp hombre gris 41 gris,Gris,41
Pant. Largo Prote Fi Trango Rojo-antracita L Rojo,Rojo,L
Botas chiruca troll 03 gore-tex azul marino 31 azul marino,Azul Marino,31
Pies de gato la sportiva tarentula 42.5 gris,Gris,42.5
Pies de gato La Sportiva Mythos Terra 45 Tierra Oscura,Tierra Oscura,45
Botas boreal aspen 33 gris/rojo,Gris/Rojo,33
Pantalones salomon wayfarer hombre negro 48r negro,Negro,48R
Chaqueta Columbia Powder Lite Mujer Remolacha XL Remolacha,Remolacha,XL
BOTAS CHIRUCA ABORIGEN 03 GTX SURROUND MARINO-MARRON 45 Azul Marino,Azul Marino,45
PIES DE GATO LA SPORTIVA GENIUS 43 ROJO/AMARILLO,Rojo/Amarillo,43
Botas chiruca troll 03 gore-tex azul marino 26 azul marino,Azul Marino,26
ZAPATILLAS LA SPORTIVA AKYRA HOMBRE GRIS AZUL 42.5 GRIS/AZUL,Gris/Azul,42.5
Pantalones ternua natib hombre naranja rojo m naranja,Naranja,M
Botas Boreal SIANA CORAL 38 Coral,Coral,38
"Botas boreal mali 45,5 morado",Morado,"45,5"
Botas boreal yucatan marron 40 marron,Marron,40
PIES DE GATO LA SPORTIVA SKWAMA BLACK-YELLOW 46 NEGRO/AMARILLO,Negro/Amarillo,46
botas chiruca massana 05 gore-tex asfalto-rojo 42 asfalto,Asfalto,42
BOTAS CHIRUCA TROLL 06 GORE-TEX LILA 31 LILA,Lila,31
Chaqueta campagnolo 3a01787n hombre rojo 48 rojo,Rojo,48
"ZAPATILLAS LA SPORTIVA HELIOS SR HOMBRE AMARILLO 38,5 AMARILLO",Amarillo,"38,5"
Pies de gato La Sportiva Miura mujer White-Jade Green 35 Blanco/Verde,Blanco/Verde,35
chaqueta campagnolo 3e13116 mujer grafito iris 40 gris,Gris,40
Zapatillas Salomon Xa Pro 3d J Niños Cerise 31 Cereza,Cereza,31
Botas La Sportiva Trango Trk Mujer Gtx Azul 39 Azul,Azul,39
Zapatillas boreal tempest low grafito 44 gris oscuro,Gris Oscuro,44
botas de montaña millet high route gtx hombre 43 1/3 marron,Marron,43 1/3
Zapatillas La Sportiva Tx4 Hombre Naranja 45 Naranja,Naranja,45
CHAQUETA SALOMON BONATTI RACE WP HOMBRE GRIS XL GRIS,Gris,XL
ZAPATILLAS LA SPORTIVA URAGANO GORETEX HOMBRE NEGRO AMARILLO 44 NEGRO/AMARILLO,Negro/Amarillo,44
BOTAS BOREAL TEMPEST MID GRAFITO 40 3/4 GRIS/VERDE,Gris/Verde,40 3/4
SANDALIAS HI-TEC TERRENO STRAP HOMBRE CARBÓN GRIS ACERO 43 CARBON,Carbon,43
botas de nieve salewa ws capsico mid insulated mujer 38 gris,Gris,38
Zapatillas La Sportiva TX4 Mujer Gris 37.5 Gris,Gris,37.5
Botas chiruca troll 06 gore-tex lila 25 lila,Lila,25
