title,color,size
Zapatillas la sportiva ultra raptor hombre negro verde 43 negro/verde,Negro/Verde,43
sandalias new balance cruiser k2013 niños negro lima 30 negro,Negro,30
botas boreal nelion women's 40 3/4 lima,Lima,40 3/4
BOTAS SALOMON QUEST 4D 3 GTX HOMBRE MARRON 43 1/3 MARRON,Marron,43 1/3
Botas chiruca galicia 02 gore-tex marron 41 marron,Marron,41
BOTAS BOREAL MAIPO 41.5 GRIS,Gris,41.5
ZAPATILLAS LA SPORTIVA WILD CAT MUJER GRIS ROJO 38 GRIS/ROJO,Gris/Rojo,38
botas hi-tec garcia sport wp hombre chocolate 41 chocolate,Chocolate,41
chaqueta salomon bonatti race wp hombre gris xl gris,Gris,XL
Botas Boreal YUCATAN GRIS 41.5 Gris,Gris,41.5
BOTAS CHIRUCA PANTICOSA 06 GORE-TEX GRIS 40 Gris,Gris,40
Zapatillas salomon outline goretex hombre blazer azul marino 44 navy,Navy,44
botas chiruca troll 06 gore-tex lila 30 lila,Lila,30
ZAPATILLAS SALOMON XA PRO 3D MUJER AZUL MORADO 38 2/3 AZUL/MORADO,Azul/Morado,38 2/3
zapatillas new balance fresh foam hierro v3 mujer coral vivo 37 coral,Coral,37
ZAPATILLAS BOREAL SALSA W'S TURQUESA 37 TURQUESA,Turquesa,37
zapatillas la sportiva akasha hombre ópalo chile 43 azul/rojo,Azul/Rojo,43
Botas salomon x ultra 3 mid gtx hombre castor gray 42 2/3 gris,Gris,42 2/3
Zapatillas La Sportiva Ultra Raptor Gtx Hombre Carbon Naranja 44 Carbon,Carbon,44
Sandalias salomon rx break hombre perla azul 44 azul/verde,Azul/Verde,44
Camiseta Salomon Coton Logo Ss Tee Hombre Rojo Azul L Rojo/azul,Rojo/Azul,L
Pies de gato la sportiva mythos terra 40 tierra oscura,Tierra Oscura,40
ZAPATILLAS SALOMON XA ELEVATE J NIÑOS ROJO 38 ROJO,Rojo,38
BOTAS CHIRUCA CLETA 02 MARRON 43 MARRON,Marron,43
BOTAS BOREAL ASPEN 30 GRIS/ROJO,Gris/Rojo,30
Botas hi-tec gregal mid wp hombre marron 43 marron,Marron,43
Pies de gato la sportiva katana mujer white-purple 39 blanco/morado,Blanco/Morado,39
Pies de gato La Sportiva Skwama mujer Apple Green-Cobalt Blue 38.5 Verde/Azul,Verde/Azul,38.5
Botas Montaña Millet Ld High Route Mesh Mujer 40 Gris,Gris,40
botas chiruca cleta 02 marron 40 marron,Marron,40
zapatillas de trekking salomon x ultra 3 hombre azul poseidon 44 azul,Azul,44
"Zapatillas Saucony Excursion Tr12 Mujer Azul Negro 38,5 Azul/negro",Azul/Negro,"38,5"
Zapatillas boreal bamba antracita 44 antracita,Antracita,44
Zapatillas salomon x ultra 3 gtx mujer artic 40 verde,Verde,40
zapatillas salomon xa elevate j niños rojo 31 rojo,Rojo,31
Zapatillas Boreal BAMBA ANTRACITA 39.5 Antracita,Antracita,39.5
Pies de gato La Sportiva Solution mujer White-Lily Orange 34 Blanco/Naranja,Blanco/Naranja,34
BOTAS BOREAL FUJI 47 MARRON,Marron,47
Pies de gato La Sportiva Solution White-Yellow 39 Blanco/Amarillo,Blanco/Amarillo,39
ZAPATILLAS NIKE DOWNSHIFTER 8 MUJER PIEDRA PÓMEZ 39 VERDE,Verde,39
Botas Columbia Redmond V2 Mid Wp Hombre Cordovés Panadero 43 Marron,Marron,43
pies de gato la sportiva solution mujer white-lily orange 33 blanco/naranja,Blanco/Naranja,33
Pantalones running salomon agile short mujer morado m morado,Morado,M
Botas Chiruca Patagonia 12 Hombre Marron 41 Marron,Marron,41
Pantalones TrangoWorld Kasu FI Hombre Gris S Gris,Gris,S
Zapatillas new balance gc574 pigmento negro 38 azul/negro,Azul/Negro,38
Attipas - zapatos attipas primeros pasos cutie blanco 20 blanco,BLANCO,20
Botas boreal flyers mid 47 gris/amarillo,Gris/Amarillo,47
Attipas - attipas calzado los primeros pasos ballet rosa 19 rosa,ROSA,19
PANTALONES RUNNING SALOMON AGILE SHORT MUJER NEGRO L NEGRO,Negro,L
BOTAS BOREAL ZANSKAR FULL GRAIN 42 MARRON,Marron,42
"pies de gato la sportiva tarantulace blue 40,5 azul",Azul,"40,5"
Zapatillas Boreal SENDAI WS LILA 38 3/4 Lila,Lila,38 3/4
Zapatillas Salomon X Ultra 3 Gtx Mujer Gris 38 2/3 Gris,Gris,38 2/3
SUDADERA THE NORTH FACE LIGHT DREW PEAK HOMBRE NEGRO L NEGRO,Negro,L
botas the north face hedgehog fastpack mid gtx hombre negro 43 negro,Negro,43
botas boreal drom mid grafito 39.5 gris/verde,Gris/Verde,39.5
ZAPATILLAS HI-TEC RAVUS ADVENTURE LOW WP HOMBRE MARRON 42 MARRON,Marron,42
"zapatillas la sportiva ultra raptor mujer baya 38,5 baya",Baya,"38,5"
camiseta interior trx2 wool wm pro trango gris claro-gris oscuro l gris,Gris,L
ZAPATILLAS SALOMON RX SLIDE 4.0 HOMBRE NEGRO 42 2/3 NEGRO,Negro,42 2/3
PIES DE GATO LA SPORTIVA SOLUTION MUJER WHITE-LILY ORANGE 33 BLANCO/NARANJA,Blanco/Naranja,33
Zapatillas boreal drom gris 40 2/3 gris,Gris,40 2/3
BOTAS BOREAL BAMBA MID WS GRIS 37.5 GRIS,Gris,37.5
zapatillas trekking salewa ms speed ascent hombre azul amarillo 48.5 azul/amarillo,Azul/Amarillo,48.5
Pantalones breezy coromell hombre negro rojo m negro/rojo,Negro/Rojo,M
Pantalones TrangoWorld Otago Hombre Azul Oscuro S Azul oscuro,Azul oscuro,S
Botas Boreal NELION WOMEN'S 39.5 Lima,Lima,39.5
Botas boreal hurricane ws gris 38 gris,Gris,38
sudadera trangoworld oby niños verde azul 16 verde/azul,Verde/Azul,16
Chaqueta mac in a sac mias origin rojo lava m lava,Lava,M
"Botas Salewa Ms Alp Trainer Mid Gtx Hombre Negro 46,5 Carbon",Carbon,"46,5"
sandalias chiruca malibu 05 mujer gris morado 42 gris,Gris,42
zapatillas boreal sendai vent verde 46 verde,verde,46
Botas Boreal BAMBA MID MARINO 40 Azul Marino,Azul Marino,40
ZAPATILLAS SALOMON X RADIANT GORETEX HOMBRE BELUGA 44 GRIS OSCURO,Gris Oscuro,44
Pies de gato La Sportiva Katana Yellow-Black 37.5 Amarillo/Negro,Amarillo/Negro,37.5
"BOTAS BOREAL ATLAS 39,5 MARRON",Marron,"39,5"
Zapatillas trail running merrell all out terra trail hombre negro amarillo 41 negro/amarillo,Negro/Amarillo,41
BOTAS MONTAÑA MILLET LD HIGH ROUTE MESH HOMBRE 44 2/3 GRIS,Gris,44 2/3
zapatillas nike downshifter 8 mujer piedra pómez 40 verde,Verde,40
botas boreal yucatan gris 41.5 gris,Gris,41.5
ZAPATILLAS SAUCONY JAZZ ORIGINAL VINTAGE NIÑOS NAVY 34 NAVY,Navy,34
Botas hi-tec garcia sport wp hombre chocolate 41 chocolate,Chocolate,41
Zapatillas Nike Tanjun Hombre Negro 43 Negro,Negro,43
Zapatillas Montaña Salomon X Ultra 2 Gtx Mujer Azul 40 Azul,Azul,40
zapatillas trail running salomon xa pro 3d gtx hombre navy 46 2/3 navy,Navy,46 2/3
Zapatillas trail running the north face ultra equity hombre 44 azul,Azul,44
Zapatillas La Sportiva Akasha Mujer Negro Morado 37 Negro/Morado,Negro/Morado,37
ZAPATILLAS SALOMON XA PRO 3D J NIÑOS AZUL NARANJA 40 AZUL,Azul,40
botas chiruca somiedo 05 gore-tex gris 47 gris,Gris,47
Botas La Sportiva Trango Tech Gtx Negro-Amarillo 41 Negro/Amarillo,Negro/Amarillo,41
zapatillas salomon xa pro 3d goretex hombre negro 41 1/3 negro,Negro,41 1/3
Zapatillas saucony dxn trainer vintage mujer burdeos 39 burdeos,Burdeos,39
Pies de gato la sportiva skwama mujer apple green-cobalt blue 35 verde/azul,Verde/Azul,35
BOTAS BOREAL BULNES 42 MARRON,Marron,42
zapatillas chiruca detroit 12 gore-tex marron 40 marron,Marron,40
"zapatillas de montaña merrell moab fst leather goretex hombre roca 41,5 roca",Roca,"41,5"
BOTAS HI-TEC GARCIA SPORT WP HOMBRE TAUPE 41 TAUPE,Taupe,41
PANTALONES CHIRUCA SILVANO PRO 11 HOMBRE M KAKI,Kaki,M
Zapatillas Boreal DROM GRIS 46 Gris,Gris,46
Botas boreal siana morado 41.5 morado,Morado,41.5
BOTAS CHIRUCA MASSANA 07 GORE-TEX BURDEOS 40 BURDEOS,Burdeos,40
Zapatillas la sportiva mutant mujer ópalo agua 42 agua,Agua,42
Pies de gato La Sportiva Finale mujer Grey-Coral 33.5 Gris/Coral,Gris/Coral,33.5
Zapatillas Merrell Outmost Vent GoreTex Hombre Roca 45 Roca,Roca,45
botas chiruca cares boa hi vis 08 goretex hombre 41 marron,Marron,41
Zapatillas Salomon Eos Goretex Mujer Fantasma 38 Gris,Gris,38
zapatillas boreal futura ws rojo 37 gris,Gris,37
Zapatillas la sportiva tx4 mujer gris 38 gris,Gris,38
chaqueta trail running salomon bonatti wp hombre azul naranja m azul/naranja,Azul/Naranja,M
"Zapatillas boreal sendai vent verde 42,5 verde",verde,"42,5"
Botas Hi-tec Bandera Lite Wp Hombre Gris Azul 42 Gris/azul,Gris/Azul,42
Botas chiruca aborigen 03 gtx surround marino-marron 40 azul marino,Azul Marino,40
ATTIPAS - Calzado los primeros pasos urban attipas 19 AMARILLO,AMARILLO,19
pies de gato la sportiva tc pro 37.5 crema,Crema,37.5
pantalones cortos trango world yittu mujer morado m morado,Morado,M
zapatillas boreal tempest low grafito 44 gris oscuro,Gris Oscuro,44
ZAPATILLAS MERRELL MOAB 2 GORETEX HOMBRE NAVY 45 NAVY,Navy,45
"Zapatillas nike court borough low se gs negro gris 37,5 negro/gris",Negro/Gris,"37,5"
Pies de gato La Sportiva Tarantula mujer Turquoise 38.5 Turquesa,Turquesa,38.5
Zapatillas la sportiva falkon low 27-35 gris 32 gris,Gris,32
PANTALONES TRANGOWORLD KASU FI HOMBRE GRIS M GRIS,Gris,M
Zapatillas Salomon Xa Pro 3d J Niños Azul Naranja 37 Azul,Azul,37
ZAPATILLAS SALOMON XA PRO 3D HOMBRE MIKONOS 42 2/3 AZUL,Azul,42 2/3
botas salomon x ultra 3 mid gtx mujer hydro 36 2/3 azul,Azul,36 2/3
botas chiruca mars boa 05 goretex niños gris rojo 35 gris/rojo,Gris/Rojo,35
Zapatillas nike revolution 4 eu mujer rosa hielo 38 rosa/blanco,Rosa/Blanco,38
Pies de gato La Sportiva TaRENTula 46 Gris,Gris,46
pantalones trangoworld prote fi hombre negro azul s negro/azul,Negro/Azul,S
Sudadera The North Face Open Gate FZ HD Hombre Kaki S Kaki,Kaki,S
botas chiruca somiedo 05 gore-tex gris 38 gris,Gris,38
BOTAS DE MONTAÑA BOREAL HURRICANE HOMBRE ANTRACITA 45 1/4 ANTRACITA,Antracita,45 1/4
pies de gato la sportiva finale vs mujer grey-coral 37 gris/coral,Gris/Coral,37
ZAPATILLAS CHIRUCA ETNICO 03 GTX SURROUND MARINO-MARRON 41 AZUL MARINO,Azul Marino,41
Zapatillas columbia canyon point waterproof hombre marron 40 marron,Marron,40
PIES DE GATO LA SPORTIVA TARENTULA 43 GRIS,Gris,43
botas chiruca trofeo 01 goretex pointer hombre 44 kaki,Kaki,44
Zapatillas De Trekking Salomon X Ultra 3 Hombre Azul Poseidon 44 2/3 Azul,Azul,44 2/3
Zapatillas Salomon X Radiant Goretex Hombre Beluga 42 Gris Oscuro,Gris Oscuro,42
Zapatillas Hi-Tec Ravus Vent Low Wp Hombre Gris 46 Gris,Gris,46
Zapatillas La Sportiva Akyra Hombre Gris Azul 41 Gris/Azul,Gris/Azul,41
ZAPATILLAS NIKE TANJUN SE HOMBRE AZUL 42 AZUL,Azul,42
"Zapatillas Nike Flex Contact 2 Hombre Antracita 42,5 Antracita",Antracita,"42,5"
zapatillas saucony jazz original vintage niños burdeos 35 burdeos,Burdeos,35
Zapatillas boreal sendai ws gris 41.5 gris,Gris,41.5
zapatillas trail running salomon wings pro 2 hombre lima 42 lima,Lima,42
FORRO POLAR CAMPAGNOLO 3G10747 HOMBRE NEGRO BLANCO 50 NEGRO/BLANCO,Negro/Blanco,50
Pies de gato la sportiva otaki blue-flame 44.5 azul/naranja,Azul/Naranja,44.5
Zapatillas Boreal FUTURA WS GRIS 41.5 Gris,Gris,41.5
"botas boreal atlas 39,5 marron",Marron,"39,5"
botas salomon x ultra 3 mid gtx hombre castor gray 42 gris,Gris,42
Botas chiruca telma 03 gore-tex azul 36 azul,Azul,36
zapatillas trail running salomon xa enduro hombre 41 1/3 azul/naranja,Azul/Naranja,41 1/3
pantalones trangoworld otago hombre gris naranja m gris/naranja,Gris/Naranja,M
chiruca pointer 01 goretex hombre marrón 47 marron,Marron,47
Chaqueta ganin ft trango verde lima l lima,Lima,L
Chaqueta Hara Trango Carmesi M Rosa,Rosa,M
Botas Boreal STRIDER 42 Marron,Marron,42
Botas salomon x ultra 3 mid gtx mujer imán 41 1/3 negro,Negro,41 1/3
Pies de gato La Sportiva Otaki Blue-Flame 45 Azul/Naranja,Azul/Naranja,45
Zapatillas Boreal SENDAI WS LILA 37.5 Lila,Lila,37.5
Pant. largo slaggard trango negro-celeste l negro/azul,Negro/Azul,L
Zapatillas la sportiva akyra hombre gris azul 42.5 gris/azul,Gris/Azul,42.5
"BOTAS BOREAL ATLAS 39,5 MARRON",Marron,"39,5"
Zapatillas La Sportiva Falkon Gtx 27-35 Gris 31 Gris,Gris,31
Pies de gato la sportiva tarentula 40.5 gris,Gris,40.5
"ZAPATILLAS NEW BALANCE FRESH FOAM CRAG V2 HOMBRE ORO 41,5 ORO BRILLANTE",Oro brillante,"41,5"
zapatillas salomon eos goretex mujer fantasma 38 gris,Gris,38
Zapatillas Boreal FLYERS VENT MARINO 40 3/4 Azul Marino,Azul Marino,40 3/4
saucony jazz original vintage azul mujer 39 azul,Azul,39
"Attipas - zapatos bebé ribbon gris attipas 21,5 gris",GRIS,"21,5"
Pies de gato la sportiva miura mujer white-jade green 34 blanco/verde,Blanco/Verde,34
Botas Boreal SIANA CORAL 42 Coral,Coral,42
botas chiruca etrusca 02 gore-tex marron 47 marron,Marron,47
Saucony Jazz Original Vintage Azul Mujer 39 Azul,Azul,39
BOTAS CHIRUCA MASSANA 02 GORE-TEX MARRON 39 MARRON,Marron,39
Sandalias chiruca cartagena 11 mujer azul turquesa 40 turquesa,Turquesa,40
CHAQUETA TERNUA JAKSAM HOMBRE GRIS NEGRO S GRIS/NEGRO,Gris/Negro,S
botas boreal aspen girls 34 gris/turquesa,Gris/Turquesa,34
"Zapatillas Nike Downshifter 8 Hombre Lobo Gris 42,5 Gris",Gris,"42,5"
Zapatillas Boreal BAMBA ANTRACITA 44 Antracita,Antracita,44
Sudadera trangoworld simme mujer negro azul l negro/azul,Negro/Azul,L
pantalones trangoworld kasu fi hombre gris s gris,Gris,S
Botas chiruca cares 05 gore-tex gris 37 gris,Gris,37
Botas Boreal DESERT 42 Marron,Marron,42
BOTAS LA SPORTIVA TRANGO TRK MUJER GTX AZUL 40 AZUL,Azul,40
Botas Salomon X Ultra 3 Mid Gtx Mujer Imán 41 1/3 Negro,Negro,41 1/3
ATTIPAS - Attipas calzado los primeros pasos ballet rosa 19 ROSA,ROSA,19
Zapatillas nike downshifter 8 mujer piedra pómez 38 verde,Verde,38
chaleco trx2 800 pro trango naranja intenso-calabaza l naranja,Naranja,L
zapato bomio ip trango marron chocolate 42 marron,Marron,42
"Botas Boreal Brenta 48,5 Naranja",Naranja,"48,5"
ZAPATILLAS TRAIL RUNNING LA SPORTIVA BUSHIDO HOMBRE NEGRO AMARILLO 41 NEGRO/AMARILLO,Negro/Amarillo,41
zapatillas salomon x ultra 3 gtx hombre negro 44 2/3 negro,Negro,44 2/3
Zapatillas saucony jazz trail original hombre verde 41 verde,Verde,41
chaqueta trx2 stretch pro trango azul-azul oscuro 3xl azul,Azul,3XL
Chaqueta de senderismo ternua zixon therm hombre azul marino s azul marino,Azul Marino,S
ATTIPAS - Attipas los primeros pasos puzzle gris 20 GRIS,GRIS,20
Pantalones chiruca silvano pro 11 hombre m kaki,Kaki,M
"Zapatillas La Sportiva Lycan Hombre Negro Naranja 41,5 Negro/naranja",Negro/Naranja,"41,5"
zapatillas salomon xa pro 3d hombre cherry 43 1/3 rojo,Rojo,43 1/3
Zapatillas La Sportiva Akasha Mujer Azul Marino Púrpura 36 Azul/morado,Azul/Morado,36
PANTALONES BREEZY COROMELL HOMBRE NEGRO ROJO XL NEGRO/ROJO,Negro/Rojo,XL
"Zapatillas nike revolution 4 eu mujer rosa hielo 38,5 rosa/blanco",Rosa/Blanco,"38,5"
"ATTIPAS - Attipas calzado los primeros pasos zoo azul 22,5 AZUL",AZUL,"22,5"
Pies de gato la sportiva skwama mujer apple green-cobalt blue 40 verde/azul,Verde/Azul,40
Chaqueta trx2 stretch pro trango azul-azul oscuro 3xl azul,Azul,3XL
zapatillas nike tanjun se hombre azul 44 azul,Azul,44
Pies de gato la sportiva mythos lady 42 blanco,Blanco,42
pies de gato la sportiva finale mujer grey-coral 37 gris/coral,Gris/Coral,37
Botas la sportiva trango trk mujer gtx azul 39 azul,Azul,39
botas boreal yucatan gris 42 gris,Gris,42
zapatillas la sportiva kaptiva goretex mujer negro orquídea 41 negro/fuxia,Negro/Fuxia,41
Zapatillas new balance kd373 verde 37 verde,Verde,37
Botas boreal atlas marino 38 3/4 azul marino,Azul Marino,38 3/4
BOTAS CHIRUCA DALLAS 05 GORE-TEX NEGRO 44 NEGRO,Negro,44
Zapatillas Salomon Sense Ride 2 Hombre Dalia Roja 44 Rojo,Rojo,44
Zapatillas Salomon Ultra Pro Hombre Clima Tormentoso 45 1/3 Gris/Naranja,Gris/Naranja,45 1/3
Attipas - attipas los primeros pasos puzzle azul 20 azul,AZUL,20
botas boreal siana coral 37 coral,Coral,37
chaleco columbia powder lite hombre negro l negro,Negro,L
ZAPATILLAS COLUMBIA CANYON POINT WATERPROOF HOMBRE MARRON 46 MARRON,Marron,46
BOTAS CHIRUCA TROLL 03 GORE-TEX AZUL MARINO 28 Azul Marino,Azul Marino,28
Botas Boreal ATLAS 40 Marron,Marron,40
Camiseta termica Hg Original 8030 Hombre Rojo XL Rojo/Negro,Rojo/Negro,XL
pies de gato la sportiva cobra slate 37.5 gris,Gris,37.5
zapatillas nike revolution 4 eu hombre rojo 44 rojo,Rojo,44
BOTAS CHIRUCA BERREA FORCE Hi Vis 18 GORE-TEX MARRON-NARANJA 43 Marron,Marron,43
Chaqueta the north face stratos hombre negro l negro,Negro,L
Bermuda ternua kross hombre borgoña l burdeos,Burdeos,L
PIES DE GATO LA SPORTIVA MYTHOS LADY 37 BLANCO,Blanco,37
PIES DE GATO LA SPORTIVA KATANA TANGERINE-TROPIC BLUE 41.5 NARANJA/AZUL,Naranja/Azul,41.5
pantalones trekking izas infern hombre marron marron claro s marron/marron claro,Marron/Marron claro,S
Zapatillas trail running Salomon Xa Enduro Hombre 44 2/3 Azul/Naranja,Azul/Naranja,44 2/3
Zapatillas La Sportiva Kaptiva GoreTex Hombre Negro Amarillo 43.5 Negro/Amarillo,Negro/Amarillo,43.5
botas salomon quest 4d 3 gtx hombre negro 45 1/3 negro,Negro,45 1/3
Botas columbia canyon point mid waterproof mujer rojo marsala 40 rojo,Rojo,40
Botas boreal karok women's 40 gris,Gris,40
Botas chiruca calibre 22 gore-tex marron 42 marron,Marron,42
Chaqueta de Senderismo Ternua Zixon Therm Hombre Azul Marino S Azul Marino,Azul Marino,S
Botas columbia redmond v2 mid wp hombre grafito jaspe rojo 42 gris/rojo,Gris/Rojo,42
PIES DE GATO LA SPORTIVA KATAKI MUJER MINT-CORAL 40.5 MENTA,Menta,40.5
Zapatillas Saucony DXN Trainer Vintage Mujer Burdeos 41 Burdeos,Burdeos,41
Pies de gato La Sportiva Mythos Terra 46 Tierra Oscura,Tierra Oscura,46
ZAPATILLAS SALOMON X ULTRA 3 PRIME GORETEX MUJER MÁLAGA 41 1/3 ROSA,Rosa,41 1/3
BOTAS CHIRUCA PANTICOSA 12 GORE-TEX MARRON 42 MARRON,Marron,42
Botas boreal aspen 29 gris/rojo,Gris/Rojo,29
"Zapatillas nike downshifter 8 hombre lobo gris 45,5 gris",Gris,"45,5"
Pies de gato La Sportiva Skwama Black-Yellow 41.5 Negro/Amarillo,Negro/Amarillo,41.5
Botas chiruca panticosa 12 gore-tex marron 42 marron,Marron,42
Botas la sportiva tx5 gtx hombre 41.5 gris,Gris,41.5
botas boreal zanskar gris 42 gris,Gris,42
Botas salomon x ultra 3 mid gtx mujer imán 40 negro,Negro,40
BOTAS CHIRUCA PANTICOSA 12 GORE-TEX MARRON 40 MARRON,Marron,40
BOTAS CHIRUCA MONIQUE 09 GORE-TEX GRIS-ROJO 36 Gris/Rojo,Gris/Rojo,36
Botas Boreal MAZAMA GRIS 39.5 Gris,Gris,39.5
polo the north face polo piquet hombre negro l negro,Negro,L
Pantalones Cortos Senderismo +8000 Tremaya Mujer Negro Fuxia M Negro/fuxia,Negro/Fuxia,M
Sandalias senderismo campagnolo aquarii mujer hielo 40 beig,Beig,40
Botas chiruca sarria 07 mujer gris burdeos 40 gris,Gris,40
zapatillas salomon xa elevate hombre 44 azul,Azul,44
Zapatillas boreal flyers vent ws 37 gris,Gris,37
Zapatillas Running Nike Flex Experience Rn 4 Hombre Azul  41 Azul,Azul,41
BOTAS BOREAL MAIPO 39.5 GRIS,Gris,39.5
Zapatillas Boreal BAMBA W'S OLIVA 39.5 verde oliva,verde oliva,39.5
Botas de montaña salomon quest 4d 2 gtx hombre marron negro 43 1/3 marron,Marron,43 1/3
Pies de gato la sportiva katana yellow-black 46 amarillo/negro,Amarillo/Negro,46
PIES DE GATO LA SPORTIVA TC PRO 42.5 CREMA,Crema,42.5
PIES DE GATO LA SPORTIVA SOLUTION WHITE-YELLOW 38.5 BLANCO/AMARILLO,Blanco/Amarillo,38.5
BOTAS CHIRUCA SPANIEL 12 GORE-TEX MARRON 39 MARRON,Marron,39
"BOTAS LA SPORTIVA OLYMPUS MONS EVO NEGRO AMARILLO 42,5 NEGRO/AMARILLO",Negro/Amarillo,"42,5"
botas chiruca xacobeo 05 goretex hombre gris petroleo 44 gris,Gris,44
PIES DE GATO LA SPORTIVA KATANA TANGERINE-TROPIC BLUE 43.5 NARANJA/AZUL,Naranja/Azul,43.5
botas chiruca urales 12 gore-tex marron 41 marron,Marron,41
Pies de gato la sportiva solution white-yellow 43.5 blanco/amarillo,Blanco/Amarillo,43.5
Chaqueta columbia powder lite jkt hombre negro 2xl negro,Negro,2XL
chaqueta hara trango amaranto m violeta,Violeta,M
Chaqueta Chiruca Polar Axe 08 Hombre XL Verde/Naranja,Verde/Naranja,XL
botas chiruca cares 05 gore-tex gris 46 gris,Gris,46
ZAPATILLAS SAUCONY JAZZ ORIGINAL VINTAGE HOMBRE NEGRO NEGRO 45 NEGRO,Negro,45
botas chiruca massana 07 gore-tex burdeos 39 burdeos,Burdeos,39
Pies de gato La Sportiva Futura Blue-Yellow 40.5 Azul/Amarillo,Azul/Amarillo,40.5
Pantalones chiruca silvano pro 11 hombre xl kaki,Kaki,XL
PANTALONES TRANGOWORLD TRX2 PES STRETCH PRO HOMBRE NEGRO AZUL S NEGRO/AZUL,Negro/Azul,S
la sportiva mutant hombre gris lima 41.5 gris/verde,Gris/Verde,41.5
zapatillas la sportiva ultra raptor hombre negro verde 45.5 naranja/verde,Naranja/Verde,45.5
BOTAS CHIRUCA MASSANA 05 GORE-TEX ASFALTO-ROJO 34 Asfalto,Asfalto,34
Bermudas ternua mika mujer morado m morado,Morado,M
PANTALONES BREEZY COROMELL MUJER NEGRO PHLOX XL NEGRO/MORADO,Negro/Morado,XL
Botas chiruca troll 03 gore-tex azul marino 40 azul marino,Azul Marino,40
botas boreal desert 42 marron,Marron,42
Camas Mascotas Siesta - 85 Cm Rojo Mariquitas para perros o gatos,Rojo,85 cm
Pies de gato La Sportiva Solution White-Yellow 45 Blanco/Amarillo,Blanco/Amarillo,45
BOTAS CHIRUCA CLETA 02 MARRON 43 MARRON,Marron,43
Zapatillas boreal glove oliva 45.5 verde oliva,verde oliva,45.5
botas chiruca cameros 02 marron 42 marron,Marron,42
Chaleco trx2 800 pro trango negro-negro m negro,Negro,M
Zapatillas la sportiva jynx niños 36-40 ópalo manzana verde 39 azul,Azul,39
ZAPATILLAS BOREAL BAMBA W'S GRANATE 37.5 GRANATE,Granate,37.5
chaqueta trail running salomon bonatti wp hombre azul naranja s azul/naranja,Azul/Naranja,S
ZAPATILLAS LA SPORTIVA PYRAMID MUJER GTX MARRÓN 38 MARRON,Marron,38
"ZAPATILLAS LA SPORTIVA AKYRA HOMBRE AZUL OCEANO 42,5 AZUL",Azul,"42,5"
zapatillas chiruca cuba 05 gore-tex gris-azul-rosa 36 gris/azul,Gris/Azul,36
CALCETINES LORPEN T2 LIGHT HIKER GRIS 39/42 GRIS,Gris,39/42
Zapatillas Boreal GLOVE OLIVA 46.5 verde oliva,verde oliva,46.5
Pies de gato la sportiva solution white-yellow 38.5 blanco/amarillo,Blanco/Amarillo,38.5
zapatillas saucony excursion tr11 hombre rojo gris 42 rojo/gris,Rojo/Gris,42
Pies de gato La Sportiva Genius 45.5 Rojo/Amarillo,Rojo/Amarillo,45.5
Pies de gato La Sportiva Finale mujer Grey-Coral 39.5 Gris/Coral,Gris/Coral,39.5
"BOTAS BOREAL MAIPO 44,5 GRIS",Gris,"44,5"
BOTAS CHIRUCA XACOBEO 05 GORE-TEX GRIS-PETROLEO 43 GRIS,Gris,43
Botas La Sportiva Trango Tech Gtx Negro-Amarillo 40 Negro/Amarillo,Negro/Amarillo,40
sandalias hi-tec santorini strap mujer taupe 41 taupe,Taupe,41
BOTAS CHIRUCA RIGLOS 05 GRIS 42 Gris,Gris,42
Pies de gato la sportiva tc pro 44 crema,Crema,44
SANDALIAS CHIRUCA MALIBU 05 MUJER GRIS MORADO 37 GRIS,Gris,37
Botas Boreal BAMBA MID MARINO 41.5 Azul Marino,Azul Marino,41.5
"ZAPATILLAS LA SPORTIVA AKASHA HOMBRE ÓPALO CHILE 41,5 AZUL/ROJO",Azul/Rojo,"41,5"
Zapatillas new balance kd373 burdeos 28 burdeos,Burdeos,28
PIES DE GATO LA SPORTIVA MYTHOS TERRA 40.5 TIERRA OSCURA,Tierra Oscura,40.5
"ZAPATILLAS NIKE FLEX EXPERIENCE RN 7 MUJER PISTOLA DE HUMO 38,5 GRIS/ROSA",Gris/Rosa,"38,5"
zapatillas chiruca sendero 02 gore-tex marron 43 marron,Marron,43
Zapatillas boreal glove w's gris 41.5 gris,Gris,41.5
Pies de gato la sportiva futura blue-yellow 38.5 azul/amarillo,Azul/Amarillo,38.5
pies de gato la sportiva tarantula mujer turquoise 39 turquesa,Turquesa,39
Pies de gato La Sportiva Kataki Ocean-Sulphur 40.5 Azul/Amarillo,Azul/Amarillo,40.5
zapatillas la sportiva kaptiva goretex mujer negro orquídea 37 negro/fuxia,Negro/Fuxia,37
zapatillas nike downshifter 8 hombre gris negro 43 gris/negro,Gris/Negro,43
Botas chiruca cleta 02 marron 40 marron,Marron,40
chaqueta campagnolo 3a01787n zip hood hombre antracita verde 46 antracita,Antracita,46
Sandalias Chiruca Cartagena 11 Mujer Azul Turquesa 40 Turquesa,Turquesa,40
Pies de gato la sportiva katana tangerine-tropic blue 40.5 naranja/azul,Naranja/Azul,40.5
BOTAS TREKKING SALOMON AUTHENTIC LTR GTX HOMBRE NEGRO CAFÉ 43 1/3 NEGRO/CAFÉ,Negro/Café,43 1/3
Sandalias chiruca cartagena 05 mujer gris morado 39 gris,Gris,39
"zapatillas trail running la sportiva bushido hombre gris verde 42,5 gris/verde",Gris/Verde,"42,5"
PIES DE GATO LA SPORTIVA MIURA MUJER WHITE-JADE GREEN 40 BLANCO/VERDE,Blanco/Verde,40
Zapatillas La Sportiva Ultra Raptor Hombre Naranja Gris 43.5 Naranja/Gris,Naranja/Gris,43.5
ZAPATILLAS BOREAL DROM W'S MORADO 38 MORADO,Morado,38
ZAPATILLAS BOREAL GLOVE OLIVA 42.5 VERDE OLIVA,verde oliva,42.5
Zapatillas Boreal SALSA W'S TURQUESA 37.5 Turquesa,Turquesa,37.5
BOTAS BOREAL NELION WOMEN'S 38 LIMA,Lima,38
Zapatillas Saucony Peregrine Iso Hombre Naranja 48 Naranja,Naranja,48
CHAQUETA +8000 POTOSI 19I 993 HOMBRE GRANITO M GRIS,Gris,M
zapatillas chiruca maracaibo 19 morado 37 morado,Morado,37
Pies de gato La Sportiva Katana Tangerine-Tropic Blue 38.5 Naranja/Azul,Naranja/Azul,38.5
Zapatillas Salomon X Ultra 3 Goretex Hombre Mar De Los Sargazos 41 1/3 Azul,Azul,41 1/3
Zapatillas Merrell Moab 2 GoreTex Hombre Beluga 43 Gris Oscuro,Gris Oscuro,43
Botas la sportiva trango trk gtx amarillo negro 41.5 amarillo/negro,Amarillo/Negro,41.5
ZAPATILLAS TRAIL RUNNING LA SPORTIVA AKASHA HOMBRE NEGRO 44.5 NEGRO/AMARILLO,Negro/Amarillo,44.5
Zapatillas la sportiva hyrax gtx marrón 41 marron,Marron,41
Botas Boreal ZANSKAR GRIS 40 Gris,Gris,40
ZAPATILLAS LA SPORTIVA MUTANT MUJER ÓPALO AGUA 43 Agua,Agua,43
PIES DE GATO LA SPORTIVA KATANA YELLOW-BLACK 41.5 AMARILLO/NEGRO,Amarillo/Negro,41.5
Botas Chiruca Xacobeo 36 GoreTex Hombre Gris Oscuro 41 Gris Oscuro,Gris Oscuro,41
Sandalias chiruca malibu 05 gris-morado 36 gris,Gris,36
"Zapatillas De Trekking The North Face Hedgehog Fastpack Gtx Hombre Azul 42,5 Azul",Azul,"42,5"
Zapatillas trail running Salomon Xa Pro 3D GTX Hombre Navy 49 1/3 Navy,Navy,49 1/3
Botas Boreal ASPEN 33 Gris/Rojo,Gris/Rojo,33
"SANDALIAS TEVA HURRICANE XLT2 HOMBRE BUMERANG NEGRO 39,5 NEGRO",Negro,"39,5"
BOTAS DE SENDERISMO HI-TEC FORZA MID WP NIÑOS GRIS 37 GRIS,Gris,37
Pies de gato la sportiva finale sulphur-blue 41.5 amarillo/azul,Amarillo/Azul,41.5
zapatillas new balance gm500 hombre gris plata 42 plata,Plata,42
BOTAS CHIRUCA TROLL 06 GORE-TEX LILA 38 Lila,Lila,38
Zapatillas Salomon Sense Ride 2 Hombre Ilusión Azul 44 2/3 Azul,Azul,44 2/3
SANDALIAS HI-TEC SANTORINI STRAP MUJER TAUPE 37 TAUPE,Taupe,37
Mallas running new balance impact tight negro hombre m negro,Negro,M
Camiseta running salomon elevate seamless ls tee mujer turquesa l turquesa,Turquesa,L
Pantalones Trekking Izas Escort Hombre Caqui M Kaki,Kaki,M
Sudadera +8000 almaden j 044 niños azul 16 azul,Azul,16
BOTAS CHIRUCA BASSET 12 GORE-TEX MARRON 41 MARRON,Marron,41
ZAPATILLAS NEW BALANCE FUELCORE NERGIZE MUJER ROSA 37 ROSA,Rosa,37
botas chiruca galicia 02 gore-tex marron 43 marron,Marron,43
ZAPATILLAS MERRELL MOAB 2 GORETEX HOMBRE NAVY 41 NAVY,Navy,41
BOTAS CHIRUCA BERREA HI VIS 08 GORE-TEX MARRON-NARANJA 43 MARRON,Marron,43
"ZAPATILLAS LA SPORTIVA UNIKA HOMBRE NEGRO 41,5 NEGRO",Negro,"41,5"
BOTAS LA SPORTIVA TRANGO TRK GTX AMARILLO NEGRO 40 AMARILLO/NEGRO,Amarillo/Negro,40
sudadera trangoworld poppi mujer azul rosa xs azul/rosa,Azul/Rosa,XS
