title,color,size
Zapatillas Trail Running Salomon Sense Ride Hombre Rojo Negro 42 Rojo/negro,Rojo/Negro,42
zapatillas boreal glove oliva 42.5 verde oliva,verde oliva,42.5
Zapatillas chiruca etnico 03 gtx surround marino-marron 41 azul marino,Azul Marino,41
zapatillas salomon outline goretex hombre blazer azul marino 44 navy,Navy,44
Zapatillas new balance wl373 mujer óxido 37 rosa,Rosa,37
pies de gato la sportiva mythos terra 45 tierra oscura,Tierra Oscura,45
"zapatillas la sportiva helios sr hombre amarillo 38,5 amarillo",Amarillo,"38,5"
chaqueta salomon bonatti race wp hombre gris s gris,Gris,S
Pies de gato La Sportiva Solution White-Yellow 42 Blanco/Amarillo,Blanco/Amarillo,42
"Zapatillas saucony excursion tr12 mujer azul negro 38,5 azul/negro",Azul/Negro,"38,5"
pies de gato la sportiva solution white-yellow 35.5 blanco/amarillo,Blanco/Amarillo,35.5
ZAPATILLAS HI-TEC BADWATER HOMBRE NEGRO BLANCO 41 NEGRO/BLANCO,Negro/Blanco,41
zapatillas boreal sendai gris 44 gris,Gris,44
ATTIPAS - ZAPATOS PRIMEROS PASOS ATTIPAS TIE 20 GRIS,GRIS,20
botas la sportiva olympus mons evo negro amarillo 46 negro/amarillo,Negro/Amarillo,46
Botas boreal desert 42 marron,Marron,42
botas boreal tempest mid marron 42.5 marron,Marron,42.5
BOTAS CHIRUCA MONIQUE 12 GORE-TEX MARRON 39 MARRON,Marron,39
"attipas - zapatos primeros pasos attipas tie 21,5 gris",GRIS,"21,5"
"Botas Boreal Apache Marron 45,5 Marron",Marron,"45,5"
zapatillas nike tanjun premium hombre azul 43 azul,Azul,43
botas chiruca monique 12 gore-tex marron 42 marron,Marron,42
pies de gato la sportiva katana mujer white-purple 40 blanco/morado,Blanco/Morado,40
Zapatillas Salomon Xa Pro 3d Goretex Hombre Negro 41 1/3 Negro,Negro,41 1/3
CHALECO THE NORTH FACE THERMOBALL VEST HOMBRE M NEGRO,Negro,M
MALLAS ANTICELULITICAS SONTRESS 1051 MUJER M NEGRO,Negro,M
Chaqueta columbia mission air interchange hombre verde oliva s verde oliva,Verde oliva,S
Zapatillas la sportiva akasha mujer ópalo agua 42 agua,Agua,42
CAMISETA TERNUA KAILEY MUJER MORADO S MORADO,Morado,S
Sudadera trekking trangoworld poppi mujer verde granate l verde,Verde,L
Pantalones trangoworld dobu fi hombre negro m negro,Negro,M
Zapatillas nike downshifter 8 hombre lobo gris 43 gris,Gris,43
Zapatillas trail running la sportiva akyra mujer azul naranja 37 azul/naranja,Azul/Naranja,37
Zapatillas salomon x radiant goretex hombre beluga 42 2/3 gris oscuro,Gris Oscuro,42 2/3
Botas Boreal NELION WOMEN'S 42 Lima,Lima,42
zapatillas boreal futura ws gris 42 gris,Gris,42
botas boreal bamba mid marino 43 1/4 azul marino,Azul Marino,43 1/4
SOMBRERO TERNUA KLILUK BEIGE S/M TAUPE,Taupe,S/M
zapatillas salomon xa elevate j niños rojo 32 rojo,Rojo,32
ZAPATILLAS SALOMON XA PRO 3D J NIÑOS CERISE 31 CEREZA,Cereza,31
Botas chiruca massana 07 gore-tex burdeos 40 burdeos,Burdeos,40
"Zapatillas columbia peakfreak venture lt hombre cordobés 41,5 chocolate",Chocolate,"41,5"
Zapatillas merrell outmost vent goretex hombre roca 44 roca,Roca,44
Zapatillas new balance kd373 verde 37 verde,Verde,37
ZAPATILLAS LA SPORTIVA AKASHA MUJER AZUL MARINO PÚRPURA 36 AZUL/MORADO,Azul/Morado,36
"ZAPATILLAS TRAIL RUNNING LA SPORTIVA MUTANT HOMBRE GRIS LIMA 40,5 GRIS/VERDE",Gris/Verde,"40,5"
"ZAPATILLAS LA SPORTIVA LYCAN HOMBRE NEGRO AZUL 41,5 NEGRO/AZUL",Negro/Azul,"41,5"
Sandalias Hi-tec Delos Mujer Violeta 37 Violeta,Violeta,37
zapatillas boreal futura antracita 46.5 antracita,Antracita,46.5
pies de gato la sportiva genius 40.5 rojo/amarillo,Rojo/Amarillo,40.5
zapatillas new balance fuelcore nergize mujer rosa palo 40 rosa palo,Rosa Palo,40
Botas boreal bamba mid gris 39.5 gris,Gris,39.5
zapatillas new balance gc574 pigmento negro 38 azul/negro,Azul/Negro,38
Zapatillas De Montaña Hi-tec Bandera Lite Low Wp Hombre Gris 46 Gris,Gris,46
Zapatillas trail running La Sportiva Akasha Hombre Negro Azufre 41.5 Negro/Azufre,Negro/Azufre,41.5
Zapatillas boreal flyers vent marino 42 azul marino,Azul Marino,42
Botas Chiruca Game Hi Vis 08 GoreTex Hombre 40 Marron,Marron,40
Botas Boreal Flyers Mid 47 Gris/amarillo,Gris/Amarillo,47
"Zapatillas La Sportiva Unika Hombre Negro 41,5 Negro",Negro,"41,5"
Pies de gato La Sportiva Katana Tangerine-Tropic Blue 39.5 Naranja/Azul,Naranja/Azul,39.5
botas chiruca urales 12 gore-tex marron 39 marron,Marron,39
Botas de montaña boreal hurricane hombre antracita 45 1/4 antracita,Antracita,45 1/4
Pies de gato La Sportiva Otaki mujer Sulphur-Coral 40.5 Amarillo/Rosa,Amarillo/Rosa,40.5
Zapatillas Nike Downshifter 8 Mujer Lobo Gris 40 Gris,Gris,40
Pantalones running salomon agile short mujer morado m morado,Morado,M
Zapatillas boreal alligator women's 42 rojo,Rojo,42
Botas Boreal BAMBA MID MARINO 43 1/4 Azul Marino,Azul Marino,43 1/4
Camiseta ternua talok 1/2 zip hombre mousse grey s gris,Gris,S
chaleco trx2 800 pro trango negro-negro m negro,Negro,M
BOTAS BOREAL KERALA GRIS 42 GRIS,Gris,42
BOTAS BOREAL ORDESA WOMEN'S GRIS 38 3/4 GRIS,Gris,38 3/4
ZAPATILLAS CHIRUCA PANTERA GTX 03 GORE-TEX GRIS-AZUL 37 GRIS/AZUL,Gris/Azul,37
ZAPATILLAS SALOMON X ULTRA 3 GTX HOMBRE NEGRO 44 2/3 NEGRO,Negro,44 2/3
ZAPATILLAS LA SPORTIVA AKYRA HOMBRE AMARILLO 41 AMARILLO,Amarillo,41
"ZAPATILLAS SAUCONY JAZZ TRAIL ORIGINAL HOMBRE PÚRPURA 44,5 PÚRPURA",Púrpura,"44,5"
Pies de gato la sportiva katana tangerine-tropic blue 44 naranja/azul,Naranja/Azul,44
ZAPATILLAS LA SPORTIVA ULTRA RAPTOR HOMBRE NEGRO AMARILLO 43.5 Negro/Amarillo,Negro/Amarillo,43.5
Zapatillas trail running la sportiva akyra mujer salmon 38 salmon,Salmon,38
zapatillas saucony jazz original vintage niños verde 32 verde,Verde,32
Zapatillas Saucony Excursion Tr12 Mujer Morado 38 Morado,Morado,38
zapatillas boreal glove w's gris 37.5 gris,Gris,37.5
"botas boreal bamba mid marino 45,5 azul marino",Azul Marino,"45,5"
Botas chiruca massana 05 gore-tex asfalto-rojo 36 asfalto,Asfalto,36
Zapatillas Nike Air Max Motion Lw Gs Negro 38 Negro,Negro,38
Zapatillas new balance fresh foam cruz on mujer gris 41 gris,Gris,41
ZAPATILLAS BOREAL ALLIGATOR WOMEN'S 42 ROJO,Rojo,42
Zapatillas la sportiva lycan mujer gris verde 39 gris/verde,Gris/Verde,39
"Zapatillas La Sportiva Akasha Hombre Ópalo Chile 41,5 Azul/rojo",Azul/Rojo,"41,5"
Pies de gato la sportiva miura mujer white-jade green 38 blanco/verde,Blanco/Verde,38
Zapatillas Salomon X Ultra 3 Gtx Mujer Verde 38 2/3 Verde,Verde,38 2/3
Pies de gato La Sportiva Futura mujer Jade Green-White 36 Verde/Blanco,Verde/Blanco,36
BOTAS CHIRUCA CARES 05 GORE-TEX GRIS 37 GRIS,Gris,37
botas chiruca massana 07 gore-tex burdeos 37 burdeos,Burdeos,37
"ZAPATILLAS SAUCONY EXCURSION TR12 HOMBRE NEGRO AZUL 42,5 NEGRO/AZUL",Negro/Azul,"42,5"
Pies de gato La Sportiva Finale Brown-Orange 46.5 Marrón/Naranja,Marrón/Naranja,46.5
Zapatillas trail running salomon xa enduro hombre 41 1/3 azul/naranja,Azul/Naranja,41 1/3
Zapatillas chiruca tasmania 10 gore-tex gris 41 gris,Gris,41
PIES DE GATO LA SPORTIVA FINALE MUJER GREY-CORAL 33 GRIS/CORAL,Gris/Coral,33
BOTAS CHIRUCA MASSANA 07 GORE-TEX BURDEOS 37 BURDEOS,Burdeos,37
ZAPATILLAS COLUMBIA CANYON POINT WATERPROOF HOMBRE CARBON 48 CARBON,Carbon,48
Botas boreal tempest mid marron 42.5 marron,Marron,42.5
BOTAS BOREAL HURRICANE VERDE 42 VERDE,Verde,42
Botas Salewa Ms Mtn Trainer Mid Goretex Hombre Negro Amarillo 41 Negro/amarillo,Negro/Amarillo,41
Pies de gato La Sportiva Finale Sulphur-Blue 45.5 Amarillo/Azul,Amarillo/Azul,45.5
Zapatillas la sportiva akasha mujer ópalo agua 42 agua,Agua,42
Botas Hi-tec Garcia Sport Wp Hombre Taupe 41 Taupe,Taupe,41
Zapatillas trail running la sportiva ultra raptor hombre naranja gris 43 naranja/gris,Naranja/Gris,43
Zapatillas salomon x ultra 3 gtx hombre azul azul 45 1/3 azul/azul,Azul/Azul,45 1/3
ZAPATILLAS LA SPORTIVA MUTANT MUJER ÓPALO AGUA 39 AGUA,Agua,39
"ZAPATILLAS SAUCONY EXCURSION TR11 HOMBRE GRIS BURDEOS 44,5 GRIS/ROJO",Gris/Rojo,"44,5"
BOTAS CHIRUCA BERREA FORCE HI VIS 18 GORE-TEX MARRON-NARANJA 41 MARRON,Marron,41
botas la sportiva trango tech gtx negro-amarillo 42.5 negro/amarillo,Negro/Amarillo,42.5
zapatillas chiruca maracaibo 19 morado 37 morado,Morado,37
zapatillas trail running salomon sense ride hombre rojo negro 44 2/3 rojo/negro,Rojo/Negro,44 2/3
PANTALONES TRANGOWORLD DOBU FI HOMBRE NEGRO M NEGRO,Negro,M
Botas Chiruca Massana 06 Goretex Mujer Gris Morado 38 Gris,Gris,38
botas chiruca gredos supra 12 gore-tex marron 43 marron,Marron,43
Zapatillas Nike Revolution 4 Gs Azul 36 Azul,Azul,36
Botas la sportiva trango tech gtx negro-amarillo 42.5 negro/amarillo,Negro/Amarillo,42.5
"Attipas - zapatos attipas primeros pasos cutie blanco 21,5 blanco",BLANCO,"21,5"
Chaqueta mac in a sac mias origin rojo lava l lava,Lava,L
Botas chiruca troll 06 gore-tex lila 25 lila,Lila,25
Zapatillas Nike Flex Contact 2 Hombre Negro 43 Negro,Negro,43
zapatillas boreal sendai ws lila 37.5 lila,Lila,37.5
Zapatillas HI-Tec Wild-Fire Low I Wp Hombre Chocolate 41 Chocolate,Chocolate,41
BOTAS CHIRUCA MONIQUE 12 GORE-TEX MARRON 41 MARRON,Marron,41
Mallas de compresión sontress 5005 mujer l negro,Negro,L
CHAQUETA MAC IN A SAC MIAS ORIGIN ROJO LAVA M LAVA,Lava,M
Pies de gato la sportiva genius 38.5 rojo/amarillo,Rojo/Amarillo,38.5
zapatillas la sportiva jynx niños 36-40 negro 39 negro/amarillo,Negro/Amarillo,39
camiseta running salomon s-lab sense tank mujer m rosa,Rosa,M
ZAPATILLAS CHIRUCA TASMANIA 10 GORE-TEX GRIS 37 Gris,Gris,37
pantalones breezy coromell hombre negro rojo 2xl negro/rojo,Negro/Rojo,2XL
Pies de gato La Sportiva Solution mujer White-Lily Orange 38 Blanco/Naranja,Blanco/Naranja,38
botas la sportiva nepal trek evo gtx antracita-rojo 47 antracita,Antracita,47
Botas chiruca dynamic 05 gore-tex gris-rojo 45 gris/rojo,Gris/Rojo,45
botas salomon x ultra 3 mid gtx mujer azul lima 38 2/3 azul/verde,Azul/Verde,38 2/3
Chaqueta Sieber Complet Gtx Trango Kaki 2xl Kaki,Kaki,2XL
"zapatillas boreal sendai vent grafito 44,5 gris/verde",Gris/verde,"44,5"
Zapatillas La Sportiva Unika Hombre Carbón Azul 43 Gris/azul,Gris/Azul,43
Chaqueta Ternua Jaksam Hombre Gris Negro S Gris/Negro,Gris/Negro,S
PIES DE GATO LA SPORTIVA MIURA MUJER WHITE-JADE GREEN 35 BLANCO/VERDE,Blanco/Verde,35
Chaqueta Trail Running Salomon Bonatti Wp Hombre Naranja M Naranja,Naranja,M
zapatillas new balance fresh foam gobi v3 mujer burgundy 41 burdeos,Burdeos,41
Botas chiruca troll 05 goretex niños gris rojo 30 gris/rojo,Gris/Rojo,30
CHAQUETA CAMPAGNOLO 3A01787N ZIP HOOD HOMBRE ANTRACITA VERDE 46 ANTRACITA,Antracita,46
Zapatillas Boreal SENDAI GRIS 41.5 Gris,Gris,41.5
Chiruca boxer boa 01 goretex hombre 43 marron verdoso,Marron verdoso,43
Botas La Sportiva Trango Trk Gtx Amarillo Negro 40 Amarillo/Negro,Amarillo/Negro,40
Pantalones Trangoworld Limut Dn Hombre Negro L Negro,Negro,L
botas chiruca urales 12 gore-tex marron 41 marron,Marron,41
Attipas - attipas calzado los primeros pasos sneakers violeta 20 violeta,VIOLETA,20
Botas boreal maipo 41.5 gris,Gris,41.5
Botas chiruca game hi vis 08 goretex hombre 41 marron,Marron,41
BOTAS CHIRUCA CAMEROS 02 MARRON 41 Marron,Marron,41
Botas hi-tec ravus adventure mid wp hombre chocolate 46 chocolate,Chocolate,46
Zapatillas la sportiva uragano goretex hombre negro amarillo 44 negro/amarillo,Negro/Amarillo,44
Pies de gato La Sportiva Finale mujer Grey-Coral 38.5 Gris/Coral,Gris/Coral,38.5
BOTAS CHIRUCA XACOBEO 27 GORETEX HOMBRE MARRON 43 MARRON,Marron,43
Pies de gato La Sportiva Solution White-Yellow 37 Blanco/Amarillo,Blanco/Amarillo,37
zapatillas saucony jazz original vintage hombre verde kaki 43 verde,Verde,43
Imsevimse - bañador-pañal imsevimse con volante l rosa flamingo,Rosa flamingo,L
Zapatillas salomon x ultra 3 prime goretex mujer málaga 38 2/3 rosa,Rosa,38 2/3
PIES DE GATO LA SPORTIVA SOLUTION MUJER WHITE-LILY ORANGE 39 BLANCO/NARANJA,Blanco/Naranja,39
BOTAS LA SPORTIVA TRANGO TECH GTX NEGRO-AMARILLO 42 NEGRO/AMARILLO,Negro/Amarillo,42
CHAQUETA DE PUNTO CAMPAGNOLO 3H60747N HOMBRE VAQUERO 46 VAQUERO,Vaquero,46
pies de gato la sportiva otaki blue-flame 37.5 azul/naranja,Azul/Naranja,37.5
"ZAPATILLAS NEW BALANCE GM500 HOMBRE BURDEOS BLANCO 46,5 BURDEOS",Burdeos,"46,5"
Pies de gato la sportiva mythos lady 35.5 blanco,Blanco,35.5
zapatillas new balance wl574 mujer coral 40 coral,Coral,40
"ZAPATILLAS NEW BALANCE GM500 HOMBRE GRIS PLATA 47,5 PLATA",Plata,"47,5"
CAMISETA INTERIOR TRX2 WOOL WM PRO TRANGO GRIS CLARO-GRIS OSCURO XS Gris,Gris,XS
Zapatillas la sportiva falkon gtx 27-35 gris 27 gris,Gris,27
CAMISETA INTERIOR TRX2 WOOL WM PRO TRANGO GRIS CLARO-GRIS OSCURO XXL GRIS,Gris,XXL
Botas La Sportiva Trango Trk Mujer Gtx Azul 40 Azul,Azul,40
BOTAS CHIRUCA RIGLOS 05 GRIS 34 GRIS,Gris,34
Zapatillas Salomon X Ultra 3 Gtx Mujer Gris 40 2/3 Gris,Gris,40 2/3
zapatillas new balance u220 hombre azul 43 azul,Azul,43
"attipas - attipas calzado los primeros pasos zoo azul 22,5 azul",AZUL,"22,5"
botas chiruca boxer boa 12 gore-tex marron 42 marron,Marron,42
BOTAS SALOMON X ULTRA 3 MID GTX MUJER IMÁN 39 1/3 NEGRO,Negro,39 1/3
zapatillas boreal flyers vent marino 43 1/4 azul marino,Azul Marino,43 1/4
Chaqueta trail running salomon bonatti wp hombre azul naranja s azul/naranja,Azul/Naranja,S
Pies de gato la sportiva finale sulphur-blue 41.5 amarillo/azul,Amarillo/Azul,41.5
Zapatillas Trail Running La Sportiva Bushido Mujer Azul Naranja 38 Azul/naranja,Azul/Naranja,38
pantalones breezy tryn hombre negro gris 2xl negro/gris,Negro/Gris,2XL
SANDALIAS CHIRUCA CARTAGENA 05 MUJER GRIS MORADO 39 GRIS,Gris,39
Botas La Sportiva Nepal Trek Evo Gtx Antracita-rojo 47 Antracita,Antracita,47
calcetines lorpen t3 midweight hiker negro 39/42 negro,Negro,39/42
pies de gato la sportiva tarantula mujer turquoise 42 turquesa,Turquesa,42
Zapatillas boreal sendai vent grafito 40 3/4 gris/verde,Gris/verde,40 3/4
Chaqueta Trx2 Loft Pro Trango Azul Oscuro-azul Oscuro 2xl Azul,Azul,2XL
Botas Boreal TEMPEST MID GRAFITO 40 Gris/Verde,Gris/Verde,40
saucony jazz original vintage hombre mostaza 45 mostaza,Mostaza,45
zapatillas trail running the north face ultra equity gtx hombre 41 negro,Negro,41
Zapatillas salomon ultra pro hombre clima tormentoso 42 gris/naranja,Gris/Naranja,42
ZAPATILLAS LA SPORTIVA MUTANT MUJER ÓPALO AGUA 39 AGUA,Agua,39
BOTAS CHIRUCA SOMIEDO 05 GORE-TEX GRIS 44 Gris,Gris,44
pies de gato la sportiva futura mujer jade green-white 37 verde/blanco,Verde/Blanco,37
Zapatillas De Trekking Salomon X Ultra 3 Hombre Azul Poseidon 45 1/3 Azul,Azul,45 1/3
Botas chiruca somiedo 12 goretex hombre marrón 41 marron,Marron,41
Zapatillas salomon x ultra 3 gtx hombre negro 46 negro,Negro,46
ZAPATILLAS NEW BALANCE AM331 HOMBRE NAVY 42 NAVY,Navy,42
Zapatillas la sportiva kaptiva goretex hombre negro amarillo 43 negro/amarillo,Negro/Amarillo,43
Chaqueta ternua long island hombre ballenas grises xl gris,Gris,XL
chaqueta mac in a sac mias ultra negro naranja m negro/naranja,Negro/Naranja,M
"Zapatillas boreal magma grafito 46,5 gris oscuro",Gris Oscuro,"46,5"
Botas columbia cascade pass waterproof hombre marron 42 marron,Marron,42
Pantalones breezy coromell mujer negro phlox l negro/morado,Negro/Morado,L
"ZAPATILLAS NEW BALANCE FRESH FOAM CRAG V2 HOMBRE ORO 41,5 ORO BRILLANTE",Oro brillante,"41,5"
Zapatillas trail running La Sportiva Mutant Hombre Gris Lima 42 Gris/Verde,Gris/Verde,42
pies de gato la sportiva miura lime 42 lima,Lima,42
pies de gato la sportiva otaki blue-flame 42 azul/naranja,Azul/Naranja,42
CHAQUETA POLAR CAMPAGNOLO 38P1536 MUJER ROCK 38 ROCA,Roca,38
Botas boreal turkana marron 40 marron,Marron,40
ZAPATILLAS NEW BALANCE ML574 HOMBRE BURDEOS 44 BURDEOS,Burdeos,44
ZAPATILLAS LA SPORTIVA FALKON LOW 27-35 GRIS 31 GRIS,Gris,31
Zapatillas boreal sendai ws gris 41.5 gris,Gris,41.5
Botas boreal kovach gris 42.5 gris,Gris,42.5
Chaqueta aspen trango azul oscuro l azul oscuro,Azul oscuro,L
zapatillas hi-tec quadra classic wp hombre tupe 46 taupe,Taupe,46
pantalones trangoworld kasu fi hombre gris m gris,Gris,M
Botas Columbia Canyon Point Mid Waterproof Hombre Marron 41 Marron,Marron,41
PIES DE GATO LA SPORTIVA FUTURA MUJER JADE GREEN-WHITE 37 VERDE/BLANCO,Verde/Blanco,37
ZAPATILLAS SALOMON X ULTRA 3 GTX HOMBRE NEGRO 42 NEGRO,Negro,42
Zapatillas salomon x radiant goretex hombre beluga 44 gris oscuro,Gris Oscuro,44
BOTAS BOREAL FUJI 47 MARRON,Marron,47
"botas boreal maipo 44,5 gris",Gris,"44,5"
Sandalias chiruca cartagena 05 mujer gris morado 39 gris,Gris,39
Zapatillas trail running la sportiva ultra raptor hombre naranja gris 47 gris/naranja,Gris/Naranja,47
zapato bomio ip trango marron chocolate 41 marron,Marron,41
ZAPATILLAS MERRELL MOAB 2 GORETEX HOMBRE NAVY 41 NAVY,Navy,41
CHAQUETA ESQUÍ TRANGOWORLD KUHAN HOMBRE L NEGRO/NARANJA,Negro/Naranja,L
ZAPATILLAS CHIRUCA ETNICO 03 GTX SURROUND MARINO-MARRON 44 Azul Marino,Azul Marino,44
zapatillas la sportiva kaptiva goretex hombre negro amarillo 44.5 negro/amarillo,Negro/Amarillo,44.5
Zapatillas chiruca tasmania 10 gore-tex gris 44 gris,Gris,44
"botas la sportiva trango trk leather gtx gris verde 42,5 carbon",Carbon,"42,5"
BOTAS BOREAL KOVACH GRIS 44 GRIS,Gris,44
PIES DE GATO LA SPORTIVA SOLUTION WHITE-YELLOW 38.5 BLANCO/AMARILLO,Blanco/Amarillo,38.5
ZAPATILLAS CHIRUCA SENDERO 02 GORE-TEX MARRON 43 Marron,Marron,43
Zapatillas La Sportiva Jynx Niños 36-40 Ópalo Manzana Verde 38 Azul,Azul,38
Botas chiruca somiedo 12 goretex hombre marrón 41 marron,Marron,41
botas boreal bamba mid marino 42.5 azul marino,Azul Marino,42.5
PIES DE GATO LA SPORTIVA KATANA MUJER WHITE-PURPLE 41.5 BLANCO/MORADO,Blanco/Morado,41.5
ZAPATILLAS NEW BALANCE FRESH FOAM CRUZ ON HOMBRE BURDEOS 41.5 BURDEOS,Burdeos,41.5
Pies de gato La Sportiva Finale VS mujer Grey-Coral 36 Gris/Coral,Gris/Coral,36
Botas Campagnolo Rigel Mid Wp Hombre Madera 42 Marron,Marron,42
ZAPATILLAS SKECHERS GORUN FAST VALOR HOMBRE ROJO 42 ROJO,Rojo,42
"ZAPATILLAS TRAIL RUNNING LA SPORTIVA AKYRA MUJER VERDE 37,5 VERDE",Verde,"37,5"
zapatillas nike revolution 4 gs azul 36 azul,Azul,36
zapatillas boreal glove oliva 42 verde oliva,verde oliva,42
botas salomon x ultra 3 mid gtx hombre castor gray 46 gris,Gris,46
Zapatillas la sportiva akyra goretex hombre carbón verde manzana 43.5 carbon,Carbon,43.5
ZAPATILLAS MERRELL OUTMOST VENT GORETEX HOMBRE GRANITE 43 GRIS,Gris,43
Botas De Nieve Salewa Ms Capsico Mid Insulated Hombre 44 1/2 Negro,Negro,44 1/2
ZAPATILLAS NEW BALANCE FRESH FOAM CRUZ ON MUJER GRIS 41 GRIS,Gris,41
mallas anticeluliticas sontress 1051 mujer m negro,Negro,M
Zapatillas New Balance KD373 Morado 40 Morado,Morado,40
Chaqueta Salomon Bonatti Race Wp Hombre Gris S Gris,Gris,S
Chaqueta trail running salomon lightning wp mujer celeste s turquesa,Turquesa,S
zapatillas boreal sendai ws lila 38 3/4 lila,Lila,38 3/4
Forro polar campagnolo 3g10747 hombre negro blanco 48 negro/blanco,Negro/Blanco,48
ZAPATILLAS RUNNING NIKE REVOLUTION 3 HOMBRE GRIS ROJO 42 GRIS,Gris,42
zapatillas boreal aztec women's 41.5 gris,Gris,41.5
zapatillas trail running salomon sense ride hombre rojo negro 44 2/3 rojo/negro,Rojo/Negro,44 2/3
zapatillas la sportiva ultra raptor goretex mujer esmeralda menta 38 azul,Azul,38
BOTAS CHIRUCA DYNAMIC 52 GORE-TEX MARRON 40 MARRON,Marron,40
pies de gato la sportiva kataki mujer mint-coral 37.5 menta,Menta,37.5
chaqueta trx2 stretch pro trango azul-azul oscuro 3xl azul,Azul,3XL
"Botas boreal ketil verde 39,5 verde",Verde,"39,5"
pies de gato la sportiva mythos terra 48 tierra oscura,Tierra Oscura,48
PIES DE GATO LA SPORTIVA OTAKI MUJER SULPHUR-CORAL 37 AMARILLO/ROSA,Amarillo/Rosa,37
sandalias hi-tec delos mujer azul 40 azul,Azul,40
Botas la sportiva tx5 gtx hombre 41.5 gris,Gris,41.5
pies de gato la sportiva futura blue-yellow 37.5 azul/amarillo,Azul/Amarillo,37.5
attipas - calzado los primeros pasos urban attipas 20 amarillo,AMARILLO,20
ZAPATILLAS BOREAL GLOVE OLIVA 42.5 VERDE OLIVA,verde oliva,42.5
Zapatillas saucony azura hombre blanco 41 blanco,Blanco,41
Zapatillas Salomon X Ultra 3 Gtx Mujer Tawny 37 1/3 Rojo,Rojo,37 1/3
BOTAS CHIRUCA MONIQUE 12 GORE-TEX MARRON 39 MARRON,Marron,39
Botas chiruca cameros 02 marron 40 marron,Marron,40
Zapatillas La Sportiva Akasha Hombre Ópalo Chile 43 Azul/rojo,Azul/Rojo,43
pantalones trangoworld kasu fi hombre gris m gris,Gris,M
botas boreal zanskar full grain 42 marron,Marron,42
Pies de gato la sportiva tarentula 41.5 gris,Gris,41.5
Botas boreal drom mid grafito 42 gris/verde,Gris/Verde,42
Pies de gato la sportiva skwama mujer apple green-cobalt blue 36 verde/azul,Verde/Azul,36
Pies de gato La Sportiva Katana mujer White-Purple 39 Blanco/Morado,Blanco/Morado,39
Botas Chiruca Massana 07 Gore-tex Burdeos 38 Burdeos,Burdeos,38
PIES DE GATO LA SPORTIVA FINALE MUJER GREY-CORAL 38.5 GRIS/CORAL,Gris/Coral,38.5
ZAPATILLAS LA SPORTIVA AKASHA HOMBRE ÓPALO CHILE 43 AZUL/ROJO,Azul/Rojo,43
zapatillas merrell moab 2 goretex hombre navy 41 navy,Navy,41
PIES DE GATO LA SPORTIVA MIURA MUJER WHITE-JADE GREEN 34 BLANCO/VERDE,Blanco/Verde,34
zapatillas salomon xa pro 3d hombre mikonos 43 1/3 azul,Azul,43 1/3
Botas Chiruca Trofeo 01 GoreTex Pointer Hombre 44 Kaki,Kaki,44
Botas boreal yucatan gris 44.5 gris,Gris,44.5
Zapatillas running nike flex experience rn 5 hombre negro 44 negro,Negro,44
PIES DE GATO LA SPORTIVA FINALE SULPHUR-BLUE 39 AMARILLO/AZUL,Amarillo/Azul,39
BOTAS MILLET HIGH ROUTE GORETEX HOMBRE NEGRO VERDE ÁCIDO 45 1/3 NEGRO/VERDE,Negro/Verde,45 1/3
Zapatillas La Sportiva Ultra Raptor Hombre Negro Verde 41.5 Negro/Verde,Negro/Verde,41.5
"ATTIPAS - Zapatos primeros pasos attipas tie 21,5 GRIS",GRIS,"21,5"
Sombrero ternua kliluk taupe s/m taupe,Taupe,S/M
"ZAPATILLAS BOREAL DROM GRIS 42,5 GRIS",Gris,"42,5"
ZAPATILLAS SALOMON X RADIANT GORETEX HOMBRE BELUGA 41 1/3 GRIS OSCURO,Gris Oscuro,41 1/3
BOTAS HI-TEC GARCIA SPORT WP HOMBRE CHOCOLATE 46 CHOCOLATE,Chocolate,46
zapatillas trail running la sportiva akasha hombre negro 45 negro/amarillo,Negro/Amarillo,45
BOTAS THE NORTH FACE HEDGEHOG FASTPACK MID GTX HOMBRE NEGRO 47 NEGRO,Negro,47
zapatillas saucony excursion tr12 hombre negro azul 46 negro/azul,Negro/Azul,46
Botas Campagnolo Rigel Mid Wp Hombre Azul Verde 44 Verde/azul,Verde/Azul,44
Zapatillas Hi-tec Razor Low Wp Hombre Gris Naranja 41 Gris/naranja,Gris/Naranja,41
Zapatillas trekking salewa ms wildfire vent hombre marron 43 marron,Marron,43
botas chiruca panticosa 12 gore-tex marron 41 marron,Marron,41
Zapatillas trail running salomon wings pro 2 hombre azul verde 46 azul/verde,Azul/Verde,46
ZAPATILLAS SAUCONY JAZZ ORIGINAL VINTAGE NIÑOS VERDE 32 VERDE,Verde,32
Zapatillas Salomon X Ultra 3 Goretex Hombre Cuerda Elástica 47 1/3 Marron,Marron,47 1/3
Zapatillas nike tanjun se hombre azul 44 azul,Azul,44
"Zapatillas nike revolution 4 eu mujer tormenta 38,5 azul",Azul,"38,5"
Pies de gato La Sportiva Cobra Slate 37.5 Gris,Gris,37.5
Pies de gato la sportiva finale vs mujer grey-coral 36 gris/coral,Gris/Coral,36
Zapatillas la sportiva kaptiva goretex hombre negro amarillo 41.5 negro/amarillo,Negro/Amarillo,41.5
botas de montaña chiruca somontano 06 goretex hombre 41 gris,Gris,41
Botas chiruca sarria 07 mujer gris burdeos 39 gris,Gris,39
BOTAS BOREAL KERALA GRIS 37 GRIS,Gris,37
Zapatillas trekking salewa ms speed ascent hombre azul amarillo 48.5 azul/amarillo,Azul/Amarillo,48.5
botas hi-tec garcia sport wp hombre gris 41 gris,Gris,41
Zapatillas New Balance Gc574 Resina Desvanecida Negro 39 Kaki,Kaki,39
CHAQUETA RUNNING SALOMON S-LAB LIGHT JACKET HOMBRE L BLANCO,Blanco,L
Zapatillas Nike Flex Contact 2 Hombre Antracita 43 Antracita,Antracita,43
Botas chiruca constanza 03 gore-tex negro 36 negro,Negro,36
zapatillas la sportiva ultra raptor hombre negro amarillo 42.5 negro/amarillo,Negro/Amarillo,42.5
PANTALONES CORTOS TRANGO WORLD YITTU MUJER MORADO M MORADO,Morado,M
chaqueta de montaña the north face evolve ii triclimate hombre negro m negro,Negro,M
chaqueta de montaña the north face evolve ii triclimate hombre negro m negro,Negro,M
ZAPATILLAS SALOMON OUTLINE GORETEX HOMBRE BLAZER AZUL MARINO 45 1/3 NAVY,Navy,45 1/3
zapatillas salomon ultra pro hombre naranja azul 42 naranja/azul,Naranja/Azul,42
zapatillas trail running salomon wings flyte goretex hombre gris  42 gris,Gris,42
PANT. LARGO TRX2 SHELL WM PRO GTX TRANGO MORADO-MORADO XS Morado,Morado,XS
Botas chiruca cameros 02 marron 41 marron,Marron,41
Polaina trangoworld force verde l verde,Verde,L
Zapatillas boreal glove w's malva 37 morado,Morado,37
CHAQUETA TRAIL RUNNING SALOMON BONATTI WP HOMBRE AZUL NARANJA XL AZUL/NARANJA,Azul/Naranja,XL
Sombrero Ternua Kliluk Taupe L/XL Taupe,Taupe,L/XL
PIES DE GATO LA SPORTIVA SOLUTION MUJER WHITE-LILY ORANGE 39 BLANCO/NARANJA,Blanco/Naranja,39
Pies de gato la sportiva futura blue-yellow 40 azul/amarillo,Azul/Amarillo,40
BOTAS CHIRUCA BERREA HI VIS 08 GORE-TEX MARRON-NARANJA 42 MARRON,Marron,42
botas chiruca trofeo 01 goretex pointer hombre 41 kaki,Kaki,41
Zapatillas boreal futura ws gris 41.5 gris,Gris,41.5
Zapatillas running salomon x-mission 2 hombre 42 2/3 azul,Azul,42 2/3
Botas la sportiva trango trk leather gtx gris verde 40 carbon,Carbon,40
botas chiruca cares 52 gore-tex marron 39 marron,Marron,39
chaqueta trx2 shell wm pro gtx trango morado-morado xs morado,Morado,XS
Zapatillas Columbia Redmond V2 Wp Mujer Acero Gris Ciruela Púrpura 38 Gris,Gris,38
Zapatillas boreal sendai ws gris 41.5 gris,Gris,41.5
Zapatillas Boreal Drom W's Morado 42 Morado,Morado,42
Botas Hi-Tec Ravus Vent Mid WP Hombre Chocolate 42 Chocolate,Chocolate,42
Botas campagnolo rigel mid wp hombre azul verde 44 verde/azul,Verde/Azul,44
Zapatillas La Sportiva Jynx Niños 27-35 Ópalo Manzana Verde 35 Azul,Azul,35
Zapatillas skechers gorun fast valor hombre rojo 42 rojo,Rojo,42
botas montaña millet ld high route mesh mujer 40 2/3 gris,Gris,40 2/3
ZAPATILLAS SALOMON XA ELEVATE J NIÑOS ROJO 31 ROJO,Rojo,31
sombrero ternua kliluk beige s/m taupe,Taupe,S/M
Saucony jazz original vintage hombre mostaza 45 mostaza,Mostaza,45
botas boreal karok 40 marron,Marron,40
Botas boreal atlas 40 marron,Marron,40
botas chiruca massana 05 gore-tex asfalto-rojo 36 asfalto,Asfalto,36
"BOTAS LA SPORTIVA NEPAL CUBE GTX AMARILLO 39,5 AMARILLO",Amarillo,"39,5"
BOTAS CHIRUCA BERREA Hi Vis 08 GORE-TEX MARRON-NARANJA 41 Marron,Marron,41
