title,color,size
Pies de gato La Sportiva Skwama mujer Apple Green-Cobalt Blue 38 Verde/Azul,Verde/Azul,38
Botas De Montaña Millet High Route Gtx Hombre 43 1/3 Marron,Marron,43 1/3
Pies de gato La Sportiva TC Pro 44.5 Crema,Crema,44.5
Botas Montaña Millet Ld High Route Mesh Hombre 42 2/3 Gris,Gris,42 2/3
Pies de gato La Sportiva Solution White-Yellow 43.5 Blanco/Amarillo,Blanco/Amarillo,43.5
Zapatillas Nike Downshifter 8 Hombre Lobo Gris 43 Gris,Gris,43
Botas Columbia Canyon Point Mid Waterproof Hombre Marron 41 Marron,Marron,41
Botas Hi-Tec Garcia Sport Wp Hombre Gris 42 Gris,Gris,42
Botas De Montaña Merrell Grassbow Mid Sport Goretex Hombre 41 Gris,Gris,41
Chaqueta Trx2 Stretch Pro Trango Azul-azul Oscuro 3xl Azul,Azul,3XL
Botas Chiruca Troll 01 GoreTex Niños Gris Verde 40 Gris/Verde,Gris/Verde,40
Botas The North Face Hedgehog Fastpack Mid Gtx Mujer Gris 37 Gris,Gris,37
Sudadera Trangoworld Simme Mujer Negro Azul L Negro/azul,Negro/Azul,L
Botas La Sportiva Trango Tower Gtx Negro Amarillo 43 Negro/amarillo,Negro/Amarillo,43
Pies de gato La Sportiva Skwama Black-Yellow 38 Negro/Amarillo,Negro/Amarillo,38
Zapatillas La Sportiva Unika Hombre Carbón Azul 43 Gris/azul,Gris/Azul,43
Pantalones Breezy Coromell Hombre Negro Azul XL Negro/Azul,Negro/Azul,XL
"Zapatillas La Sportiva Hyrax Gtx Marrón 41,5 Marron",Marron,"41,5"
Sandalias Senderismo Campagnolo Aquarii Mujer Hielo 40 Beig,Beig,40
"Zapatillas Nike Air Max Motion Lw Gs Negro 37,5 Negro",Negro,"37,5"
Zapatillas Trail Running Salomon Sense Ride Hombre Azul Naranja 41 1/3 Azul/naranja,Azul/Naranja,41 1/3
Pies de gato La Sportiva Finale Sulphur-Blue 38 Amarillo/Azul,Amarillo/Azul,38
Botas Hi-Tec Ravus Vent Mid WP Hombre Chocolate 42 Chocolate,Chocolate,42
Pies de gato La Sportiva Skwama mujer Apple Green-Cobalt Blue 41.5 Verde/Azul,Verde/Azul,41.5
ZAPATILLAS CHIRUCA DETROIT 12 GORE-TEX MARRON 41 Marron,Marron,41
Pies de gato La Sportiva Mythos Lady 40.5 Blanco,Blanco,40.5
BOTAS CHIRUCA TROLL 03 GORE-TEX AZUL MARINO 35 Azul Marino,Azul Marino,35
Pies de gato La Sportiva Skwama Black-Yellow 41.5 Negro/Amarillo,Negro/Amarillo,41.5
Zapatillas Montaña Millet Trident Guide Hombre 44 2/3 Rojo,Rojo,44 2/3
Zapatillas Saucony Jazz Original Vintage Mujer Gris Negro 40 Gris/negro,Gris/Negro,40
Zapatillas Nike Downshifter 8 Hombre Gris Negro 43 Gris/negro,Gris/Negro,43
Zapatillas La Sportiva Jynx Niños 36-40 Negro 36 Negro/amarillo,Negro/Amarillo,36
BOTAS CHIRUCA CARES 05 GORE-TEX GRIS 41 Gris,Gris,41
BOTAS CHIRUCA CLETA 02 MARRON 41 Marron,Marron,41
Zapatillas Salomon X Ultra 3 Gtx Hombre Azul Azul 42 2/3 Azul/azul,Azul/Azul,42 2/3
"Zapatillas trekking Salewa MS Firetail 3 GTX Hombre Negro Verde 44,5 Negro/Verde",Negro/Verde,"44,5"
Zapatillas La Sportiva Lycan Hombre Negro Azul 43 Negro/azul,Negro/Azul,43
Pies de gato La Sportiva Genius 40.5 Rojo/Amarillo,Rojo/Amarillo,40.5
Saucony Jazz Original Vintage Hombre Mostaza 45 Mostaza,Mostaza,45
Zapatillas Boreal Sendai Vent Verde 44 Verde,Verde,44
Chaqueta Campagnolo 3a01787n Zip Hood Hombre Antracita Verde 46 Antracita,Antracita,46
Camiseta Running The North Face Graphic Play Hard Tank Mujer Morado XS Morado,Morado,XS
ATTIPAS - Zapatos bebé ribbon rojo attipas 19 ROJO,ROJO,19
"Zapatillas La Sportiva Lycan Hombre Gris Verde 44,5 Gris/verde",Gris/Verde,"44,5"
Zapatillas Chiruca Spider Gtx 09 Gore-tex Negro-rojo 42 Negro/rojo,Negro/Rojo,42
BOTAS CHIRUCA TROLL 06 GORE-TEX LILA 28 Lila,Lila,28
Zapatillas Salomon Xa Elevate Hombre Rojo 44 Rojo,Rojo,44
Zapatillas Boreal SENDAI GRIS 41.5 Gris,Gris,41.5
Botas Hi-tec Garcia Sport Wp Hombre Chocolate 46 Chocolate,Chocolate,46
ZAPATILLAS LA SPORTIVA MUTANT MUJER ÓPALO AGUA 41 Agua,Agua,41
"ATTIPAS - Attipas calzado los primeros pasos zoo azul 22,5 AZUL",AZUL,"22,5"
Zapatillas Running Salomon X-Scream 3D Mujer 38 2/3 Lila/Morado,Lila/Morado,38 2/3
BOTAS CHIRUCA BERREA Hi Vis 08 GORE-TEX MARRON-NARANJA 42 Marron,Marron,42
Mochila Trail Running Salomon Adv Skin 5 Set Rojo Negro M/l Rojo/negro,Rojo/Negro,M/L
"ATTIPAS - Zapatos bebé ribbon gris attipas 22,5 GRIS",GRIS,"22,5"
Zapatillas Nike Twilight Runner Ue Hombre Negro 43 Negro,Negro,43
Botas Hi-tec Ravus Adventure Mid Wp Hombre Chocolate 42 Chocolate,Chocolate,42
Botas Boreal NELION WOMEN'S 40 Lima,Lima,40
Zapatillas Salomon Xa Pro 3d Goretex Hombre Lyon Azul 44 Azul,Azul,44
ZAPATILLAS LA SPORTIVA MUTANT MUJER ÓPALO AGUA 36.5 Agua,Agua,36.5
Sudadera The North Face Light Drew Peak Hombre Negro L Negro,Negro,L
BOTAS CHIRUCA MASSANA 05 GORE-TEX ASFALTO-ROJO 34 Asfalto,Asfalto,34
Zapatillas Salomon Xa Pro 3d Gtx Mujer Negro Violeta 38 2/3 Negro/rosa,Negro/Rosa,38 2/3
Mochila Trail Running Salomon Adv Skin 5 Set Rojo M/l Rojo,Rojo,M/L
Chaqueta de plumas Breezy Cefira Mujer Silver L Silver,Silver,L
Bermuda Ternua Kross Hombre Borgoña L Burdeos,Burdeos,L
"Calcetines Icebreaker Hike+ Light Crew Hombre 39 - 41,5 Gris",Gris,"39 - 41,5"
Zapatillas Trail Running The North Face Ultra Equity Gtx Hombre 41 Negro,Negro,41
BOTAS CHIRUCA GREDOS SUPRA 05 GORE-TEX GRIS 39 Gris,Gris,39
Zapatillas Trail Running Salomon Xa Pro 3d Gtx Hombre Navy 44 2/3 Navy,Navy,44 2/3
Zapatillas Boreal FLYERS 39.5 Gris/Amarillo,Gris/Amarillo,39.5
Zapatillas Skechers Gorun Fast Valor Hombre Rojo 42 Rojo,Rojo,42
Sudadera The North Face Open Gate FZ HD Hombre Kaki S Kaki,Kaki,S
Pies de gato La Sportiva Genius 39 Rojo/Amarillo,Rojo/Amarillo,39
Botas La Sportiva Trango Trk Gtx Carbon 47 Carbon,Carbon,47
Botas Boreal Ordesa Women's Gris 38 3/4 Gris,Gris,38 3/4
Zapatillas La Sportiva Ultra Raptor Hombre Naranja Gris 43.5 Naranja/Gris,Naranja/Gris,43.5
Zapatillas Boreal BAMBA ANTRACITA 45.5 Antracita,Antracita,45.5
Botas Chiruca Spaniel 12 Gore-tex Marron 39 Marron,Marron,39
Zapatillas Salomon X Ultra 3 Gtx Mujer Tawny 41 1/3 Rojo,Rojo,41 1/3
Botas The North Face Hedgehog Fastpack Mid Gtx Mujer Gris 37 Gris,Gris,37
Botas La Sportiva Trango Trk Mujer Gtx Azul 38 Azul,Azul,38
Chaqueta De Plumas Icepeak  Kaarl Hombre 54 Azul,Azul,54
Banda para el Pelo La Sportiva Fade Headband Negro Naranja L Negro/Naranja,Negro/Naranja,L
Botas Senderismo Hi-tec Riverstone Wp Hombre Gris 45 Gris,Gris,45
BOTAS CHIRUCA GREDOS SUPRA 05 GORE-TEX GRIS 47 Gris,Gris,47
Zapatillas trail running La Sportiva Akasha Hombre Negro 45 Negro/Amarillo,Negro/Amarillo,45
"Zapatillas Nike Air Max Motion Lw Gs Negro 37,5 Negro",Negro,"37,5"
Zapatillas Boreal DROM W'S MORADO 39.5 Morado,Morado,39.5
ATTIPAS - Attipas los primeros pasos puzzle azul 20 AZUL,AZUL,20
Zapatillas Columbia Canyon Point Hombre Negro 46 Negro,Negro,46
BOTAS CHIRUCA RIGLOS 05 GRIS 43 Gris,Gris,43
Zapatillas Saucony Jazz Original Vintage Niños Burdeos 35 Burdeos,Burdeos,35
BOTAS CHIRUCA TROLL 03 GORE-TEX AZUL MARINO 40 Azul Marino,Azul Marino,40
Botas de montaña Salomon Evasion 2 Mid LTR GoreTex Hombre Kaki 46 2/3 Kaki,Kaki,46 2/3
Pies de gato La Sportiva Solution White-Yellow 39.5 Blanco/Amarillo,Blanco/Amarillo,39.5
Chaqueta De Punto Campagnolo 38h2237 Hombre Cyano 50 Azul,Azul,50
Pies de gato La Sportiva Kataki mujer Mint-Coral 41 Menta,Menta,41
Chaqueta Helens Complet Trango Verde Caza S Verde,Verde,S
Chaqueta Haglöfs Heron Hombre Pizarra M Pizarra,Pizarra,M
Zapatillas Salomon Xa Pro 3d K Niños Cerise 27 Cereza,Cereza,27
Botas La Sportiva Trango Tech Gtx Negro-Amarillo 45 Negro/Amarillo,Negro/Amarillo,45
CHAQUETA ASPEN TRANGO AZUL OSCURO L Azul oscuro,Azul oscuro,L
Zapatillas La Sportiva Kaptiva GoreTex Mujer Negro Orquídea 37 Negro/Fuxia,Negro/Fuxia,37
Zapatillas Hi-tec Quixhill Wp Hombre 44 Gris,Gris,44
Botas La Sportiva Trango Trk Gtx Amarillo Negro 42.5 Amarillo/Negro,Amarillo/Negro,42.5
Pies de gato La Sportiva Tarantula mujer Turquoise 36 Turquesa,Turquesa,36
Zapatillas Saucony Excursion Tr11 Hombre Rojo Gris 42 Rojo/gris,Rojo/Gris,42
BOTAS CHIRUCA CARES 52 GORE-TEX MARRON 39 Marron,Marron,39
Zapatillas La Sportiva Kaptiva GoreTex Hombre Negro Amarillo 42.5 Negro/Amarillo,Negro/Amarillo,42.5
Zapatillas Boreal DROM W'S MORADO 40 Morado,Morado,40
Zapatillas La Sportiva TX4 Mujer Gris 42 Gris,Gris,42
Camiseta Termica Hg Original 8030 Hombre Rojo M Rojo/negro,Rojo/Negro,M
"ATTIPAS - Zapatos bebé ribbon gris attipas 22,5 GRIS",GRIS,"22,5"
Zapatillas Columbia Canyon Point Waterproof Hombre Marron 43 Marron,Marron,43
Zapatillas Salomon Outline GoreTex Hombre Blazer Azul Marino 44 Navy,Navy,44
Zapatillas Boreal BAMBA ANTRACITA 41.5 Antracita,Antracita,41.5
Pies de gato La Sportiva Katana mujer White-Purple 39.5 Blanco/Morado,Blanco/Morado,39.5
Zapatillas Boreal GLOVE W'S MALVA 37 Morado,Morado,37
Zapatillas Boreal SALSA W'S TURQUESA 37.5 Turquesa,Turquesa,37.5
Pies de gato La Sportiva Finale mujer Grey-Coral 37.5 Gris/Coral,Gris/Coral,37.5
BOTAS CHIRUCA MONIQUE 12 GORE-TEX MARRON 41 Marron,Marron,41
Zapatillas Boreal BAMBA W'S GRANATE 38 Granate,Granate,38
Pantalones Trangoworld Prote Extreme DS Hombre Gris Negro L Gris/Negro,Gris/Negro,L
Botas Chiruca Troll 05 GoreTex Niños Gris Rojo 32 Gris/Rojo,Gris/Rojo,32
Zapatillas Salomon Outline GoreTex Hombre Blazer Azul Marino 44 Navy,Navy,44
Zapatillas Columbia Canyon Point Waterproof Hombre Carbon 40 Carbon,Carbon,40
"Botas La Sportiva G5 Negro Amarillo 44,5 Negro/amarillo",Negro/Amarillo,"44,5"
Zapatillas Boreal GLOVE W'S GRIS 41.5 Gris,Gris,41.5
Chaqueta trail running Salomon Bonatti Wp Hombre Azul Naranja M Azul/Naranja,Azul/Naranja,M
Botas Trekking Salomon Authentic Ltr Gtx Hombre Negro Café 43 1/3 Negro/café,Negro/Café,43 1/3
Botas La Sportiva Trango Guide Evo Gtx Azul 42 Azul/rojo,Azul/Rojo,42
Zapatillas Salomon X Ultra 3 Gtx Mujer Tawny 39 1/3 Rojo,Rojo,39 1/3
Zapatillas New Balance ML574 Hombre Burdeos 44 Burdeos,Burdeos,44
Botas Boreal ATLAS MARINO 38 Azul Marino,Azul Marino,38
Zapatillas Salomon X Radiant Goretex Hombre Beluga 41 1/3 Gris Oscuro,Gris Oscuro,41 1/3
Calcetines Lorpen T2 Light Hiker Gris 39/42 Gris,Gris,39/42
Pies de gato La Sportiva Solution mujer White-Lily Orange 40.5 Blanco/Naranja,Blanco/Naranja,40.5
Zapatillas Hi-tec Sensor Trail Lite Hombre Azul 45 Azul,Azul,45
Botas Merrell Accentor Sport Mid Goretex Mujer Negro Acuífero 39 Negro/azul,Negro/Azul,39
Pies de gato La Sportiva Miura mujer White-Jade Green 35.5 Blanco/Verde,Blanco/Verde,35.5
Botas Boreal KAROK 40 Marron,Marron,40
"Zapatillas Boreal SENDAI VENT GRAFITO 45,5 Gris/Verde",Gris/Verde,"45,5"
Mochila trail running Salomon S-Lab Sense Ultra 8 Set Blanco XL Blanco,Blanco,XL
Zapatillas Salomon Cove Hombre 42 Gris,Gris,42
Pies de gato La Sportiva Solution mujer White-Lily Orange 38 Blanco/Naranja,Blanco/Naranja,38
ZAPATILLAS CHIRUCA DETROIT 12 GORE-TEX MARRON 43 Marron,Marron,43
BOTAS CHIRUCA MASSANA 05 GORE-TEX ASFALTO-ROJO 35 Asfalto,Asfalto,35
Botas Chiruca Mars Boa 05 Goretex Niños Gris Rojo 35 Gris/rojo,Gris/Rojo,35
Zapatillas La Sportiva Akyra Hombre Azul Oceano 43 Azul,Azul,43
Zapatillas La Sportiva Spire Gtx Hombre Gris 44 Negro,Negro,44
Zapatillas Salomon Xa Pro 3d Goretex Hombre Negro 48 Negro,Negro,48
Zapatillas Trail Running La Sportiva Ultra Raptor Hombre Naranja Gris 46 Gris/naranja,Gris/Naranja,46
Botas Boreal ATLAS MARINO 38 3/4 Azul Marino,Azul Marino,38 3/4
Botas Salomon X Ultra 3 Mid GTX Hombre Castor Gray 46 Gris,Gris,46
Zapatillas Saucony Jazz Original Vintage Niños Navy 34 Navy,Navy,34
Zapatillas Salomon Xa Elevate J Niños Rojo 38 Rojo,Rojo,38
"Sandalias Teva Hurricane Xlt2 Hombre Bumerang Negro 45,5 Negro",Negro,"45,5"
"Botas Boreal Drom Mid Rojo 44,5 Rojo",Rojo,"44,5"
Chaqueta de fibras The North Face Thermoball Hoodie Hombre Gris Oscuro S Gris Oscuro,Gris Oscuro,S
Botas Chiruca Sarria 07 Mujer Gris Burdeos 38 Gris,Gris,38
Zapatillas La Sportiva Akyra Hombre Gris Azul 43 Gris/Azul,Gris/Azul,43
Zapatillas Salomon Ultra Pro Hombre Clima Tormentoso 41 1/3 Gris/Naranja,Gris/Naranja,41 1/3
Pant. Largo Slaggard Trango Negro-celeste L Negro/azul,Negro/Azul,L
Zapatillas trail running La Sportiva Mutant Hombre Gris Lima 42 Gris/Verde,Gris/Verde,42
Zapatillas trail running Salomon Xa Enduro Hombre 44 2/3 Azul/Naranja,Azul/Naranja,44 2/3
Parka The North Face Zaneck Hombre Gris L Gris,Gris,L
Pantalones Esquí de travesía Salomon Active Soft Shell Mujer M Rojo con cremallera entera,Rojo con cremallera entera,M
Pies de gato La Sportiva Miura mujer White-Jade Green 38 Blanco/Verde,Blanco/Verde,38
Zapatillas Salomon Ultra Pro Hombre Clima Tormentoso 43 1/3 Gris/Naranja,Gris/Naranja,43 1/3
Botas Chiruca Massana 07 Gore-tex Burdeos 39 Burdeos,Burdeos,39
Zapatillas Boreal SENDAI WS LILA 38 3/4 Lila,Lila,38 3/4
Zapatillas Boreal FLYERS VENT MARINO 42 Azul Marino,Azul Marino,42
Chaqueta Esquí Trangoworld Kuhan Hombre L Negro/naranja,Negro/Naranja,L
"Zapatillas New Balance Fresh Foam Crag V2 Hombre Oro 41,5 Oro Brillante",Oro brillante,"41,5"
Zapatillas Boreal BAMBA ANTRACITA 40 Antracita,Antracita,40
Pantalones Salomon Agile 2in1 Short Hombre Gris M Gris,Gris,M
Zapatillas Salomon Evasion 2 Aero Hombre Gris 44 Marron,Marron,44
Botas Boreal Sherpa 40 Marron,Marron,40
BOTAS CHIRUCA MASSANA 05 GORE-TEX ASFALTO-ROJO 34 Asfalto,Asfalto,34
Zapatillas New Balance ML574 Hombre Burdeos 44 Burdeos,Burdeos,44
Botas Boreal BAMBA MID WS GRIS 39.5 Gris,Gris,39.5
Botas Boreal BAMBA MID WS GRIS 37.5 Gris,Gris,37.5
Pies de gato La Sportiva Mythos Terra 37.5 Tierra Oscura,Tierra Oscura,37.5
"Botas Boreal Maipo 44,5 Gris",Gris,"44,5"
Botas Boreal ASPEN 29 Gris/Rojo,Gris/Rojo,29
BOTAS CHIRUCA BERREA FORCE Hi Vis 18 GORE-TEX MARRON-NARANJA 43 Marron,Marron,43
Botas Boreal BAMBA MID MARINO 40 Azul Marino,Azul Marino,40
Botas Montaña Merrell Moab Mid GoreTex Hombre Marron 43 Marron,Marron,43
Botas Boreal KOVACH GRIS 46 Gris,Gris,46
Zapatillas Salomon Xa Pro 3d Goretex Hombre Negro 48 Negro,Negro,48
Zapatillas Saucony Jazz Trail Original Hombre Verde 41 Verde,Verde,41
Zapatillas Boreal SENDAI WS GRIS 41.5 Gris,Gris,41.5
Botas Boreal BAMBA MID MARINO 41.5 Azul Marino,Azul Marino,41.5
Saucony Jazz Original Vintage Hombre Mostaza 44 Mostaza,Mostaza,44
Sandalias Hi-tec Delos Mujer Azul 40 Azul,Azul,40
Zapatillas De Trekking Salomon X Ultra 2 Gtx Hombre Lima 44 2/3 Lima,Lima,44 2/3
Zapatillas Saucony Jazz Original Vintage Niños Burdeos 35 Burdeos,Burdeos,35
"Zapatillas Boreal Chameleon Azul 45,5 Azul",Azul,"45,5"
Zapatillas Salomon X Ultra 3 Goretex Hombre Cuerda Elástica 45 1/3 Marron,Marron,45 1/3
Zapatillas New Balance Fresh Foam Cruz On Hombre Negro Imán 42 Negro,Negro,42
Botas de Montaña Merrell Moab Fst Ice+ Thermo Hombre 41 Verde oliva,Verde oliva,41
BOTAS CHIRUCA SPANIEL 12 GORE-TEX MARRON 42 Marron,Marron,42
Zapatillas de trekking Salewa Ms MTN Trainer Hombre Gris 41 Gris,Gris,41
"Zapatillas La Sportiva Mutant Mujer Cieruela Manzana Verde 36,5 Cereza",Verde/Cereza,"36,5"
Pies de gato La Sportiva Futura mujer Jade Green-White 33.5 Verde/Blanco,Verde/Blanco,33.5
