title,color,size
sudadera trekking trangoworld login hombre azul verde 2xl azul/verde,Azul/Verde,2XL
ZAPATILLAS CHIRUCA SPIDER GTX 09 GORE-TEX NEGRO-ROJO 40 NEGRO/ROJO,Negro/Rojo,40
ZAPATILLAS SALOMON XA PRO 3D GORETEX HOMBRE NEGRO 44 NEGRO,Negro,44
zapatillas saucony jazz trail original hombre verde 41 verde,Verde,41
ZAPATILLAS MERRELL OUTMOST VENT GORETEX HOMBRE ROCA 42 ROCA,Roca,42
Pies de gato La Sportiva TC Pro 44.5 Crema,Crema,44.5
Zapatillas Trail Running The North Face Ultra Equity Hombre 44 Azul,Azul,44
Botas La Sportiva Trango Trk Gtx Amarillo Negro 44.5 Amarillo/Negro,Amarillo/Negro,44.5
Chaqueta de senderismo ternua zixon therm hoody hombre burdeos s burdeos,Burdeos,S
chaqueta argualas trango verde caza l verde,Verde,L
Attipas - attipas los primeros pasos puzzle azul 20 azul,AZUL,20
zapatillas chiruca tasmania 10 gore-tex gris 40 gris,Gris,40
Botas Chiruca Xacobeo 12 GoreTex Hombre Marron 42 Marron,Marron,42
ZAPATILLAS SALOMON XA PRO 3D GTX MUJER NEGRO VIOLETA 38 2/3 NEGRO/ROSA,Negro/Rosa,38 2/3
sudadera trekking trangoworld poppi mujer verde granate l verde,Verde,L
botas la sportiva trango guide evo gtx azul 45 azul/rojo,Azul/Rojo,45
BOTAS CHIRUCA GREDOS SUPRA 05 GORE-TEX GRIS 41 GRIS,Gris,41
Botas the north face hedgehog fastpack mid gtx mujer gris 37 gris,Gris,37
Botas hi-tec garcia sport wp hombre chocolate 46 chocolate,Chocolate,46
ZAPATILLAS CHIRUCA SPIDER GTX 09 GORE-TEX NEGRO-ROJO 41 NEGRO/ROJO,Negro/Rojo,41
"zapatillas la sportiva kaptiva goretex mujer negro orquídea 38,5 negro/fuxia",Negro/Fuxia,"38,5"
chaqueta trx2 shell wm pro gtx trango morado-morado xs morado,Morado,XS
botas chiruca boxer boa 12 gore-tex marron 39 marron,Marron,39
Zapatillas boreal glove antracita 44 antracita,Antracita,44
Botas chiruca gredos supra 05 gore-tex gris 38 gris,Gris,38
Chaqueta Mac In A Sac Mias Origin Rojo Lava M Lava,Lava,M
ZAPATILLAS RUNNING SALOMON X-SCREAM 3D MUJER 38 2/3 LILA/MORADO,Lila/Morado,38 2/3
Pies de gato La Sportiva Katana Tangerine-Tropic Blue 41.5 Naranja/Azul,Naranja/Azul,41.5
Zapatillas Saucony Excursion Tr12 Hombre Negro Azul 44 Negro/azul,Negro/Azul,44
Zapatillas salomon x ultra 3 gtx mujer artic 40 verde,Verde,40
BOTAS LA SPORTIVA NEPAL TREK EVO GTX ANTRACITA-ROJO 47 ANTRACITA,Antracita,47
Botas La Sportiva Trango Trk Gtx Carbon 47 Carbon,Carbon,47
PANTALONES BREEZY COROMELL HOMBRE NEGRO GRIS M NEGRO/GRIS,Negro/Gris,M
Pies de gato La Sportiva Tarantula mujer Turquoise 35.5 Turquesa,Turquesa,35.5
zapatillas la sportiva lycan hombre negro azul 43 negro/azul,Negro/Azul,43
BOTAS CHIRUCA TROLL 06 GORE-TEX LILA 30 LILA,Lila,30
SUDADERA TRANGOWORLD OBY NIÑOS VERDE AZUL 16 VERDE/AZUL,Verde/Azul,16
"Botas The North Face Hedgehog Fastpack Mid Gtx Hombre Negro 42,5 Negro",Negro,"42,5"
BOTAS BOREAL BAMBA MID MARINO 40 AZUL MARINO,Azul Marino,40
Botas senderismo hi-tec riverstone wp hombre gris 41 gris,Gris,41
pies de gato la sportiva kataki mujer mint-coral 35.5 menta,Menta,35.5
ZAPATILLAS BOREAL CHAMELEON AZUL 46 AZUL,Azul,46
botas salomon x ultra 3 mid gtx hombre castor gray 44 2/3 gris,Gris,44 2/3
zapatillas la sportiva jynx niños 36-40 ópalo manzana verde 39 azul,Azul,39
"Zapatillas la sportiva hyrax mujer gtx azul 39,5 azul",Azul,"39,5"
PIES DE GATO LA SPORTIVA OTAKI MUJER SULPHUR-CORAL 39.5 AMARILLO/ROSA,Amarillo/Rosa,39.5
ZAPATILLAS LA SPORTIVA MUTANT MUJER ÓPALO AGUA 39 Agua,Agua,39
PANTALONES TRANGOWORLD TRX2 PES STRETCH PRO HOMBRE NEGRO AZUL S NEGRO/AZUL,Negro/Azul,S
Pies de gato La Sportiva Otaki Blue-Flame 37 Azul/Naranja,Azul/Naranja,37
CAMISETA TERNUA KAILEY MUJER MORADO S MORADO,Morado,S
Pies de gato la sportiva otaki blue-flame 42 azul/naranja,Azul/Naranja,42
ZAPATILLAS  HI-TEC DEXTER LOW WP HOMBRE MARRON 46 NEGRO,Negro,46
zapatillas trail running salomon xa enduro hombre 44 2/3 azul/naranja,Azul/Naranja,44 2/3
zapatillas columbia ivo trail hombre negro vapor 44 negro,Negro,44
Botas boreal siana coral 38 coral,Coral,38
Botas chiruca somiedo 05 gore-tex gris 37 gris,Gris,37
Pies de gato La Sportiva Mythos Terra 39.5 Tierra Oscura,Tierra Oscura,39.5
Pies de gato La Sportiva Skwama mujer Apple Green-Cobalt Blue 33 Verde/Azul,Verde/Azul,33
BOTAS BOREAL HURRICANE ANTRACITA 40 ANTRACITA,Antracita,40
Zapatillas salomon rx slide 4.0 hombre negro 42 2/3 negro,Negro,42 2/3
botas de montaña merrell moab fst ice+ thermo hombre 43 verde oliva,Verde oliva,43
Calcetines Trail Running Compressport Pro Racing Socks V3.0 Verde 45 - 48 Verde,Verde,45 - 48
Zapatillas Salomon Ultra Pro Mujer Azulejo Azul 40 Azul,Azul,40
Botas La Sportiva Trango Tech Gtx Negro-Amarillo 40.5 Negro/Amarillo,Negro/Amarillo,40.5
Zapatillas Trail Running La Sportiva Akasha Mujer Negro Morado 38 Negro/morado,Negro/Morado,38
ATTIPAS - ZAPATOS BEBÉ RIBBON GRIS ATTIPAS 19 GRIS,GRIS,19
ZAPATILLAS COLUMBIA REDMOND V2 WP MUJER EXPRÉS OCÉANO PROFUNDO 39 MARRON,Marron,39
sandalias hi-tec delos mujer marron 40 marron,Marron,40
pies de gato la sportiva katana mujer white-purple 41.5 blanco/morado,Blanco/Morado,41.5
zapatillas new balance fresh foam hierro v3 hombre imán negro 47 negro,Negro,47
PIES DE GATO LA SPORTIVA KATANA YELLOW-BLACK 43.5 AMARILLO/NEGRO,Amarillo/Negro,43.5
botas boreal kovach gris 44 gris,Gris,44
ZAPATILLAS LA SPORTIVA AKASHA HOMBRE GRIS AZUL 41.5 GRIS/AZUL,Gris/Azul,41.5
BOTAS BOREAL ZANSKAR MARRON 42 MARRON,Marron,42
BOTAS LA SPORTIVA TRANGO TRK GTX AMARILLO NEGRO 44.5 AMARILLO/NEGRO,Amarillo/Negro,44.5
Pies de gato la sportiva cobra slate 39.5 gris,Gris,39.5
botas montaña millet ld high route mesh hombre 44 2/3 gris,Gris,44 2/3
MOCHILA TRAIL RUNNING SALOMON S-LAB SENSE ULTRA 8 SET BLANCO XL BLANCO,Blanco,XL
Zapatillas salomon xa elevate hombre 44 azul,Azul,44
Zapatillas Nike Downshifter 8 Hombre Azul 43 Azul,Azul,43
ZAPATILLAS NIKE TANJUN PREMIUM HOMBRE AZUL 43 AZUL,Azul,43
Pantalones Cortos Senderismo +8000 Tremaya Mujer Negro Fuxia M Negro/fuxia,Negro/Fuxia,M
Zapatillas Boreal GLOVE ANTRACITA 44 Antracita,Antracita,44
Botas Chiruca Xacobeo 12 Goretex Hombre Marron 39 Marron,Marron,39
botas chiruca boxer boa 12 gore-tex marron 43 marron,Marron,43
Pies de gato la sportiva katana yellow-black 36.5 amarillo/negro,Amarillo/Negro,36.5
botas boreal hurricane verde 42 verde,Verde,42
zapatillas new balance kd373 marron 37 marron,Marron,37
ZAPATILLAS BOREAL SENDAI WS GRIS 41.5 GRIS,Gris,41.5
chaqueta campagnolo 3a01787n hombre rojo 48 rojo,Rojo,48
ZAPATILLAS SALOMON XA ELEVATE J NIÑOS ROJO 32 ROJO,Rojo,32
chaqueta polar campagnolo 38p1536 mujer rock 38 roca,Roca,38
"zapatillas new balance fresh foam gobi v3 mujer burgundy 37,5 burdeos",Burdeos,"37,5"
CHAQUETA THE NORTH FACE STRATOS HOMBRE NEGRO L NEGRO,Negro,L
Botas Salomon X Ultra 3 Mid Gtx Hombre Sargasso 46 Azul,Azul,46
pant. largo trx2 soft pro trango azul-azul oscuro 2xl azul,Azul,2XL
Bermuda ternua kross hombre borgoña l burdeos,Burdeos,L
zapatillas chiruca tasmania 10 gore-tex gris 44 gris,Gris,44
"Sandalias Teva Hurricane Xlt2 Hombre Bumerang Negro 45,5 Negro",Negro,"45,5"
Botas hi-tec garcia sport wp hombre chocolate 44 chocolate,Chocolate,44
Zapatillas saucony shadow 5000 vintage hombre verde 41 verde,Verde,41
Zapatillas trail running la sportiva akasha hombre negro 45 negro/amarillo,Negro/Amarillo,45
SOMBRERO TERNUA KLILUK TAUPE L/XL TAUPE,Taupe,L/XL
Camiseta ternua kailey mujer morado s morado,Morado,S
CAMISETA RUNNING THE NORTH FACE GRAPHIC PLAY HARD TANK MUJER MORADO XS MORADO,Morado,XS
Pies de gato La Sportiva Finale VS mujer Grey-Coral 38 Gris/Coral,Gris/Coral,38
botas salomon x ultra 3 mid gtx hombre castor gray 48 gris,Gris,48
Botas boreal flyers mid 47 gris/amarillo,Gris/Amarillo,47
PIES DE GATO LA SPORTIVA SOLUTION MUJER WHITE-LILY ORANGE 39.5 BLANCO/NARANJA,Blanco/Naranja,39.5
botas chiruca gredos supra 42 gore-tex marron 42 marron,Marron,42
botas chiruca monique 07 goretex mujer burdeos 39 burdeos,Burdeos,39
SAUCONY JAZZ ORIGINAL VINTAGE MUJER GRANATE 40 GRANATE,Granate,40
Chaqueta cortaviento running dare2b blighted windshell mujer 38 rosa fuxia,Rosa fuxia,38
ZAPATILLAS DE SENDERISMO HI-TEC RUTA LOW WP HOMBRE MARRON 40 MARRON,Marron,40
zapatillas trail running salomon sense ride mujer azul 38 2/3 azul,Azul,38 2/3
"Zapatillas new balance u220 hombre azul 46,5 azul",Azul,"46,5"
Attipas - zapatos bebé ribbon gris attipas 20 gris,GRIS,20
ATTIPAS - ATTIPAS CALZADO LOS PRIMEROS PASOS SNEAKERS GRIS 19 GRIS,GRIS,19
zapatillas trail running la sportiva akasha hombre negro azufre 41.5 negro/azufre,Negro/Azufre,41.5
Pantalones escalada y esquí trangoworld trx2 shell wn mujer m negro/amarillo,Negro/Amarillo,M
Chaqueta Campagnolo Hybrid 3E48367 Hombre 50 Antracita,Antracita,50
ZAPATILLAS NEW BALANCE FUEL CORE COAST MUJER ROSA 39 ROSA,Rosa,39
ZAPATILLAS DE TREKKING SALOMON X ULTRA 3 HOMBRE AZUL POSEIDON 44 2/3 AZUL,Azul,44 2/3
Pies de gato la sportiva solution white-yellow 40.5 blanco/amarillo,Blanco/Amarillo,40.5
BOTAS CHIRUCA BOXER BOA 12 GORE-TEX MARRON 43 MARRON,Marron,43
ZAPATILLAS BOREAL FLYERS VENT MARINO 39.5 AZUL MARINO,Azul Marino,39.5
ZAPATILLAS RUNNING NIKE REVOLUTION 3 HOMBRE AZUL AZUL 44 AZUL/AZUL,Azul/Azul,44
pies de gato la sportiva tarantula mujer coral 35 coral,Coral,35
"SAUCONY JAZZ ORIGINAL VINTAGE HOMBRE AZUL 42,5 AZUL",Azul,"42,5"
sandalias de descanso salomon rx break mujer turquesa 40 2/3 turquesa,Turquesa,40 2/3
botas la sportiva trango tech gtx negro-amarillo 40.5 negro/amarillo,Negro/Amarillo,40.5
Mallas anticeluliticas sontress 1051 mujer l negro,Negro,L
BOTAS CHIRUCA MASSANA 05 GORE-TEX ASFALTO-ROJO 34 ASFALTO,Asfalto,34
BOTAS CHIRUCA PANTICOSA 06 GORE-TEX GRIS 40 Gris,Gris,40
zapatillas saucony excursion tr12 hombre negro azul 42 negro/azul,Negro/Azul,42
"Zapatillas new balance u410 hombre burdeos 47,5 burdeos",Burdeos,"47,5"
ZAPATILLAS TRAIL RUNNING LA SPORTIVA AKASHA HOMBRE NEGRO 44 NEGRO/AMARILLO,Negro/Amarillo,44
"Zapatillas la sportiva lycan mujer azul 37,5 azul",Azul,"37,5"
Zapatillas new balance am331 hombre navy 42 navy,Navy,42
PULLOVER TRX2 STRETCH PRO TRANGO AZUL-AZUL OSCURO 2XL AZUL,Azul,2XL
Botas Boreal SIANA CORAL 37 Coral,Coral,37
BOTAS BOREAL MALI GRIS 37.5 GRIS,Gris,37.5
zapatillas salomon xa pro 3d goretex hombre negro 48 negro,Negro,48
"ZAPATILLAS TRAIL RUNNING LA SPORTIVA ULTRA RAPTOR HOMBRE NARANJA GRIS 44,5 NARANJA/GRIS",Naranja/Gris,"44,5"
"Sandalias Teva Hurricane Xlt2 Hombre Bumerang Negro 39,5 Negro",Negro,"39,5"
"Botas La Sportiva Olympus Mons Evo Negro Amarillo 42,5 Negro/amarillo",Negro/Amarillo,"42,5"
Pies de gato La Sportiva Katana Tangerine-Tropic Blue 35 Naranja/Azul,Naranja/Azul,35
PIES DE GATO LA SPORTIVA FUTURA MUJER JADE GREEN-WHITE 33.5 VERDE/BLANCO,Verde/Blanco,33.5
"Botas Boreal Apache Gris 46,5 Gris",Gris,"46,5"
Zapatillas Hi-Tec Forza Low WP Niños 38 Gris/Amarillo,Gris/Amarillo,38
BOTAS CHIRUCA MASSANA 05 GORE-TEX ASFALTO-ROJO 36 Asfalto,Asfalto,36
CHAQUETA SOFT SHELL TREKKING IZAS COPPER HOMBRE NEGRO ROJO M NEGRO/ROJO,Negro/Rojo,M
"ATTIPAS - Attipas calzado los primeros pasos sneakers rosa bebe 21,5 ROSA CLARO",ROSA CLARO,"21,5"
botas salomon x ultra 3 mid gtx hombre castor gray 42 2/3 gris,Gris,42 2/3
botas boreal bulnes 42.5 marron,Marron,42.5
Sandalias Hi-tec Santorini Strap Mujer Taupe 41 Taupe,Taupe,41
pies de gato la sportiva futura mujer jade green-white 36.5 verde/blanco,Verde/Blanco,36.5
"Zapatillas La Sportiva Unika Hombre Negro 41,5 Negro",Negro,"41,5"
Chaqueta de fibras the north face thermoball hoodie hombre gris oscuro s gris oscuro,Gris Oscuro,S
Zapatillas la sportiva akasha hombre ópalo chile 41 azul/rojo,Azul/Rojo,41
Botas Boreal ATLAS MARINO 35.5 Azul Marino,Azul Marino,35.5
Botas salomon x ultra 3 mid gtx hombre sargasso 45 1/3 azul,Azul,45 1/3
Zapatillas La Sportiva Falkon Low 27-35 Gris 31 Gris,Gris,31
BOTAS CHIRUCA TROLL 06 GORE-TEX LILA 29 Lila,Lila,29
BOTAS CHIRUCA DALLAS 05 GORE-TEX NEGRO 46 NEGRO,Negro,46
ATTIPAS - ATTIPAS LOS PRIMEROS PASOS PUZZLE AZUL 20 AZUL,AZUL,20
Pies de gato La Sportiva Solution mujer White-Lily Orange 37.5 Blanco/Naranja,Blanco/Naranja,37.5
Botas La Sportiva Trango Tech Gtx Negro-Amarillo 42.5 Negro/Amarillo,Negro/Amarillo,42.5
"zapatillas la sportiva akasha hombre negro naranja 41,5 negro/naranja",Negro/Naranja,"41,5"
PIES DE GATO LA SPORTIVA KATANA TANGERINE-TROPIC BLUE 43 NARANJA/AZUL,Naranja/Azul,43
Pies de gato La Sportiva Otaki Blue-Flame 38.5 Azul/Naranja,Azul/Naranja,38.5
Pies de gato La Sportiva Mythos Lady 41.5 Blanco,Blanco,41.5
BOTAS BOREAL HURRICANE ANTRACITA 40 ANTRACITA,Antracita,40
Zapatillas boreal futura antracita 39.5 antracita,Antracita,39.5
BOTAS CHIRUCA MONIQUE 09 GORE-TEX GRIS-ROJO 37 Gris/Rojo,Gris/Rojo,37
Camiseta termica hg original 8030 hombre rojo m rojo/negro,Rojo/Negro,M
Camiseta The North Face S/s Kcc Chest Tee Hombre Verde M Verde,Verde,M
SAUCONY JAZZ ORIGINAL VINTAGE AZUL MUJER 39 AZUL,Azul,39
BOTAS CHIRUCA TROLL 06 GORE-TEX LILA 38 Lila,Lila,38
"ZAPATILLAS BOREAL FUTURA VERDE 44,5 VERDE",verde,"44,5"
BOTAS CHIRUCA TROLL 03 GORE-TEX AZUL MARINO 40 Azul Marino,Azul Marino,40
PIES DE GATO LA SPORTIVA SKWAMA BLACK-YELLOW 41.5 NEGRO/AMARILLO,Negro/Amarillo,41.5
Botas boreal tempest mid grafito 42 gris/verde,Gris/Verde,42
Zapatillas saucony excursion tr12 hombre negro azul 46 negro/azul,Negro/Azul,46
"ZAPATILLAS SAUCONY JAZZ TRAIL ORIGINAL HOMBRE PÚRPURA 44,5 PÚRPURA",Púrpura,"44,5"
sudadera trangoworld moneva hombre verde s verde,Verde,S
ZAPATILLAS DE TREKKING MILLET TRIDENT HOMBRE 44 2/3 GRIS/ROJO,Gris/Rojo,44 2/3
Zapatillas boreal alligator women's 42 rojo,Rojo,42
Botas Boreal NELION WOMEN'S 40 Lima,Lima,40
Botas Boreal NELION WOMEN'S 42 Lima,Lima,42
"Attipas - attipas calzado los primeros pasos sneakers azul 21,5 azul",AZUL,"21,5"
ZAPATILLAS SALOMON ULTRA PRO MUJER AZULEJO AZUL 39 1/3 AZUL,Azul,39 1/3
Chaqueta trail running Salomon Bonatti Wp Hombre Azul Naranja S Azul/Naranja,Azul/Naranja,S
Zapatillas trekking salomon cove mujer 36 gris,Gris,36
BOTAS DE MONTAÑA MERRELL AZURA MID WATERPROOF MUJER 37 GRIS/VERDE,Gris/Verde,37
BOTAS CHIRUCA MASSANA 05 GORE-TEX ASFALTO-ROJO 40 Asfalto,Asfalto,40
Botas la sportiva trango guide evo gtx azul 45 azul/rojo,Azul/Rojo,45
BOTAS HI-TEC GREGAL MID WP HOMBRE MARRON 43 MARRON,Marron,43
botas chiruca somiedo 05 gore-tex gris 39 gris,Gris,39
pies de gato la sportiva futura blue-yellow 39.5 azul/amarillo,Azul/Amarillo,39.5
Zapatillas salomon x ultra 3 prime goretex mujer málaga 38 2/3 rosa,Rosa,38 2/3
Sandalias chiruca malibu 07 mujer coral 38 coral,Coral,38
chaqueta de fibras the north face thermoball hoodie hombre gris oscuro s gris oscuro,Gris Oscuro,S
Botas boreal bamba mid marino 41.5 azul marino,Azul Marino,41.5
chaqueta bern trango negro m negro,Negro,M
BOTAS BOREAL TEMPEST MID MARRON 42 MARRON,Marron,42
ZAPATILLAS TRAIL RUNNING SALOMON XA PRO 3D GTX HOMBRE NAVY 46 2/3 NAVY,Navy,46 2/3
Botas hi-tec ravus adventure mid wp hombre chocolate 42 chocolate,Chocolate,42
ZAPATILLAS SALOMON X ULTRA 3 GORETEX HOMBRE CUERDA ELÁSTICA 45 1/3 MARRON,Marron,45 1/3
ATTIPAS - Attipas los primeros pasos puzzle azul 20 AZUL,AZUL,20
PANTALONES TRANGOWORLD KASU FI HOMBRE GRIS M GRIS,Gris,M
Pantalones Breezy Coromell Mujer Negro Phlox XL Negro/Morado,Negro/Morado,XL
"zapatillas trail running la sportiva ultra raptor hombre azul amarillo 45,5 azul/amarillo",Azul/Amarillo,"45,5"
"ZAPATILLAS BOREAL MAGMA GRAFITO 46,5 GRIS OSCURO",Gris Oscuro,"46,5"
Zapatillas Boreal DROM W'S MORADO 41.5 Morado,Morado,41.5
pies de gato la sportiva kataki ocean-sulphur 36 azul/amarillo,Azul/Amarillo,36
CALCETINES RUNNING COMPRESSPORT PRO RACING SOCKS V3.0 ULTRALIGHT HIGH AZUL 42 - 44 AZUL,Azul,42 - 44
zapatillas boreal sendai ws gris 41.5 gris,Gris,41.5
chaqueta running salomon elevate fz mid mujer morado l morado,Morado,L
zapatillas hi-tec razor low wp hombre carbón 46 carbon,Carbon,46
Mallas sontress 1608 mujer negro l negro,Negro,L
zapatillas saucony jazz trail original hombre púrpura 44 púrpura,Púrpura,44
Botas Boreal MALI GRIS 37.5 Gris,Gris,37.5
Botas boreal yucatan gris 44 gris,Gris,44
Botas chiruca boxer boa 12 gore-tex marron 43 marron,Marron,43
botas boreal maipo 42 gris,Gris,42
ZAPATILLAS SALOMON ULTRA PRO MUJER AZULEJO AZUL 39 1/3 AZUL,Azul,39 1/3
Botas Chiruca Troll 01 Goretex Niños Gris Verde 32 Gris/verde,Gris/Verde,32
saucony jazz original vintage mujer granate 37 granate,Granate,37
ZAPATILLAS COLUMBIA PEAKFREAK VENTURE LT HOMBRE CORDOBÉS 43 CHOCOLATE,Chocolate,43
Sudadera the north face drew peak hombre negro gris m negro/gris,Negro/Gris,M
botas senderismo hi-tec riverstone wp hombre gris 41 gris,Gris,41
camiseta interior trx2 wool wm pro trango gris claro-gris oscuro l gris,Gris,L
Zapatillas trail running the north face ultra equity hombre 44 azul,Azul,44
Zapatillas salomon ultra pro hombre naranja azul 46 naranja/azul,Naranja/Azul,46
Zapatillas salomon xa pro 3d mujer azul morado 38 2/3 azul/morado,Azul/Morado,38 2/3
zapatillas salomon x ultra 3 gtx mujer gris 38 2/3 gris,Gris,38 2/3
Botas boreal sherpa 40 marron,Marron,40
botas senderismo hi-tec riverstone wp hombre gris 41 gris,Gris,41
Botas de montaña salomon x alp mid ltr gtx hombre azul 44 2/3 azul,Azul,44 2/3
botas de montaña salomon x alp mid ltr gtx hombre gris 41 1/3 gris,Gris,41 1/3
Pies de gato la sportiva tarentula 40.5 gris,Gris,40.5
zapatillas la sportiva ultra raptor gtx hombre opalo amapola 43.5 azul/rojo,Azul/Rojo,43.5
Zapatillas la sportiva tx4 mujer gris 38 gris,Gris,38
BOTAS BOREAL ASPEN GIRLS 34 GRIS/TURQUESA,Gris/Turquesa,34
CHAQUETA TRAIL RUNNING SALOMON BONATTI WP HOMBRE AZUL GRIS XL AZUL/GRIS,Azul/Gris,XL
pies de gato la sportiva otaki blue-flame 43.5 azul/naranja,Azul/Naranja,43.5
ZAPATILLAS TREKKING SALEWA MS FIRETAIL 3 GTX HOMBRE NEGRO VERDE 45 NEGRO/VERDE,Negro/Verde,45
Zapatillas salomon xa pro 3d mujer azul morado 38 2/3 azul/morado,Azul/Morado,38 2/3
botas la sportiva nepal trek evo gtx antracita-rojo 41 antracita,Antracita,41
BOTAS LA SPORTIVA TRANGO TRK GTX AMARILLO NEGRO 40 AMARILLO/NEGRO,Amarillo/Negro,40
Botas chiruca gredos supra 05 gore-tex gris 37 gris,Gris,37
zapatillas la sportiva lycan hombre negro naranja 41 negro/naranja,Negro/Naranja,41
ATTIPAS - ZAPATOS PRIMEROS PASOS ATTIPAS TIE 20 GRIS,GRIS,20
botas boreal kerala gris 37 gris,Gris,37
ZAPATILLAS BOREAL FLYERS VENT WS 37.5 GRIS,Gris,37.5
ZAPATILLAS LA SPORTIVA ULTRA RAPTOR HOMBRE NEGRO VERDE 44 NEGRO/VERDE,Negro/Verde,44
zapatillas salomon xa pro 3d mujer azul morado 38 2/3 azul/morado,Azul/Morado,38 2/3
botas de montaña salomon x alp mid ltr gtx hombre gris 41 1/3 gris,Gris,41 1/3
"zapatillas montaña columbia redmond hombre marron 41,5 marron",Marron,"41,5"
Zapatillas trail running salomon xa pro 3d gtx hombre navy 44 navy,Navy,44
"ZAPATILLAS SAUCONY JAZZ TRAIL ORIGINAL HOMBRE VERDE 42,5 VERDE",Verde,"42,5"
ZAPATILLAS NIKE TANJUN PREMIUM HOMBRE ROJO 42 ROJO,Rojo,42
Sombrero ternua kliluk taupe s/m taupe,Taupe,S/M
BOTAS CHIRUCA RIGLOS 05 GRIS 34 Gris,Gris,34
"zapatillas boreal magma grafito 46,5 gris oscuro",Gris Oscuro,"46,5"
Zapatillas merrell outmost vent goretex hombre canguro 42 marron,Marron,42
Pies de gato la sportiva futura mujer jade green-white 37 verde/blanco,Verde/Blanco,37
zapatillas boreal glove oliva 45.5 verde oliva,verde oliva,45.5
botas salomon x ultra 3 mid gtx mujer imán 39 1/3 negro,Negro,39 1/3
ZAPATILLAS SALOMON ULTRA PRO HOMBRE CLIMA TORMENTOSO 45 1/3 GRIS/NARANJA,Gris/Naranja,45 1/3
BOTAS SALOMON X ULTRA 3 MID GTX HOMBRE CASTOR GRAY 43 1/3 GRIS,Gris,43 1/3
PIES DE GATO LA SPORTIVA FUTURA BLUE-YELLOW 39.5 AZUL/AMARILLO,Azul/Amarillo,39.5
"Zapatillas New Balance U220 Hombre Azul 46,5 Azul",Azul,"46,5"
Chaqueta trail running Salomon Bonatti Wp Hombre Azul Naranja L Azul/Naranja,Azul/Naranja,L
Botas boreal drom mid grafito 46 gris/verde,Gris/Verde,46
Chaqueta salomon fast wing iii jacket mujer xl morado,Morado,XL
pies de gato la sportiva katana yellow-black 39 amarillo/negro,Amarillo/Negro,39
Zapatillas de trekking millet trident hombre 42 2/3 gris/rojo,Gris/Rojo,42 2/3
Zapatillas boreal glove oliva 42.5 verde oliva,verde oliva,42.5
zapatillas saucony excursion tr12 mujer azul negro 37.5 azul/negro,Azul/Negro,37.5
Botas Boreal TURKANA GRIS 39.5 Gris,Gris,39.5
Pantalones Trekking Salomon Wayfarer Capri Hombre L Kaki,Kaki,L
botas la sportiva trango tech gtx negro-amarillo 40 negro/amarillo,Negro/Amarillo,40
"botas boreal mali 45,5 morado",Morado,"45,5"
Mallas sontress 1609 mujer negro m negro,Negro,M
pies de gato la sportiva genius 43 rojo/amarillo,Rojo/Amarillo,43
Pies de gato La Sportiva Mythos Terra 46 Tierra Oscura,Tierra Oscura,46
Sombrero Trekking Trango World Jonar L Negro,Negro,L
BOTAS BOREAL MALI GRIS 37.5 GRIS,Gris,37.5
zapatillas trekking salewa ms wildfire vent hombre marron 42 marron,Marron,42
IMSEVIMSE - BAÑADOR-PAÑAL IMSEVIMSE CON VOLANTE L ROSA BEACH,Rosa beach,L
ZAPATILLAS SALOMON X ULTRA 3 GTX MUJER TAWNY 37 1/3 ROJO,Rojo,37 1/3
botas chiruca monique 12 gore-tex marron 42 marron,Marron,42
Sandalias Hi-tec Delos Mujer Azul 40 Azul,Azul,40
Zapatillas boreal bamba antracita 39.5 antracita,Antracita,39.5
Pies de gato La Sportiva Solution mujer White-Lily Orange 41 Blanco/Naranja,Blanco/Naranja,41
Camiseta térmica trango world lace hombre m blanco,Blanco,M
ZAPATILLAS LA SPORTIVA TX4 HOMBRE NARANJA 45 NARANJA,Naranja,45
botas chiruca dynamic 05 gore-tex gris-rojo 41 gris/rojo,Gris/Rojo,41
Chaqueta Campagnolo 3E13116 Mujer Grafito Iris 40 Gris,Gris,40
Botas Chiruca Dynamic 52 Gore-tex Marron 47 Marron,Marron,47
Zapatillas La Sportiva Ultra Raptor Goretex Mujer Esmeralda Menta 38 Azul,Azul,38
PIES DE GATO LA SPORTIVA TC PRO 41 CREMA,Crema,41
CHAQUETA MAC IN A SAC MIAS ULTRA NEGRO NARANJA L NEGRO/NARANJA,Negro/Naranja,L
ZAPATILLAS BOREAL FUTURA WS GRIS 42 GRIS,Gris,42
botas la sportiva g2 sm negro amarillo 43 negro/amarillo,Negro/Amarillo,43
Zapatillas new balance gm500 hombre gris plata 42 plata,Plata,42
Pies de gato la sportiva katana mujer white-purple 41 blanco/morado,Blanco/Morado,41
Zapatillas de trekking salomon x ultra 3 hombre azul poseidon 43 1/3 azul,Azul,43 1/3
PIES DE GATO LA SPORTIVA KATAKI MUJER MINT-CORAL 35.5 MENTA,Menta,35.5
"botas la sportiva trango trk gtx carbon 44,5 carbon",Carbon,"44,5"
zapatillas columbia ivo trail hombre negro vapor 44 negro,Negro,44
botas chiruca cares 52 gore-tex marron 42 marron,Marron,42
Zapatillas Salomon X Ultra 3 Gtx Hombre Negro Verde 42 2/3 Negro/verde,Negro/Verde,42 2/3
ZAPATILLAS CHIRUCA MARACAIBO 19 MORADO 37 MORADO,Morado,37
zapatillas salomon ultra pro hombre clima tormentoso 42 gris/naranja,Gris/Naranja,42
CHAQUETA LA SPORTIVA PROMO FLEECE MUJER NEGRO L NEGRO/AMARILLO,Negro/Amarillo,L
ZAPATILLAS LA SPORTIVA AKYRA HOMBRE NARANJA NEGRO 42 NARANJA/NEGRO,Naranja/Negro,42
BOTAS CHIRUCA SOMIEDO 05 GORE-TEX GRIS 44 Gris,Gris,44
zapatillas boreal glove oliva 39.5 verde oliva,verde oliva,39.5
BOTAS BOREAL YUCATAN GRIS 44.5 GRIS,Gris,44.5
BOTAS CHIRUCA SOMIEDO 05 GORE-TEX GRIS 37 GRIS,Gris,37
"ZAPATILLAS LA SPORTIVA LYCAN HOMBRE GRIS VERDE 41,5 GRIS/VERDE",Gris/Verde,"41,5"
Botas de montaña salomon x ultra 3 mid gtx hombre verde amarillo 44 verde/amarillo,Verde/Amarillo,44
Pies de gato la sportiva mythos terra 40 tierra oscura,Tierra Oscura,40
"Zapatillas la sportiva akasha mujer carbón remolacha 37,5 carbon",Carbon,"37,5"
Botas salomon quest 4d 3 gtx hombre negro 44 2/3 negro,Negro,44 2/3
ZAPATILLAS MERRELL OUTMOST VENT GORETEX HOMBRE ROCA 43 ROCA,Roca,43
BOTAS BOREAL FLYERS MID 47 GRIS/AMARILLO,Gris/Amarillo,47
Sandalias Hi-tec Delos Mujer Marron 40 Marron,Marron,40
"ZAPATILLAS LA SPORTIVA AKASHA HOMBRE NEGRO NARANJA 45,5 NEGRO/NARANJA",Negro/Naranja,"45,5"
pies de gato la sportiva futura blue-yellow 36.5 azul/amarillo,Azul/Amarillo,36.5
Botas chiruca berrea hi vis 08 gore-tex marron-naranja 41 marron,Marron,41
botas hi-tec garcia sport wp hombre gris 46 gris,Gris,46
"BOTAS LA SPORTIVA TRANGO TRK GTX CARBON 44,5 CARBON",Carbon,"44,5"
Botas Boreal ZANSKAR FULL GRAIN 40 Marron,Marron,40
zapatillas la sportiva mutant hombre mandarina carbón 43 naranja/gris,Naranja/Gris,43
zapatillas nike downshifter 8 mujer piedra pómez 40 verde,Verde,40
Botas Boreal BAMBA MID WS GRIS 40 Gris,Gris,40
pantalones salomon s-lab short 6 m hombre azul azul m,Azul,M
Botas boreal bamba mid ws gris 37 gris,Gris,37
ZAPATILLAS SALOMON XA PRO 3D GTX MUJER NEGRO VIOLETA 38 2/3 NEGRO/ROSA,Negro/Rosa,38 2/3
zapatillas náuticas salomon cove light mujer 40 gris,Gris,40
Sandalias Chiruca Malibu 05 Mujer Gris Morado 37 Gris,Gris,37
Zapatillas Trail Running Salomon Wings Flyte Goretex Hombre Gris  42 Gris,Gris,42
Zapatillas de trekking salomon x ultra 3 hombre azul poseidon 44 2/3 azul,Azul,44 2/3
CALCETINES TRAIL RUNNING COMPRESSPORT PRO RACING SOCKS V3.0 VERDE 35 - 38 VERDE,Verde,35 - 38
chaqueta de senderismo ternua zixon therm hombre azul marino s azul marino,Azul Marino,S
Pies de gato La Sportiva Katana mujer White-Purple 41 Blanco/Morado,Blanco/Morado,41
Zapatillas new balance am210 hombre blanquecino 46.5 beig,Beig,46.5
Zapatillas New Balance WL574 Mujer Coral 40 Coral,Coral,40
"zapatillas la sportiva lycan hombre negro naranja 43,5 negro/naranja",Negro/Naranja,"43,5"
Botas boreal kovach gris 42.5 gris,Gris,42.5
Chaqueta trail running Salomon Bonatti Wp Hombre Azul Naranja L Azul/Naranja,Azul/Naranja,L
zapatillas new balance kd373 marron 30 marron,Marron,30
Zapatillas la sportiva lycan mujer gris verde 39 gris/verde,Gris/Verde,39
Mallas anticeluliticas sontress 1051 mujer m negro,Negro,M
botas de montaña salomon x ultra 3 mid gtx hombre azul reflecting 44 2/3 azul,Azul,44 2/3
ZAPATILLAS BOREAL BAMBA OLIVA 40 VERDE OLIVA,Verde oliva,40
"Zapatillas saucony xodus iso 3 mujer arándano 38,5 rosa",Rosa,"38,5"
Zapatillas trail running la sportiva akasha hombre negro azufre 41.5 negro/azufre,Negro/Azufre,41.5
Zapatillas trail running la sportiva akasha hombre negro azufre 41.5 negro/azufre,Negro/Azufre,41.5
Zapatillas Boreal Aztec Verde 46 Verde,Verde,46
SANDALIAS CHIRUCA GUAM 02 HOMBRE MARRÓN 42 MARRON,Marron,42
Chaqueta campagnolo hybrid 3e48367 hombre 54 antracita,Antracita,54
Zapatillas nike tanjun se hombre azul 44 azul,Azul,44
